Name,State,Title,Description
"Putnam Cottage","Connecticut","Putnam Cottage","The Putnam Cottage is a red brick home located on Boston Post Road in Greenwich, Connecticut. The home has an interesting historical story. It was built in the 17th century and has changed shape and size over the years. The building features aspects that were unique to the period of history in which it was built, but it has changed over time to reflect various phases in architecture. The history of the house may be best known for its association with General Israel Putnam, but it was likely built for Timothy Knapp and his family. Putnam had a historic escape during the Revolutionary War. The home was purchased by a group of concerned citizens in 1901 and the deed was presented to the Israel Putnam Association a year later. The house became a public museum in 1906, exactly 100 years after Putnam's escape. The name was never officially declared the Putnam Cottage, but over time people just continued to call it that and it eventually stuck. Putnam's association with the house was just a brief part of the home's history, yet it became synonymous with the home. Changes in the home's design began in the 19th century when the ceilings were raised, a porch was added and the windows were changed. It remained basically the same throughout the 20th century. "
"Quassy Amusement Park","Connecticut","Quassy Amusement Park - Middlebury, Connecticut - Family Amusement and Fun Park","Quassy Amusement Park is a family-oriented theme park located on the south shore of Lake Quassapaug in the city of Middlebury, Connecticut. The park itself dates all the way back to 1908 and is of moderate size, featuring a variety of different rides and attractions. Its repertoire also includes a few water-based attractions, including a collection of waterslides and a number of interactive water play activities. An arcade, a scenic picnic area, and a number of food stands and restaurant options are also part of the mix for the convenience and pleasure of patrons. As is the case with most amusement parks, the main draw to Quassy for the majority of park patrons is the collection of thrill rides and attractions. As this is a family-oriented establishment, most of the rides are built to appeal to and be appropriate for the entire family, but there is also a special kiddie section built especially for the youngest visitors as well. Some of the most popular rides in the park could best be described as carnival classics. These include a beautifully painted antique carousel, a tilt-a-whirl, a fun slide, several roller coasters, a bumper car arena, and a swinging pirate ship. However, many visitors also come to enjoy the Big Flush Water Coaster, Quassy's version of an exciting log flume ride, as well as the miniature locomotive among many other options. Those looking to beat the heat and get a little wet won't want to miss Quassy Beach and Quassy's Saturation Station, the interactive water play section of the park. The Saturation Station includes over 30 different ways to enjoy the fun including but not limited to an over-sized bucket that periodically dumps more than 300 gallons of water on the guests below and the Tunnel Twister waterslides. Many guests also enjoy taking a break from all the excitement by taking a dip in Lake Quassapaug itself for a moment or two and then relaxing on the beach for a spell. For the convenience of the guests, the Saturation Station and beach area includes access to lockers and changing areas. Lifeguards are always on duty to protect the safety of the guests as well. Last but definitely not least is Quassy's celebrated family entertainment center. Billed as one of the largest entertainment centers of its type in the entire New England area, Quassy's arcade includes access to more than 100 of everyone's favorite games. These cover all the bases and all tastes from classics like Skee-Ball, Pinball and Pac-Man to all of the latest and greatest arcade favorites. Also included are a number of redemption-based games where park goers can earn tickets that can later be cashed in on terrific and charming prizes. Quassy's Family Entertainment Center also offers reconditioned games for sale to collectors and enthusiasts including pool tables, foosball sets, parts, vending machines, and various video and pinball games. For those that enjoy amusement parks as locations for birthday parties, get-togethers, catered events, and educational excursions, Quassy offers all of these and more as options as well. Anyone interested is encouraged to contact the park directly or visit their official website for a current run-down of rates and packages available."
"Residence Inn Danbury","Connecticut","Residence Inn Danbury","The Residence Inn Danbury is a Marriott hotel located in Danbury, Connecticut. The hotel is close to Danbury Fair Mall, Richter Park Golf Course, The Maritime Aquarium, Charles Ives Center for the Arts, Military Museum, and other Danbury attractions. Residence Inn Danbury offers wired and wireless internet throughout the hotel. There may be a charge, though it is currently unknown.  Free parking is available at this Marriott location. The hotel offers four floors with 78 suites and one meeting room. The entire hotel is smoking free, but pets are allowed. There is a small fee for pets. General amenities at the hotel include a beauty shop nearby that the front desk will book, a buffet breakfast, and a car rental location nearby. Also included in the amenities are coffee in the lobby, evening reception, a grocery shopping service, onsite laundry, newspaper in lobby, and safe deposit boxes. For fitness there is a cardiovascular fitness center which includes a treadmill and universal gym. There is also an indoor swimming pool and hot tub, where towels are provided. This Residence Inn is for long term and short term travelers. The rooms are equipped with full kitchens, and there is no full service restaurant onsite."
"Residence Inn Mystic Groton","Connecticut","Residence Inn Mystic Groton","The Residence Inn Mystic Groton offers accommodations in one of Connecticut's most charming cities. The hotel provides suite accommodations with flat screen televisions, comfortable bedding with pillow top mattresses, full kitchens, and private bathrooms. Some rooms even have in-suite fireplaces. The hotel is just a short distance from the area's best attractions including the Mystic Seaport, the Mystic Aquarium, the Old Mistick Village, the Connecticut Wine Trail and Mystic Pizza. Just a short drive from Mystic, guests can enjoy an evening of gambling at the Sun Casino, the MGM Grand or Foxwoods Casino. Business travelers will enjoy the convenient access to corporate offices like General Dynamics/Electric Boat, Pfizer and the Groton Submarine Base. The hotel offers a variety of amenities including high-speed Internet access in all of the rooms and throughout the hotel, an indoor heated pool, a whirlpool and a complimentary morning breakfast buffet serving classic American favorites each morning of your stay. Guests can also enjoy use of the onsite fitness center featuring free weights, cardiovascular equipment, stationary bikes, treadmills, a SpourtCourt and a Universal machine. The hotel offers ample meeting space in the Waterford Room, a 320 square foot boardroom style space with seating capacity for up to twelve people. "
"Richard Douglass House","Connecticut","Richard Douglass House","Richard Douglass and the Douglass family were a part of the Revolutionary period in American history. The Richard Douglass House is located in Downtown New London on Green Street. It is an official part of the State of Connecticut Register of Historic Places and on the National Register of Historic Places. The home is a Gambrel Cape Style home, built sometime between 1750 and 1820. At the time the home was constructed, New London was a busy maritime town and was home to more than 80 ships. Green and Golden Streets, still popular among tourists, were new communities and home to wealthy working people like the Douglass family. The area began to change a bit during the 19th and 20th centuries, but Green Street remained similar looking to how it was in the beginning of the 1800's. The Douglass house underwent renovation and looks much the same as it did in 1801. It had undergone some faulty modernization and was than abandoned for three decades. The restoration not only brought the home back to its historically significant appearance, it unearthed a .50 caliber musket ball in the yard. It is believed this artillery was used during the Revolutionary War. Visitors to the area can photograph and tour the area and learn about Revolutionary history. "
"Saint Anne's Church","Connecticut","Saint Anne's Church","Saint Anne's Church and the Shrine of Saint Anne for Mothers is located in Waterbury, Connecticut and is a common pilgrimage for Catholics, especially Catholic women. The shrine's mission is to  affirm the dignity of women by celebrating motherhood as a noble and essential part of our Church, society and our world. This is done through the support and promotion of dignity of mothers. Saint Anne was the mother of Mary, who gave birth to Jesus. The church strives to honor all mothers, be they deceased or living, single or those who have suffered the loss of a child. The church offers regular Mass on Sundays at 9:30 am and a Spanish Mass at 12:30 pm. There is also a Tuesday and Friday Mass, a Latin Mass on the first Friday of the month, Benediction on Tuesday mornings and fellowship following Sunday Mass. Fellowship is held in the lower level of the church and snacks and beverages are served. Children are invited to participate in crafts while their parents enjoy fellowship. The church offers an engaged couples' encounter, an effort to prepare young couples for marriage. Vacation Bible camp is held annually and there are English as a second language classes held every Wednesday evening. "
"Saybrook Point Inn & Spa","Connecticut","Saybrook Point Inn & Spa","The Saybrook Point Inn and Spa is located in the historic area of Old Saybrook, Connecticut which overlooks the Long Island Sound. This hotel and spa is only two hours from New York City and provides a comfortable and luxurious lodging accommodation along a beautiful shoreline that has kept guests returning for their vacations and weekend getaways for nearly 130 years. The location of the hotel offers panoramic views of the Long Island Sound and sits at the mouth of the Connecticut River. Due to its scenic location, the hotel has become one of the most popular in the area.  Most of the guest rooms at the Saybrook offer balconies with water views and fireplaces to keep visitors warm and cozy. The hotel features business accommodations including meeting rooms with individual climate control options. An on-site health club provides visitors with both indoor and outdoor swimming pools, fitness and exercise equipment, steam rooms, whirlpool spas, and saunas. A large marina is located at the hotel and features a floating gas dock, room for 200 vessels, and expert staff to assist with boating needs. Guests looking for outdoor and waterfront activities are happy with the accommodations and amenities at this luxurious hotel and spa."
"Scranton Library","Connecticut","Scranton Library","The Scranton Library is located in Madison, Connecticut and offers a variety of literary resources for the community. The building is located on Boston Post Road in downtown Madison. In addition to a large selection of books visitors can enjoy art exhibits, children's programs, computers and a meeting place for community organizations. The helpful staff will assist those who are performing research or searching for a book they are unable to find. Library cards are free with proof of Madison residence and can be used all over the State of Connecticut. In addition to borrowing books with your card, you are also able to use the library's online database from home and search magazine articles, newspapers and a variety of history and science databases. The items at the Scranton Library number over 115,000 and include large print books, bestsellers, magazines, DVDs, newspapers and audio books. Guests can also borrow books from other area libraries through the libraries interstate lending program. There are reference and information services for children, teens and adults at the library, as well as special collections, Madison information, display space, summer reading programs and story time. The library also offers a delivery service for homebound residents of Madison. "
"Seven Angels Theatre","Connecticut","Seven Angels Theatre","The Seven Angels Theatre began in 1990 when a writer's strike in Hollywood brought Semina DeLaurentis to Waterbury. She decided to begin a theater for the community after being asked about helping grow the area's cultural opportunities. The small performance space she chose was located at the Mattatuck Museum and she spread the word to friends and family about her plans. The group of seven people she assembled worked together to create the Seven Angels Theatre. The first performance at Seven Angels was Nunsense, featuring original cast members and professional designers and a musical director and the play was performed to 21 sold out audiences. Semina received encouragement from the community requesting that the performances continue, causing her to officially launch Seven Angels in 1990. In addition to theater performances, Seven Angels offers an Actor's Equity program, enable serious actors to work and gain membership to the group. There are also children's programs enabling children to participate in dramatic and arts education. Programs include Where's That's Comma? and a variety of youth acting courses that expose kids to theater life. The theater moved into its permanent home in 1991 at the Hamilton Park Pavilion. Today, the theater offers comedic performances and hosts special events. "
"Sharon Audubon Center","Connecticut","Sharon Audubon Center","The Sharon Audubon Center offers a place where people can learn about and explore nature in Litchfield. The center was the creation of Clement and Keyo Ford, when they donated their estate to Audubon in 1961. They wanted their Bog Meadow Farm turned into a place where nature could be explored. Audubon Sharon features the Sharon Audubon Center and the Emily Winthrop Miles Wildlife Sanctuary. The mission of Audubon Sharon is to  protect birds, other wildlife and their habitats by creating life-changing experiences that inspire and enable school children, community members and their families to appreciate, understand and protect the natural world. There is a Visitor Center located onsite and a Nature Store that features a variety of souvenir and educational products. The building that houses the center and the store is open year round, but closed on Mondays and holidays. In addition to the center and store, there is a Natural History Museum and Exhibit Room, as well as a Children's Adventure Center and a Research Library. The Exhibit Room features displays on the American Crow, owls, snakes and turtles. The Children's Adventure Center is a great place for kids to learn about reptiles and amphibians, listen to the sounds of nature, feel a raccoon and a opossum, view animal tracks and explore the inside of a model beaver den. "
"Sheffield Island Lighthouse and Nature Trail","Connecticut","Sheffield Island Lighthouse and Nature Trail","Located on the southern end of the Norwalk Islands, the historic Sheffield Island Lighthouse can be seen standing guard on the west entrance of the Norwalk River on northern Long Island Sound. The Norwalk Seaport Association is responsible for maintaining the lighthouse and the surrounding grounds and nature preserve. The lighthouse was first activated in 1968 and is listed on the National Register of Historic Places. After serving faithfully for over 34 years the lighthouse was deactivated in 1902. A ferry system is available to transport visitors from the Association's dock to the lighthouse and area attractions. Upon arriving on the island guests can explore the lighthouse and climb the stairs to the tower. On very clear days the skyline of New York City is visible on the horizon.  There are ten rooms within the structure showcasing period furniture. The other island attraction is the Nature Trail that traverses through the Stewart B. McKinney Wildlife Refuge. The refuge has a large viewing platform where various bird species and other wildlife can be observed. The lighthouse and nature trail are enjoyable, educational, and extremely relaxing for visitors of all ages. Anyone visiting the Norwalk area would be further rewarded with a trip to Sheffield Island. "
"Sherwood Island State Park","Connecticut","Sherwood Island State Park","Sherwood Island State Park is situated along the shore of Long Island Sound in Westport Connecticut. The Park encompasses over 230 acres of beach, wetlands and woodlands. Visitors to the area enjoy a variety of recreational activities including hiking, biking, skiing, swimming, fishing, nature study, bird-watching, flying model planes and kites, picnicking, and just relaxing under the shade trees found throughout the Park. The Nature Center within the Park is closed during the winter months, but offers visitors a number of interesting activities during the spring, summer and fall seasons. Guests are also encouraged to take advantage of the numerous evening lectures. Sunday afternoon lectures and demonstrations are designed with the youngsters in mind.   The Nature Center is closed for the winter now. Sherwood Island State Park is of particular interest to birders. The Orange-crowned Warbler, a very rare species, has been recently been observed within the park creating a flurry of activity for local and regional bird enthusiasts. There are many other more common species that call the park their home. Other birds of many varying types can be seen at different times of the year as they pass through the coastal areas. It is estimated that nearly 300 species of birds can be observed throughout the year. The Park itself is open year-round for outdoor enthusiasts to enjoy the recreational activity of their choice."
"Shubert Performing Arts Center","Connecticut","Shubert Performing Arts Center","The Shubert Performing Arts Center was opened two years after the Shubert Theater was opened in New York City in 1914. The Shubert Brothers brought their love of theater to New Haven and created an ultra modern theater that was loved by the local critics. The theater was a popular place for performers and theater professionals, as well as theater-goers in the community. The theater became a popular place to run shows prior to their debut on Broadway. The location was perfect due to its proximity to New York and the theater was considered one of the best. The surrounding area featured plenty of shops and dining options, further making the location ideal. Since its opening, the theater has hosted more than 600 pre-Broadway performances and tryouts, as well as 300 world premieres and 50 American premieres. In 1976 the theater was targeted for demolition but was saved over the course of a seven year period. It was renovated and reopened in 1983. The theater is again showing pre-Broadway shows. Plans for the future are to continue the growth of the theater and the surrounding area of New Haven. The theater is surrounded by shops, restaurants, cafes and museums. Those involved with Shubert see a bright future ahead for the century-old theater. "
"Slater Memorial Museum","Connecticut","Slater Memorial Museum","The Slater Memorial Museum is currently closed for major renovation until sometime later in 2011. The improvements will feature fresh exhibitions, remodeled galleries, and a modern glass and steel entrance hall allowing universal accessibility. The Museum staff is anxiously waiting the grand re-opening that will be announced in 2011. The current Neo-Romanesque structure was completed in the late 1800's. The Museum is home to a grand collection of American furniture and art exhibits, Native American artifacts, numerous Asian, African and European art displays, in addition to Greek and Roman presentations. The Slater's local collection represents 300 years of Norwich history.  The Museum also houses an extensive unique gun collection. The goal of the Slater Museum is to create an awareness and appreciation of the human experience through art and history. The Museum has put on view and interpreted the works of fine and decorative art for over one hundred years. The works represent a wide collection of global cultures from the continents of the Americas, Asia, Europe, and Africa. Slater Museum is part of the Connecticut Art Trail that encompasses fifteen world-class museums and historic sites. The improvements to the Museum will blend the existing structure with major enhancements that will make it the centerpiece of the Connecticut Art Trail. "
"Sloane-Stanley Museum & Kent Furnace","Connecticut","Sloane-Stanley Museum & Kent Furnace","This unique museum features the works of Eric Sloane and a reconstruction of his art studio. Sloane's career as an artist comes alive in his studio, re-created with his painting easel and rows of jars filled with brushes. On display is a vast compilation of tools used in early America. Near the Museum, visitors can walk the grounds and examine the pioneer cabin built by Sloane to honor the Diary of an Early American Boy: Noah Blake 1805 which he published. While in the museum visitors can see Sloane's collection of hand tools, woodworking items, and farm implements. The collection is quite extensive and plans are in the works to have many of the items remounted. The State of Connecticut owns and operates the Sloane-Stanley Museum and houses an extraordinary collection of Sloane's paintings depicting America of days long gone. His landscapes and painted barns are reminiscent of a reflective time period in our Nation's history. Sloane was also well known for his cloud formation paintings. The background for the planes at the Smithsonian's Air and Space Museum is one of Sloane's famous works.  Guests at the Museum will also want to visit the granite remains of the Kent Iron Furnace. Built in 1826 the blast furnace produced pig iron for nearly 70 years, and its Gothic style arches are located a short distance from the museum. The Museum operates from mid-May through the end of October."
"SoNo Switch Tower Museum","Connecticut","SoNo Switch Tower Museum","The SoNo Switch Tower Museum is a destination that will be enjoyed by those with an interest in history and an interest in railroads. The Switch towers were originally used by the railroad system to control the tracks so there would be no crashing when trains were moving together in the same area. The operator inside of the tower would flip a switch and a train could be moved from one track to another through just that action. The tower has been fully restored to its 1896 condition so visitors can enjoy a tour and being close to the railroads as they used to be. Admission to the museum is free and it is open May through October on Saturdays and Sundays. The museum is seen as small and quirky by visitors. It is located in a revitalized area in Norwalk which is in the southern portion of the city, thus the name SoNO. In addition to the Switch Tower Museum, the area is home to the Norwalk Museum and the Maritime Center. There are also a number of restaurants in the area, making it a great destination for those looking for an afternoon out with the family or a fun date. "
"South Norwalk Historic District (SoNo)","Connecticut","South Norwalk Historic District (SoNo)","South Norwalk is an area that has been revitalized and now brings locals and tourists to the area for dining, entertainment and education. The area is nicknamed SoNo or sometimes just called Downtown. The area is filled with restaurants and lounges, as well as several museums and galleries. It is considered the center of Norwalk's restaurant and nightlife culture. The area is home to the post office, the cinema, several banks, the Maritime Aquarium, the Railroad Switch Museum and the Metro-North Railroad station. It is also where the annual Arts Celebration is held. There are a number of historic features in the area including the Norwalk River Railroad Bridge, the South Main and Washington Streets Historic District, the Haviland and Elizabeth Streets-Hanford Place Historic District and the Beth Israel of Norwalk/Westport building. This building was constructed in 1906 and is considered Moorish Revival in style. It is the only example of a wood frame synagogue in an urban area and is listed on the National Register. It is also the only known synagogue in the state that features Moorish domes. Visitors to the area can spend time touring the museums and enjoying the variety of restaurants available to them. If you are visiting Norwalk, the SoNo district is a great place to find accommodations because it is close to so many of the town's attractions. "
