Name,State,Title,Description
"Fort Griswold Battlefield State Park","Connecticut","Fort Griswold Battlefield State Park","There are numerous Revolutionary War historic sites in the New England area and the Fort Griswold Battlefield State Park is one of them. It is located to the east of the river on Groton Heights and commanded the harbor and area around it. There was a deep trench surrounding the fort on three of its sides and there was a tunnel passage leading to a covered ditch. During the Revolutionary War, the British generals were looking for a way to distract Washington and his army, headed toward the south. They attacked the town of New London and destroyed Rebel pirate ships, leaving the area to Benedict Arnold, formerly of the American forces. The Battle of Groton Heights occurred when 800 British troops landed on the east side of the Thames River. They advanced on Fort Griswold, but were met with gunfire, long spears and hand to hand combat. Forcing their way in, the battle continued for a little less than an hour. There was an attempt to destroy the fort, but it failed. The fort has been the scene of other military preparations during other wars. Today, the site is home to a museum and monument in honor of the men who defended Fort Griswold. Both are open during the summer months on the daily basis from 10 am until 5 pm. "
"Fort Trumbull State Park","Connecticut","Fort Trumbull State Park","The Fort Trumbull State Park welcomes visitors during the summer and early autumn months from Wednesday to Sunday, 9 am until 4 pm. The grounds are open year-round, but the buildings close during the winter and spring. In addition to offering great outdoor surroundings, the park hosts encampments, meetings and other events throughout the season. There are living history events that are popular among children and families who want to learn more about the war torn history of the area. The park features a gift shop where visitors can shop for gifts and memorabilia to take home with them following their visit. Ina additions to great bargains on clothing, coffee cups and logo wear, shoppers can also grab toys and candy. Fort Trumbull played a vital roll during the Revolutionary War and when Benedict Arnold attacked the town of New London, the fighting commenced at the fort. The fort also played a role in the Civil War and served as a Union fort for inducting and training new recruits. Throughout the years the forst has also been home to the U.S. Coast Guard Academy and the U.S. Merchant Marine Officer Training School. During the Cold War, Fort Trumbull was home to the Naval Underwater Sound Laboratory. "
"Fox Hopyard Golf Club","Connecticut","Fox Hopyard Golf Club, East Haddam, Connecticut -A Golf Course Said to Have It All","Fox Hopyard Golf Course was built by the Roger Rulewich Group, whose designers and construction staff have included such legendary names as Robert Trent Jones, Sr. The course is located in East Haddam, Connecticut, adjacent to the Devil's Hopyard State Park, and offers a combination of water, wetlands, meadows, and wildlife. Or, in other words, the course has it all. From the back tees, the course plays to nearly 7,000 yards and a Par 71, with a 74.1 USGA rating and 136 slope rating, which ranks as one of the highest in the state. Fox Hopyard is considered one of the Rulewich Group's most memorable designs, and has been accorded numerous awards and accolades, including: #1 Public Access Course in Connecticut, Golfweek Magazine, March 2002; Top You Can Play'' in New England, New England Journal of Golf 2005; Favorite Clubhouses - Readers Choice, The Best of Northeast Golf 2005; Seventh Best of all Connecticut Courses, Golf Digest 2005; Best Overall Course, Best of Northeast Golf 2007; and Best Conditioned Golf Course, Best of Northeast Golf 2007. The club also boasts an impressive practice and learning facility, designed with an emphasis on real-game'' situations. The main tee features two levels, with more than an acre of teeing ground, and seven finished target greens. There three practice bunkers, for both greenside and fairway bunker shots, two pitching greens, and a 21,000-square-foot putting green. The club also offers a full range of instruction, and includes a separate practice tee area reserved for golf instruction. The staff works with golfers of all levels, from beginners to PGA professionals. When golfers are not playing or working on their games, the Clubhouse is a stately destination. Situated atop a 30-foot rock ledge, the Clubhouse offers a commanding view of the 9th, 15th - 18th holes, as well as the practice area and a five-acre pond. The facility has large, open-air decks, a sports bar, meeting rooms, dining room, as well as a locker room for members. Fox Hopyard also offers an expansive Pro Shop - recognized as one of the best in the nation - with a complete range of equipment, as well as apparel with the club's distinctive Fox'' logo."
"Fox Showroom Theatre","Connecticut","Fox Showroom Theatre","The Fox Showroom Theatre in Mashantucket is located at the Venues of Foxwoods. The area features a variety of dining, entertainment and nightlife opportunities ranging from gaming to shopping to dining. The theatre hosts events, concerts, comedy performances and more. Acts range from music like Carrie Underwood and Third Eye Blind to world-renown comedians and a legends tribute show. Before or after a show at the theatre, guests can enjoy a variety of activities. Nearby is the Atrium Lounge, a quiet place where people can relax and unwind. Other nightlife options include the Hard Rock Café, the Halo Bar, Kahve, the Scorpion Bar and the Paragon. The High Rollers Luxury Lanes and Lounge is a place to enjoy friends and relax in an environment with a fun retro feel. There are bowling alleys right in side of the lounge, which feature hip Las Vegas décor. Guests are treated to 35,000 square feet of space feature 20 bowling lanes, two bars, four billiard tables, a piano lounge, 60 big screen televisions and private party rooms. Also onsite are hotel accommodations, a salon and spa, golf, shopping, a wide range of gambling options and more than 30 restaurants. Those in the Mashantucket area looking for a place that offers a variety of entertainment can enjoy an evening or weekend at the Foxwoods Resort Casino, home to the Fox Showroom Theatre. "
"Foxwoods Casino","Connecticut","Foxwoods Casino - Ledyard, Connecticut - Hotel, Casino, and Resort","Foxwoods is a combination hotel, casino, and resort located in Ledyard, Connecticut. The entire Foxwoods resort covers an astounding 4,700,000 square feet of space. The casino alone covers 340,000 square feet and is currently the largest casino in the entire world when it comes to gambling floor space. It also holds the record for most slot machines of any casino in the world at just over 7,200. Foxwoods also features nearly 400 gaming tables where visitors can play such staples as craps, poker, roulette, and blackjack. A full arcade for kids and teens, close to 1,500 hotel rooms, and several critically acclaimed restaurants are also part of the mix. As is the case with many hotel-casinos, the main draw to Foxwoods for many visitors is the varied and comprehensive selection of gaming options available. Popular games include, but are not limited to the following. Both traditional blackjack and a variation called Spanish 21 are available, each played using 6-8 deck shoes and requiring minimum bets of $10-25 for main gaming areas. Poker of varying stakes - including Texas Hold `Em, Omaha Hold `Em, and seven-card stud - can be played at any time within Foxwoods' special poker room. Both European and American style roulette wheels are popular with a large number of visitors as well. In addition to all these options, Keno drawings, sports betting, craps, and the classic high roller's game baccarat are also big draws. There is even a bingo parlor that holds twice-weekly sessions. Nevertheless, the gaming is hardly the only highlight of a visit to Foxwoods. Its selection of more than 30 restaurants makes it a terrific fine dining destination as well. The options run the gamut from affordable buffets and express food choices to five-star fine dining. Foodies and cuisine lovers come from miles around to visit the AAA Four Diamond rated Paragon, as well as Cedars - a favorite for its use of fresh local poultry and seafood. Also highly popular among guests from all walks of life are the Golden Dragon, the Hard Rock Cafy, Fuddrucker's, Matches Tavern, and California Pizza Kitchen. Live entertainment is also a huge deal at Foxwoods and covers all the bases from championship fights and casual lounges to concerts and theater experiences. Many shows require the purchase of advanced tickets (such as the concerts and theater shows). However, there are also a number of free entertainment options available at Foxwoods as well. These include live performances by a variety of bands at venues like the Hard Rock Cafy and The Scorpion Bar. For teens and children, there is the Tree House Arcade where more than 100 of the world's top video and redemption games can be enjoyed. For visitors looking for still more from their experience at Foxwoods, there is still much more to be seen. Some of these options include rounds of golf on the resort's beautiful Lake of Isles course, a makeover at the in-house spa, an experience at the hotel spa, or an afternoon of shopping at any one of many available retail venues that cover everything from designer clothing and jewelry to souvenirs and t-shirts to remember your trip by once you're home again."
"General William Hart House","Connecticut","General William Hart House","The Hart House is located in the town of Old Saybrook, the first settlement on the southern short of Connecticut and was built in 1767. The house was home to General William Hart and his wife, Esther Buckingham and was one of the earliest homes in the town. The Hart's were a prosperous family, making their fortune from West Indies trading. They frequently entertained and were known in the community for throwing lavish parties. The home was typical for its time and featured a number of Georgian-style features. However, the structure was more the style found in Virginia and Pennsylvania, rather than that found in New England. It is one of three houses in Old Saybrook listed on the National Register of Historic Places and is the only one open to the public. Visitors to the house will notice a variety of unique features including the nine-window façade with twelve over twelve panes. There are also wide corner boats, molded cornices and wide clapboards with a decorative line of beading. The interior of the home features eight corner fireplaces, corner cupboards, Dutch tiles and wide pine boards. The home features four large rooms, each with one of the fireplaces and a kitchen that is a separate structure that was connected to the house years after the original construction. There are four bedrooms, a slaves' room and an attic. The attic was used as a dormitory in the 19th century for a girls' boarding school. "
"Gillette Castle State Park","Connecticut","Gillette Castle State Park","The Gillette Castle State Park is a medieval looking building made of stone with a table track-way, built-in couches and the woodcarvings of William Gillette. It is located on one of the Seven Sisters hills in East Haddam, Connecticut and was owned by Gillette, an actor, playwright and director. The castle sits on an 84 acres estate and features 24 rooms. The castle was purchased by the State of Connecticut in 1943 and since Gillette stated in his will he did not want his home owned by  some blithering saphead who has no conception of where he is or with what surrounded, he would be no doubt pleased with the effort to preserve and share the home and land surrounding it. The castle was built of local fieldstone and supported by steel and it took 20 men five years to complete the construction. There are 47 doors within the castle, no two are alike. Each of the doors has an external latch carved of the wood. The trails surrounding the home follow the three mile long railroad that runs through the property. Gillette had his common walking paths constructed with near-vertical steps, wooded trestles and stone-arched bridges. The grounds are also home to a goldfish pond, a vegetable center and a railroad station. "
"Glebe House Museum","Connecticut","Glebe House Museum","The Glebe House Museum is located in Woodbury, Connecticut and was built in 1750. It features an unusual combination of saltbox roof and gambrel roof styles. The home was the site of a 1771 meeting between John Rutgers Marshall, an Episcopal priest and several Episcopalians who decided to take part in building the new nation without sacrificing their religious beliefs. Following Marshall's ownership of the house, a silversmith occupied the space with his wife and eight children. The home had several other owners before falling into disrepair and facing demolition in the beginning of the 20th century. In 1923, it was restored and became a public museum two years later. Today, visitors are welcome to tour the house and the surrounding Gertrude Jekyll Garden, considered the birthplace of the Episcopal Church in America. The home is located in the Litchfield Hill, an historic area of Woodbury. The house offers a look into the Revolutionary War lifestyle and how the Marshall family lived simply while establishing the church. The house welcomes school and children's groups for tours and educational programs. There are three kinds of tours offered, ranging from a half hour for the general tour to an hour and a half for the in-depth workshop. "
"Golden Age of Trucking Museum","Connecticut","Golden Age of Trucking Museum","The Golden Age of Trucking Museum offers a glimpse into the lifestyle and history of trucking in America. The museum was founded in 1998 by Richard and Frances Guerrera. The Guerreras were the owners of a liquid transportation company that began with one truck and had expanded to more than 120 trucks during the years they were in business. During this time, Richard began collecting and restoring antique trucks, which he would display at local and national vehicle shows and in parades. In addition to a variety of community-minded projects, the Guerreras opened the Golden Age of Trucking Museum, displaying more than 20 of their restored trucks in one place. Though Richard became ill with cancer and died before the official opening of the museum, he was there for the groundbreaking in 1999. The museum opened in 2002 and is located on 16 acres. The Guerrera truck collection is permanently displayed at the museum and there are often temporary trucks displayed through donations. The temporary donations typically last for one year. In addition to the trucks, there are antique boats, antique cars, collectibles, paintings, prints and historic movies. The Interactive Interstate offers a hands-on area for children including books, computers, games, blocks and puzzles. The museum is a population destination for school groups, clubs, senior tours and scout groups. "
"Goodspeed Opera House","Connecticut","Goodspeed Opera House","The Goodspeed Opera House is located in East Haddam, Connecticut and has been in operation since 1959. The theatre has received international acclaim and is dedicated to  the preservation and advancement of musical theatre and the development of new works to add to the repertoire. In addition to performing classic shows, the theatre considers itself at the forefront of shaping the future of musical theatre. In addition to the opera house, Goodspeed develops new musicals and musical artists at the Nora Terris Theatre. Each year the theatre produces three musicals at the opera house. Nineteen of the original productions have moved onto Broadway, wining more than a dozen Tony Awards. The Opera House building was built in 1876 by William Goodspeed and served as his banking and shipping business headquarters. It was also intended to serve as a venue for his love of theatre. The first shows at the theatre was in 1877 and was a performance of Charles II and the farces Box and Cox and Turn Him Out. Following Goodspeed's death, the opera house served as a general store and a storage depot before being restored to a theatre and then dedicated in 1963. The theatre offers group sales and special discounts. Past products have included Annie Get Your Gun, Band Geeks!, Fifth Annual Festival of New Artists, Radio Girl, How to Succeed in Business Without Really Trying and James and the Giant Peach. "
"Goodwin Park","Connecticut","Goodwin Park","The Goodwin Park is located in the town of Hartford, Connecticut and the park offers a variety of recreation, leisure and athletic opportunities for those living in and visiting the area. The park is located on Maple Avenue and is open from dawn until dusk, year-round, seven days a week. Located inside of the park are soccer fields, baseball diamonds, basketball courts, tennis courts and picnic areas. There is a large children's playground where kids can get exercise running, climbing, jumping and crawling on the equipment. There is a pond house, a spray and swimming pool for the warm summer months and a golf course that is open to public play. Food stands are available for purchase at the park, so those interested in picnicking have the choice of packing baskets from home or purchasing food once they arrive at the park. The food options are great for those caught off-guard at the park by hunger or for school and play groups who want to allow children to purchase a small snack during their visit. Each year the park hosts a holiday festival of lights that is popular in the community. Restaurants near the park include the First and Last Tavern, Carbone's Restaurant and Piolin Restaurant. In addition to the park, visitors can enjoy Real Art Ways, a tour of the Cedar Hill Cemetery or a trip to Bushnell Park. "
"Goose Island","Connecticut","Goose Island","Goose Island is located just off the coast of Connecticut, near the town of Old Lyme. The island is visible from the Baldwin Bridge at I-95. The area is a popular destination for birdwatchers and for those who want to explore the New England Coastal areas. Aside from offering natural surroundings for outdoor lovers, the island is not commercialized or populated. Most visitors to Goose Island are making the trip to Old Lyme and spend some time exploring the island, accessible only by boat. Hotels near Goose Island include the Westport Inn, the Best Western Black Rock Inn, the Ramada Inn Stratford, Comfort Suites and the Holiday Inn Bridgeport. Guests visiting the island can enjoy dining in the town of Old Lyme and the surrounding areas at restaurants including the Nauti Dolphin Pizzeria, Osianna and Archi Moore's Bar and Restaurant. In addition to the outdoor recreation on the island, visitors can catch a Bridgeport Bluefish baseball game, visit the Barnum Museum or the Discovery Museum. The town of Old Lyme is home to less than 10,000 permanent residents, but each summer seasonal visitors fill the town. There is a public beach that is popular among visitors and locals, as well as the Florence Griswold Museum, open by the Lyme Art Colony. "
"Greenwich Avenue in Greenwich, CT","Connecticut","Greenwich Avenue in Greenwich, CT - Greenwich, Connecticut - Southern Connecticut Town Maintains Small Town Ambience Just Outside of NYC","Greenwich Avenue in Greenwich, CT, is one of the two main streets that run through the business district in the heart of the downtown area of this 50 square mile town that boasts 32 miles of shoreline. Right on the Avenue in the downtown area, various dining options are available. Italian, French, Indian and even upscale gourmet American food can be found here. Neighboring blocks have additional eating out options. Roughly 40 diverse businesses line this street. Aside from the half a dozen restaurants a wide variety of store and shops are here.  Some of the older local businesses have been forced to close in recent years with the rise of the popularity of Greenwich Avenue and with it the rise of the cost to rent space. This thoroughfare is practically the nerve column of cultural and business activity which is highly influenced by nearby New York City, a 1 hour train ride away, yet the small town, community feel is still alive in at the heart of this 60,000 person village. One of the convenient things about the numerous shops and restaurants on and around Greenwich Avenue is that there is abundant parking available along Greenwich and throughout the business area. Much of the downtown on Greenwich Avenue in Greenwich, CT, is considered a historic district with its Victorian architecture and it is recognized in the National Register of Historic Places The Old Town Hall along this thoroughfare was constructed in 1905, while some of the building on the Avenue and its environs were under construction as early as 1878. Since the late 1980s an annual spring festival for most of May is organized on the Avenue by the Greenwich Arts Council. Greenwich Art to the Avenue, as the festival is named, has over 140 local businesses participating by placing the artwork of local artists in their storefronts. The festival is opened with a carnival like event with jugglers and entertainers swelling the streets. Other cultural events and activities are programmed throughout the month as part of the festival. The Greenwich Art Society is found along this main street through the town. It offers classes and workshops in the arts and also organizes exhibitions at various locations around town as well as on this street. Along this thoroughfare the High School is located. Its auditorium serves as the local concert hall for indoor musical events such as the performances of the Choral Society and the Greenwich Pops Orchestra. Greenwich Avenue in Greenwich, CT, has several apartment buildings in easy walking distance. The cost of living along in the area of this street and in the town as a whole is well above the median in the United States. To the south of the Old Greenwich Avenue District is the rail line and nearby is the commuter train to New York City which many local residents commute on daily to get to an from work."
"Grove Street Cemetery","Connecticut","Grove Street Cemetery","The Grove Street Cemetery was the first charted burial ground in the country. The original burial ground filled after the yellow fever epidemics of 1794 and 1795, so a new cemetery was planned for the edge of town. The first person buried in the Grove Street location was Martha Townsend in 1797. The cemetery is consider an urban cemetery and is built in a geometric pattern that is similar to the nine square pattern of the city. The paths of the cemetery were designed to give horse carriages easy access and today, the paths serve the same purpose for automobiles. There are a variety of well-known names gracing the headstones in the cemetery including Eli Whitney, Roger Sherman, Walter Camp, Mary A. Goodman, Roger Sherman Baldwin, O.C. Marsh, Josiah Willard Gibbs, Jr., Lyman Beecher and Jedidiah Morse. The cemetery offers an educational program, arranged by a charitable group who felt it important to help people understand the history of Grove Street. This groups seeks to  preserve a monument of the moral sentiments, the good taste and the liberality of the present generation. The cemetery is sometimes called the Westminster of Yale and features several historic structures in the nearby area. It is one of 60 National Historic Landmarks in the state and the ninth in New Haven. "
"Haight Vineyard","Connecticut","Haight Vineyard","The Haight-Brown Vineyard is located on Chestnut Hill in Litchfield, situated on ten acres of land. The winery opened in 1973 and was Connecticut's first official winery. The winery products a variety of reds, whites and fruit wines and takes pride in being part of the state's ever-growing wine region. Each year the vineyard grows between 45 and 50 tons of grapes. The collection of wines include Merlots, Chardonnays, Rieslings, Nouveau Foch, Strawberry Bliss, Honey Nut Apple, Apple Crannie, Morning Harvest, Spring Fling, Harmony, Big Red, Rapture and Picnic Red. The winery hosts seasonal events throughout the year including a barrel tasting in April, a festival in June and a fall harvest in September. The winery is the founding member of the Connecticut Wine Trail, a path leading through the state that connects travelers to the best wineries. The winery features a salesroom that offers tasting and bottled wines to take home. There is also space available for hosting private events in the Cask Room, the Vine Room, the Main Wine Bar or the Veranda. Capacity for priavet events is 150 people. The winery is willing to bottle wines and create personalized labels for special events like wedding receptions, birthday parties and corporate celebrations. "
