Name,State,Title,Description
"Marriott Mystic Hotel and Spa in Groton, CT is a Premiere Destination","Connecticut","Marriott Mystic Hotel and Spa in Groton, CT is a Premiere Destination","	A winner of the AAA Four-Diamond award, the Marriott Mystic Hotel and Spa in Groton, Connecticut, near Mystic Seaport, Foxwoods Casino, and Mohegan Sun, is an upscale lodging destination that offers a variety of amenities in a posh yet comfortable setting. The smoke-free Mystic Marriott is a six story structure that boasts 281 rooms and four luxury suites. This sprawling property also includes 21 meeting rooms and more than 20,000 square feet of event space for business functions and private special events such as parties and weddings. The guest rooms at this resort are posh and spacious, featuring Marriott's signature Revive bed, high thread-count linens, down comforters and pillows, marble bathrooms with jetted tubs, separate tub and shower, terry bathrobes, and internet access. Concierge Level rooms offer upgraded amenities and guests in those rooms are treated to evening hors d'oeuvres in the central lounge. Onsite recreation includes an indoor pool and hot tub and a fitness center featuring cardiovascular equipment and free weights. Numerous other recreational opportunities are available within just a short drive of the Marriott Mystic Hotel and Spa. Groton and the surrounding areas are ripe with leisure time activities. Guests and their families may visit Mystic Seaport, Mystic Aquarium, the nearby Children's Museum of Southeastern Connecticut, and The Dinosaur Place, where visitors can explore life-size models of prehistoric creatures. In addition, several golf courses, mini golf, tennis, hiking trails, and kayaking opportunities are all close by as well. Also inside the Marriot Mystic Hotel is a famed Elizabeth Arden Red Door Spa. Red Door Spas are among the most well-known in the nation and provide top-notch services using quality Elizabeth Arden skincare and hair care products. The spa offers a variety of services by appointment only, including various kinds of facials, body wraps, body scrubs, massages, paraffin hand and foot treatments, therapy baths, waxing, manicures, and pedicures. There are also several steam rooms inside the spa for use before or after treatments and the spa also includes a lap pool for those who wish to swim for exercise or pleasure. The spa is nicely decorated in Arden's signature red color with minimalist furnishings and the utmost attention to cleanliness. Therapists are highly trained in their field. For dining, guests can visit the onsite Octagon Restaurant and Lounge. The restaurant is best known for its succulent steaks but also serves a hearty breakfast. The lounge, which offers a more casual setting and lighter fare, is open for both lunch and dinner. Countless other restaurants are available within just a few miles of the hotel, including famous Mystic Pizza. Marriott Mystic Hotel and Spa generally offers deals that combine a stay at the resort with tickets to a nearby attraction such as the aquarium or seaport, especially during the summer season. In addition, guests may book Girls' Getaway weekends or couples packages that combine a stay at the hotel with a variety of spa services. Other packages include a visit to southeastern Connecticut's growing wine country."
"Marriott Stamford Hotel and Spa","Connecticut","Marriott Stamford Hotel and Spa","The Marriott Stamford Hotel and Spa offers accommodations close to New York City but featuring the New England charm Connecticut travelers expect. Guestrooms at the hotel feature flat panel televisions, comfortable furniture and bedding with mattress toppers, duvets and 300-thread count linens, high-speed Internet access and newly renovated bathrooms. The Marriott is completely smoke free. The hotel is home to Sam's American Bistro, offering onsite dining in a casual environment with a menu of American Regional foods. The restaurant is open for breakfast, lunch and dinner. The Northern Lights Bar and Lounge offers a lunch menu of bar foods and small plate dining for dinner and features a variety of cocktails and wines. Guests of the hotel have access to the Agora Spa, featuring a variety of skin and body treatments like waxing, massages and facials. The hotel offers fitness center complete with cardiovascular equipment, free weights and Universal equipment, as well as a heated indoor pool and seasonal outdoor heated pool. The hotel is close to a variety of Stamford area attractions including the Stamford Town Center, the Norwalk Maritime Aquarium, the Beardsley Zoological Garden, the Stamford Museum and Nature Center, the Rich Forum and the Stamford Center for the Arts. "
"Martha's Herbary","Connecticut","Martha's Herbary","Martha's Herbary provides gardeners and lovers of a nature a place to celebrate their gardens. It is located year-round and is a family owned business. The herbary is more than just a garden shop and offers herb gardens, a sunken medicinal garden and raised culinary beds. The shop is filled with essential oils, bath soaps, salts, candles and potpourri, all made from the herbary's freshly harvested herbs. In addition to the herb items, there is a collection of garden-inspired jewelry from all over the world, clothing pieces made with natural fibers, garden-related gifts, books and of course, plants, topiaries and herbs. The herbary is located in downtown Pomfret, just under an hour from Providence. Surprising to many is that the herbary is open year-round and offers special events throughout the year. It is a great destination for chasing away the winter blues. The winter gardens are often blanketed in snow, but there is a feeling of hope in the air as friends and customers gather to discuss the coming growing season. The shop is filled with a variety of health and beauty products that are natural and helpful. Browsing the shop is a treat for all five senses and visitors can smell, see, taste, touch and hear the delight of the garden whether it is winter, spring, summer or fall. "
"Mashantucket Pequot Museum and Research Center","Connecticut","Mashantucket Pequot Museum and Research Center","The Mashantucket Pequot Museum and Research Center provides a chance for people of all ages to learn more about the lives and customs of the native people of the area. The museum feature life-size walk-through dioramas that enable visitors to feel as if they are a part of history. There are also changing exhibits and live performances. The permanent collection depicts more than 18,000 years of Native and natural history. The museum also features two libraries, one specifically designed for children. There is a variety of research materials onsite concerning the history of native people in North America. The museum and research center are both tribally owned and operated. It opened in 1998 and offers 85,000 square feet worth of indoor exhibit space. The permanent collection includes the dioramas, interactive computer programs, text panels and a series of films. Exhibits in this collection include The Glacial Crevasse, the Manshantucket Pequot Tribal Nation/ A Tribal Portrait, the Arrival of the People, A World of Ice, the Changing Environment, Life in a Cold Climate, the Pequot Village, Prelude to War, the Arrival of the Europeans, the Pequot War and Life on the Reservation. There is also a recreation of a farmstead house from 1780 that features naturalistic figures of a family from that period. "
"Mattatuck Museum Arts and History Center","Connecticut","Mattatuck Museum Arts and History Center","The Mattatuck Museum Arts and History Center is located in Waterbury, Connecticut and was established by the town's historical society in 1877. The purpose of the center was to preserve the history of that area of the state. The Mattatuck region is made up of ten towns surrounding Waterbury. The center was accredited by the American Association of Museums in 1976, making it one of the first in the state to receive such an honor. Known for engaging the community in understanding the history of the area, the center features a variety of exhibits and collections of national significance. The mission of the center is to provide the  community with professional scholarship, preservation, and historical programming about our heritage, stimulates the interest in the fine and decorative arts of Connecticut by showcasing their highest quality and expression, and encourages an appreciation of the humanities and the fine arts through its collections, exhibits and programs. The collection includes watercolors, paintings, drawings, etchings, prints and sculptural pieces. Artists represented in the collection include William Jennys, John Trumbull, Frederick Church, John Kensett, John Ferguson Weir, Charles Ethan Porter, Anni and Josef Albers, Milton Avery, Cleve Gray, Abe Ajay, Hans Richter, Peter Poskas and Kay Sage. "
"MGM Grand at Foxwoods","Connecticut","MGM Grand at Foxwoods","A luxury resort casino in Mashantucket, CT, the MGM Grand at Foxwoods boasts a four-diamond rating by the AAA and a wide variety of entertainment options.  The Deluxe rooms and Producer and Director Suites at the MGM Grand at Foxwoods offer amenities such as 300 thread count Monaco imported bedding, luxury pillow-top beds, mini bars, iHomes, flat-screen TVs, marble showers (with Rainfall fixtures) and vanities, and Pascal Morabito French toiletries. Many of the rooms also offer views of the 2,000 acres of forest nearby. Guests can enjoy the 50,000 square feet of casino space, including slots, table games, and dream card. The MGM Grand at Foxwoods also features an array of dining choices from gourmet to casual. The 4,000-seat Grand Theatre hosts many notable performers in a Las Vegas-style showcase. Business travelers can take advantage of the impressive 115,000 square feet of flexible meeting space. In addition, guests can shop in a variety of upscale retail shops on site, lounge by the pool, relax at G Spa, or play golf. By car, the MGM Grand at Foxwoods is located about 45 minutes southeast of Hartford, CT near the Connecticut River. The hotel and casino is located close to tourist sites, such as Mashantucket Pequot Museum, Mystic Seaport and Aquarium, Submarine Force Library Museum, and numerous parks."
"MGM Grand Theater at Foxwoods","Connecticut","MGM Grand Theater at Foxwoods","The MGM Grand Theater at Foxwoods is inside of the MGM Grand Casino, located in Mashantucket, Connecticut. The theater offers a variety of live performances including musical concerts, comedy performances and family-friendly acts attendees of all ages can enjoy. The theater regularly hosts world-renowned acts and occasionally features performances of off-Broadway shows. Past musical acts have include the B-52's, Robert Plant, Enrico Iglesias and Huey Lewis and the News. The theater is similar in style to many of the grand theaters inside of Las Vegas casinos and the resort has gone to great lengths to bring that caliber of entertainment to the East Coast. Nearby is The Shrine, a nightclub experience also similar to what you would find in Vegas. The club and restaurant offer Modern Asian cuisine, bottle service and attendance by some of the hottest names in entertainment. Their lineup has included Carmen Electra, Diddy, Jenny McCarthy and Brett Favre. The club features a DJ booth, multiple bars, 35 private VIP tables and one of the best loved dance floors in the area. In addition to the theater and the club, the resort features a spa, a pool with cabanas, several restaurants and a casino. Guests can stay overnight in accommodations that feature 300 thread count linens, pillow topped beds, 24-hour staff and private, luxurious bathrooms. "
"Military Museum of Southern New England","Connecticut","Military Museum of Southern New England","The Military Museum of Southern New England is a non-profit organization that opened its doors to the public in 1995.  The mission of the museum is to preserve our nation's military history. The museum staff is composed primarily of volunteers who design and maintain the exhibits, operate the gift shop, and assist visitors. The museum was originally designed to sustain the memory of American Tank Destroyer units that served during World War II. Since its inception the number of military artifacts has grown beyond 10,000. The items within this relatively small structure represent objects from all branches of the military. There is a display that features the story of the famous 10th Mountain Division. This exhibit tells of the 10th fighting in the Italian mountains in WWII. It also pays tribute to the present division based out of nearby Fort Drum which was reactivated in 1986 and served in the Persian Gulf and other modern day conflicts. The museum is a great place for military enthusiasts to visit. Once a month from April through October the museum allows access to many of the tanks and armored vehicles parked on the lot. There is a nice gift shop that has replica tanks and other military related items "
"Mill Woods Park","Connecticut","Mill Woods Park","The Mill Woods Park is a popular outdoor destination for the residents of Wethersfield, Connecticut.   The Wethersfield Dog Park is located inside of the Mill Woods Park and is one of the most popular reasons residents of the area visit the park. The park is the work of several dog loving citizens that decided they wanted a place where their dogs could enjoy an off-leash experience in a safe environment. The dog park opened in the fall of 2006. The mission of the dog park is to help dogs and people stay healthy and enjoy an outdoor environment. There is a small and large dog area at the park and visitors also enjoy access to picnic benches, bags for scooping, trash receptacles, water stations and message boards. Since many dogs are experiencing off-leash outdoor play for the first time, it is important that they be closely monitored. They can become overwhelmed and need to be leashed again until they calm down. Help your dog socialize by staying close to them until they have grown used to the freedom and the exposure to other dogs. In addition to the dog park, Mill Woods is also home to the Wethersfield Nature Center. This is an environmental education facility that aims to share and explore the natural world with visitors. The center is considered hands-on and minds-on and features a variety of education displays. Visitors also get to see mammals, birds, reptiles and a variety of other live animals. The Owl's Nest gift store is a great place to get some education material or take home a souvenir."
"Miss Porter's School","Connecticut","Miss Porter's School","Miss Porter's School in Farmington, Connecticut is a private school for young women. The school opened in 1843 with 25 students, but grew rapidly, drawing students from the Mid-Atlantic and Midwest states. The school was a project of Sarah Porter, daughter of the minister from the Congregational Church and sister to one of Yale University's presidents. She spoke four languages, teaching herself Hebrew late in her life. She emphasized traditional values at her school and wanted women to have an opportunity to gain an education equal to what was available to men during her era. She believed that schools should be similar to homes and wanted to prepare students to run households, as well as learn about the world around them. Women attending the school learned French, Latin and German, trigonometry, history, geography, reading, spelling and arithmetic, as well as physiology, botany, chemistry, astronomy, geology and the arts. Women attending the school were not permitted to wear the paralyzing fashions of the time and instead were encouraged to engage in physical movement and wear clothing that allowed this. Sarah Porter's history is alive and well at the school today and can be studied in the letters, documents, records and memorabilia onsite. The school offers 110 classes with an average class size of 11 students. There are boarding and day school options and students can participate in a wide variety of extracurricular activities and sports. "
"Mohegan Sun","Connecticut","Mohegan Sun","The Mohegan Sun is located along Mohegan Sun Blvd in Uncasville, Connecticut and is a large gaming casino resort owned by the Mohegan Tribe. The casino is one of the largest gaming resorts, entertainment venues, and shopping destinations in the United States and offers so many activities that guests of the Mohegan Sun will never tire or grow bored. The resort is situated among 240 acres on the Thames River in southeastern Connecticut. Its location is conveniently situated with access to New York, Hartford, and Boston.  The casino resort offers a wide variety of playing options including over 7,000 slot machines, a 42 table poker room, and much more. The 34 story high rise offers a luxury hotel and guestrooms to its patrons. There are a total of 1,200 guest rooms and suites, prime business and meeting space, and a world renowned spa for pampering. The venue is one of the top ten travel destinations for adults and families in Connecticut. Visitors from all over the world travel to Mohegan Sun for its gaming opportunities. The resort is also conveniently located near many popular museums, antique stores, and the Mystic Country waterfront. A wide number of attractions nearby draw crowds from all over the state."
"Mohegan Sun Arena","Connecticut","Mohegan Sun Arena","The Mohegan Sun Arena is located at the Mohegan Sun Casino. The arena features 10,000 seats and hosts concerts and sporting events on the year-round basis. It is located in Uncasville, Connecticut, just a short distance from a variety of hotels, restaurants and corporate offices. The arena has hosted such world renowned acts as Billy Joel, Kenny Chesney, Britney Spears and Fleetwood Mac. There have also been a variety of sports entertainment programs at the arena including WWE wrestling events, professional basketball games and championship boxing. The arena offers a venue for those looking to entertain or educate at public and private events. It is one of the most exclusive venues in New England. There are staff on duty to help you organize your event and catering services are available onsite. Suites at the arena are capable of hosting 25 to 100 people and offer excellent views of anything occurring in the arena. The arena is just steps from the casino, created by the Mohegan Tribe of Connecticut and opened in 1996. In addition to gambling, the resort offers a day spa, convention and meeting facilities, restaurants and a variety of gaming. Guests are treated to features such as a 55 foot waterfall, an indoor planetarium, a Wombi rock and a glowing crystal mountain. "
"Mohegan Sun Arena Uncasville, Connecticut","Connecticut","Mohegan Sun Arena Uncasville, Connecticut","The Mohegan Sun Arena is part of the Mohegan Sun Resort and Casino complex. It was opened in 2001 by the Mohegan Tribe and is situated in Uncasville, Connecticut. It is home to the Connecticut Sun, a WNBA team and was home briefly to the Mohegan Wolves and arena football team. When the arena is used for basketball games they can seat around ninety five hundred people. Concerts have room for twelve thousand. Although the Mohegan Sun Arena is attached to the Mohegan Sun Casino no sports betting is allowed. More than sporting events have been held in the arena. The American Kennel Club's Challenge Dog Show has used the facility. Many well known artists have performed at this venue such as; Andrea Bocelli, Kelly Clarkson, Mariah Carey, The Eagles, Shakira, Bon Jovi, Brooks and Dunn, Bette Midler, Jimmy Buffett, Sting, The Who, Nine Inch Nails, and Simon and Garfunkel. The WWE, Professional Bull Riding events, NCAA games, and PBA tournaments have taken place at Mohegan Sun Arena. All of the major television networks have produced events at the arena. Upcoming events will include the Connecticut Sun games, Chickenfoot, Jamie Foxx, Taylor Swift, Counting Crows, Carlos Mencia and Frank Valli and The Four Seasons. Musical artists like Journey, King of Leon, Kelly Clarkson, Brad Paisley, and the Jonas Brothers will be joined by the comedy of Howie Mandel and Robin Williams. There is a box office located in the Spring Gateway. It is open from 10:00 am to 8:00 pm daily. Tickets can also be purchased through Ticketmaster, online, or at Ticketmaster outlets. Casino guests can use their Players Club points to purchase tickets if they wish. Patrons attending events at the Mohegan Sun Arena can stay at the Mohegan Sun Resort. They offer 1,200 luxury rooms or suites. The rooms will have a king sized bed or two double queens. The rooms have relaxing lounge chairs as well as large marble bathrooms. There is a spa, fitness center and swimming pool to relax in. A golf course is available for guests at Mohegan Sun at Pautipaug. Children enjoy staying at Mohegan Sun Resort because they have their own Kids Quest area. They can play in Barbieland, Construction Quarry or Techno Quest. The center is located at The Shops at Mohegan Sun. There are licensed child care professionals on hand to watch children as young as six months. The hours of operation vary depending on the day of the week and reservations are recommended. The cost for children six months to twenty nine months is $9.00 per hour, 30 months to 12 years is $9.50 per hour. Nutritious meals are available for $6.00. There are many restaurants located at the Mohegan Sun from casual dining to desserts. Fast food from Johnny Rockets or fine dining and buffets will round out the selection of food at the resort. Shopping at The Shops at Mohegan Sun is something that can be done before the event at the Mohegan Sun Arena. There is apparel, sporting goods, jewelry, sun products, music, electronics and specialty stores."
"Mohegan Sun Casino","Connecticut","Mohegan Sun Casino - Uncasville, Connecticut - Large-Scale Casino and Resort","Mohegan Sun is a large-scale resort casino located in Uncasville, Connecticut. It is currently the second largest casino in the entire world at an astonishing 364,000 square feet. The resort grounds on the whole cover approximately 240 acres and are located along the Thames River. Mohegan Sun is also very well placed right in the middle of the beautiful foothills of Connecticut's southeastern area, as this area is responsible for 60% of the entire state's tourism. The dycor and atmosphere of Mohegan Sun was designed to have a distinctly Native American feel. Not only does the structural look and feel of the resort keep to this theme, but so do the paintings and decorative touches that decorate the casino. One of the most notable of these is a 55-foot indoor waterfall known as Taughannick Falls, designed to commemorate a treacherous crossing of the tribe. Mechanical animated wolves that actually howl can also be seen in the gaming area. The main draw to Mohegan Sun for many visitors is the extensive selection of gaming options to be found within. These include but are not limited to blackjack, poker roulette, craps, keno, slot machines, and baccarat. A race book that offers access to live greyhound and horse racing events from all over the United States (as well as England and Australia) is also part of the mix. Live entertainment is a huge part of the repertoire at Mohegan Sun as well. The resort has been host to major music and comedy acts for many years. Although those interested should contact Mohegan Sun directly for a current list of scheduled performers, past performers have included musical acts like Rob Thomas and Taking Back Sunday, as well as major comedians like Larry the Cable Guy and Robin Williams. Food enthusiasts will find that Mohegan Sun has something to offer them as well, as it's one of the most popular fine dining destinations in all of Connecticut. Some of the top picks include but are not limited to the following. The Bamboo Forest offers authentic five-star Chinese cuisine in an inviting Far Eastern atmosphere. Pompeii & Caesar is a gourmet Italian restaurant that serves everything from Chilean Sea Bass, to Marsala, to Veal Scaloppine. Todd English's Tuscany offers delicious rustic Tuscan fare in a charming old world setting. For those that enjoy being pampered and taken care of, Mohegan Sun has a variety of soothing and exotic signature treatments to offer at the Elemis Spa. Guests have their choice of several rejuvenating facials, stress relief regimens, detox routines, and massages. Then they have the option to take health and wellness to the next level by visiting the Mohegan Fitness Center for personal training and body composition analysis. Last, but not least is Mohegan Sun's extensive collection of retail venues. From high end designer boutiques to casual souvenir shops, there is something for everyone. Mohegan Sun also is capable of hosting get-togethers, meetings, and parties with its collection of ballrooms and meeting rooms. Also available are the Mohegan Sun Arena, a configurable exhibition space that measure 30,000 square feet and is capable of seating up to 10,000 people; the Wolf Den, the same stage that hosts the resort's top acts can also be used as a platform for high-impact presentations; and the Cabaret Theater, the perfect choice for group meetings that involve 350 people or more. Those interested are invited to contact the resort directly for current information as to availability and rates."
