Name,State,Title,Description
"Stratosphere Tower","Nevada","Stratosphere Tower - Las Vegas, Nevada - Landmark Tower Portion of the Stratosphere Hotel and Casino","The Stratosphere Tower is the landmark tower portion of the world famous Stratosphere hotel and casino located in the city of Las Vegas, Nevada. It is the tallest free-standing structure in the entire state of Nevada. It is also currently the tallest free-standing tower in America, as well as the second-tallest in the entire Western Hemisphere. Available within the tower itself are two observation decks, a revolving fine dining establishment called Top of the World, and three thrill rides. The hotel portion of the Stratosphere is actually located in a separate building structure as opposed to within the tower itself. As Las Vegas begins to establish itself more and more as a fine dining destination, the Top of the World restaurant has become one of Stratosphere Tower's biggest draws. It is located more than 800 feet above the city and the restaurant itself slowly revolves at a rate of 360 degrees every 80 minutes to offer diners a breath-taking panoramic view of the city from above as they enjoy their meals. Top of the World is billed as a fine dining establishment and has been the recipient of much recognition over the years from respected publications such as Sante and Wine Spectator. It was even named Best Gourmet Room'' by the Las Vegas Review-Journal. The other huge draw to Stratosphere Tower is the selection of state-of-the-art thrill rides available to visitors. Currently there are three to choose from with all of them taking advantage of Stratosphere Tower's considerable height to treat passengers to incredible views of the city from above while treating them to heart-pounding thrills at the same time. The first of these is known as Insanity the Ride. An experience on Insanity extends riders over the edge of the tower via a huge mechanical arm. The ride then spins the riders at speeds up to three G's, tilting this way and that all while suspended at a height of more than 900 feet above the ground. Insanity the Ride is insanely popular not only for the exhilarating experience it offers riders, but also for the unique way it offers them to view Las Vegas at its best. The next of the three thrill rides is X-Scream. X-Scream is described as a giant see-saw that operates while riders are suspended 866 feet above the ground. An experience on X-Scream begins with propulsion over the edge of Stratosphere Tower. After dangling for a while, riders are then pulled back up and then propelled over the edge again. Last but not least is the Big Shot. The Big Shot shoots up to 16 riders at time from the Stratosphere's 921-foot platform and up the tower's mast to heights reaching 1,081 feet before bringing them back down again. The sequence then repeats and continues at forces of up to 4 G's on the way up, as well as treats riders to an exhilarating negative G experience on the way down. Riders' legs dangle free throughout the ride as they are treated to a unique and thrilling view of Las Vegas from above. Admission to Stratosphere Tower must be purchased, as well as separate tickets to each of the individual thrill rides. However, Stratosphere does offer several package deals for those planning on experiencing several of the tower attractions during their stay. Reservations at Top of the World are required for dinner and strongly recommended for lunch."
"Summit Trail","Nevada","Summit Trail","Of the twelve developed trails within the Great Basin National Park, Summit Trail reaches the highest elevation, taking hikers all the way to the top of Mount Wheeler. At 13,063 feet, this is the tallest peak within the park and the trail offers excellent views of the Snake Range and the Great Basin all along the way.  Located at an elevation of about 10,000 feet, the preferred trailhead is well signed and easy to find. It can be reached by following Wheeler Peak Scenic Drive toward the Wheeler Peak Campground. The trailhead is about a mile before the campground turnoff and ample parking is available. From here, the trail rises steadily for nearly five miles, resulting in a gain of almost 3,000 feet and making this a strenuous climb for inexperienced hikers. The altitude and thin air can present problems, too, and afternoon storms are common in the vicinity. The ascent can require as much as four hours and is best undertaken in the morning. The round-trip journey covers about 8.2 miles, starting with a forested segment. Colorful alpine wildflowers can be seen along the way and even on the summit. Also look for glacial remains, ancient bristlecone pine trees, and plenty of Engelmann spruce, which is indigenous to this area."
"Sun Mountain","Nevada","Sun Mountain","The Las Vegas Paiute Golf Resort has three 18-hole courses designed by Pete Dye, and Sun Mountain (aka Tav-ai-Kaiv), the middle one, is considered the tamest. It plays 7,112 yards from the back tees for a par 72 finish. Featured here are some unexpected slope changes as the indigenous landscaping of the course winds through the desert, backed by the beauty of the Spring Mountain Range.  At the 50,000-square-foot clubhouse, a pro shop offers fine equipment and apparel, including such famous brand names as Greg Norman, Fairway & Greene, Titleist, Adidas, Ashworth, Nike Golf, and more. There is a 3,800-square-foot restaurant and lounge with a fireplace area for relaxing. It is open for lunch, 10am to 5pm daily, and for breakfast on Friday through Saturday from 7am till noon. A separate tobacco room is available for cigar smokers. Two excellent practice facilities can also be found here. Each of them has a driving range, a practice putting green, and a pitching and chipping area. Lessons are provided for players of all skill levels by dedicated PGA professionals. Sun Mountain is located at the Las Vegas Paiute Golf Resort, 10325 Nu-Wav Kaiv Boulevard, Las Vegas, Nevada 89124. It is northwest of Las Vegas off U.S. Highway 95."
"Sunridge Golf Club","Nevada","Sunridge Golf Club","Designed by Bill Wellman in 1997, the Sunridge Golf Club features an 18-hole regulation-length golf course with a championship layout and five sets of tee boxes. It plays 6,914 yards from the Gold tees for a par of 72, and its slope is rated at 137.  As a public resort and community golf course, the Sunridge can be enjoyed by golfers of all levels of skill, and several local charities are supported through tournaments played here. Lessons and club fittings can be arranged by the staff. The course has a separate driving range available for practice, too. The clubhouse at the Sunridge Golf Club has a bar and restaurant with full menu service. Ice cold Pabst Blue Ribbon and Alaskan Amber beers are served on tap. Inexpensive lunch specials, such as a ham and turkey sandwich with chips and a fountain drink for $5.75, are offered daily. The Sunridge Golf Club is located southeast of downtown Carson City at 1000 Long Drive, Carson City, Nevada 89705-6023. Green fees average around $40~$50, with discounts for seniors and during twilight hours. One frequent promotion here is the Fearsome Foursome Golf Special. It offers 18 holes of primetime golf for groups of four persons, priced at $120, inclusive."
"Sunrise Vista Golf Course","Nevada","Sunrise Vista Golf Course","Sunrise Vista Golf Course is situated in the northeast part of the Las Vegas Valley, an area known as Sunrise Manor. As a golf facility fully owned and operated by Nellis Air Force Base (AFB), the home of the world-famous Thunderbird aerial squadron, tee times can be booked only by military personnel and their guests; the general public must wait to play on a stand-by basis.  Sunrise Vista Golf Course offers 27 holes of golf in three 9-hole layouts. The Eagle course opened in 1962, designed by Ted Robinson, Sr. It plays 7,051 yards from the back tees when combined with the Falcon course or 6,913 yards with the Phantom course, which opened in 1984. The Phantom/Eagle combination measures 7,038 yards, and all configurations are par 72. A practice area with a full-service driving range is available. It features eight target greens that range from 75 to 250 yards. There is also a short game area with a bunker/chipping zone and three putting greens. A new clubhouse opened in 2010, offering a bar, restaurant, snack bar, space for special functions, and a patio with course views. Sunrise Vista Golf Course is located at 2841 Kinley Drive, Nellis AFB, Nevada 89191-7100."
"Sunset Park","Nevada","Sunset Park","Located diagonally across Eastern Avenue from McCarran Airport in the southeast part of Las Vegas Valley, Sunset Park is one of the area's largest public recreation facilities. Its interior lake alone covers 14 acres, serving as home to fish and water fowl while providing local residents with a venue for trout fishing year-round as well as remote control boating.  Within Sunset Park are lighted basketball and tennis courts, volleyball sand pits, an 18-hole disc golf course, several baseball and soccer fields, and a public swimming pool. The latter is open from Memorial Day through Labor Day and offers swimming lessons as well as a place to cool down in summer. There is also a large dog park, a well-equipped children's playground, a fitness course, public restrooms, and numerous picnic areas with fixed barbecue grills. Six shaded areas are available for group outing of 100 to 1,000 people. Some feature covered pavilions with electricity and running water as well as picnic tables. Sunset Park is often the location for political rallies, union gatherings, and reunions. It is the site of the annual Renaissance Fair, too, which features three days of jousting, feasting, dog and pig races, music, magic, juggling, shopping, and more in period costume. The address is 2601 East Sunset Road, Las Vegas, Nevada 89120."
"Sunset Stampede at Sam's Town","Nevada","Sunset Stampede at Sam's Town","Located within Sam's Town Hotel & Gambling Hall is a courtyard Atrium that rises ten floors above the ground. It houses a 25,000-square-foot indoor park known as Mystic Falls, landscaped with streams, artificial greenery and replicas of boulders. It also contains a tall waterfall that drops down into a quiet pool, where visitors can take a break from the non-stop gambling action in the adjacent casino.  It is here each evening that an automated sound and light show is performed the Sunset Stampede. Dancing fountain of water shoot eight stories into the air as a laser and light show begins. There are realistic animal sound effects bird calls, coyote howls, and the roar of a giant grizzly while life-size animated wildlife begin to move about, including a wolf, a bear, and a Bighorn sheep. The soundtrack for this unique stampede was recorded by the Indianapolis Philharmonic Orchestra. Each day, free shows are performed at 2pm, 6pm, 8pm, and 10pm. Good views can be had not only from the footpaths that wind through the park, but also from all of the windows of rooms facing the Atrium. The Sunset Stampede at Sam's Town takes place rain or shine. The address is 5111 Boulder Highway, Las Vegas, Nevada 89122. Both valet and free self-parking are available."
"Sunset Station Casino","Nevada","Sunset Station Casino - Henderson, Nevada - Hotel and Casino","Sunset Station Casino is a moderately-sized hotel and casino located in Henderson, Nevada. It prides itself not only on offering a full repertoire of luxurious Las Vegas-style hotel casino options when it comes to entertainment and accommodations, but on doing so at affordable prices that are tough to beat. The grounds cover an area of approximately 98 acres and not only include an extensive gaming area, but also a mall, a number of top notch restaurants, shopping options, and various recreation areas to suit every type of guest under the sun. The gaming area of Sunset Station Casino has been the recipient of a number of awards and accolades including titles for Best Slots and Best Video Poker via the Las Vegas Review-Journal. It covers over 110,000 square feet of space and covers all the bases when it comes to all of today's popular gaming options. Table game lovers will find 52 ready and waiting for them including blackjack, craps, mini-baccarat, and several different types of poker. Slot lovers will find more than 2,400 machines that run the gamut from penny slots to $25 and up high stakes machines. Also available for the entertainment and enjoyment of the patrons are a 300-seat sports book, an 18-seat Keno lounge, and a 542-seat bingo hall that is open every day of the week. Sunset Station Casino also hosts many different acts when it comes to live entertainment at its well-known Club Madrid venue. Concerts cover every genre from country, to jazz, to rock and are hosted weekly. Tickets to all shows are available through the hotel's front desk, rewards centers, and its internal Galleria Mall. Other special events are also often hosted at the Madrid in between concerts, including football parties every Monday night during the season. Dining options are varied and plentiful, ranging from upscale options, to casual sit-down venues, to quick and fun options. Some of the most popular include but are not limited to the following. Capri Italian Ristorante is a beautiful outdoor bistro that offers guests an authentic and delicious taste of Italian cuisine. The Sonoma Cellar is billed as the Valley's finest steakhouse and features such fare as dry aged and hand cut beef, garden fresh salads, fine wines, and sumptuous desserts. The Oyster Bar offers delicious homemade chowders, cioppino, gumbos, and fresh oysters in an elegant but casual setting. Also available are a Hooters, a Coco's and Mexican restaurant known as Viva Salsa. However, there is more to Sunset Station Casino than dining, gaming, and live entertainment. The rooms are affordable, yet still luxurious, featuring cable TV, in-room movies, and wireless internet access. A pool and cabana area is also available to all guests. Those who enjoy shopping will enjoy a visit to the Sunset Station Casino's Galleria Mall where a number of shopping venues can be found and enjoyed including a gift shop where souvenirs can be purchased. Furthermore, the casino is equipped to host meetings, group gatherings, and seminars as well via its 13,000 square feet of meeting space that is flexible enough to accommodate any set of needs from business meetings to wedding receptions. Those who choose to take advantage of this option will have access to amenities like audio-visual services, catering, and high-speed internet connections."
"Superstars of Magic","Nevada","Superstars of Magic","Each Wednesday through Monday at 8:30pm, Steven and Cassandra Best take the stage to dazzle audiences with their unique brand of illusions in an action-packed, high-energy spectacle known as The Superstars of Magic. The couple has performed from the Caribbean to Canada, and their magic show now calls the Vegas Club Hotel and Casino Showroom its home.  Conjuring up all kinds of surprises, from exotic rare birds to a Las Vegas showgirl, the two Bests include comedy, dance, and lavish costumes in their routine. One segment called Interlude has Cassandra's body appear to pass right through Steven's. In another segment, The Exorcist, her head is turned 360 degrees. A third star of the show is Charlie, a white Umbrella Cockatoo that performs an award-winning act called Birds of Paradise. Tickets to Superstars of Magic are priced at $$39.95 plus tax and fees and are available at the Vegas Club box office or the Plaza Players Club Booth. Superstars of Magic can only be seen at the Vegas Club Hotel and Casino Showroom in downtown Las Vegas. The address is 18 Fremont Street, Las Vegas, Nevada 89101. There are no age restrictions on who can attend."
"Tahiti Village, Las Vegas","Nevada","Tahiti Village, Las Vegas","Even though the Tahiti Village Resort is right on the Strip guests feel as though they are miles away when it is time to relax. Visitors to Las Vegas want to be able to be where the action is and find a restful atmosphere and that is what the Tahiti Village provides. Guests just have to step off the property and they can be gambling, dining or shopping within minutes. The best entertainment that Las Vegas has to offer is close by. Space and privacy can be found in the Royal Tahitian two bedroom suites. It is fully furnished and comes with a washer and dryer. There are over 1500 square feet to relax in and it can accommodate eight. A sleeper sofa is located in the living room. Granite countertops complement the full kitchen. The master bathroom has a garden tub and separate shower. Double vanities and make up area give everyone plenty of room. There are two TVs; the one in the master suite is a Plasma screen. A balcony is off the living room for relaxing or dining. The one bedroom Bora Bora features the same amenities and sleeps four comfortably. A stay in the Moorea will accommodate four guests, but is smaller than the other one bedroom. There is a kitchenette instead of a full kitchen and no balcony. The pool area has been designed as a tropical oasis in the desert. Palm trees and lounge chairs provide a restful atmosphere. Palapas are placed around the pool for a shady spot to enjoy the amenities of the pool area. A Lazy River takes guests on a leisurely journey around a tropical island. Children of all ages will have a good time cooling off after a day of play on the Las Vegas Strip. The Tiki Gods statues spout water into the river to get the guests refreshingly wet as they pass by. Colorful inner tubes are provided for the guests. A bridge, bamboo poles and a big urn cascade water into the Lazy River pool. A hot tub and exercise room are also part of the amenities. Tahiti Joe's is the name of the restaurant at the Tahiti Village. The hours of operation are from 11:00 am to 11:00 pm every day. The lounge is open twenty four hours a day. The dycor is pure Tahitian and the menu features Tahitian cuisine. Appetizers, salads, pizzas and desserts are all part of the delicious menu at Tahiti Joe's. There is a convenience store called the Wiki Wiki Stop that is open from Sunday through Thursday 7:00 am to 10:00 pm and Friday and Saturday from 7:00 am to 11:00 pm. If a guest needs groceries, beverages, snacks, clothing, sundries, reading material or cigars and cigarettes they can be found here. A coffee bar is within the Wiki Wiki Stop. The Mahana Spa offers massages, facials and body treatments. The availability to get a massage in the room is just a phone call away. The Tahiti Village Resort is located at 7200 Las Vegas Boulevard."
"Tahoe Rim Trail","Nevada","Tahoe Rim Trail","Acclaimed as one of the world's premier trails, the Tahoe Rim Trail covers a 165-mile loop around Lake Tahoe. It was constructed between 1984 and 2001 and includes 49 miles of shared passage with the Pacific Crest National Scenic Trail. Altogether, the trail passes through six counties in two states, California and Nevada. It is part of one state park, three National Forests, and three designated Wilderness areas.  Passing over the ridge tops of the Lake Tahoe Basin, the single-track multiuse trail is primarily for hikers, although 50 percent of it is available to mountain bikes and horseback riding is permitted along its entire length. There are eight trailheads in total, allowing the circuit to be undertaken as a series of day trips of 12~33 miles in length. The longer segments can be accessed from points that are not trailheads, which means a series of 14 day hikes can be taken. Planning, construction, and maintenance of the Tahoe Rim Trail are the responsibility of the Tahoe Rim Trail Association (TRTA), a nonprofit organization formed in 1981. The group is located at 948 Incline Way, Incline Village, Nevada 89451. Guide trainings are conducted by the TRTA as well as trail building projects and organized group hikes."
"Terrible's Sands Regency Casino Hotel","Nevada","Terrible's Sands Regency Casino Hotel","In 2006, Herbst Gaming struck a $148 million deal to buy the Sands Regent in downtown Reno and the new Terrible's Sands Regency Casino Hotel was born. Still referred to more simply as the Sands, the property features two towers, the Regency and the Dynasty, containing more than 800 guest rooms, of which 700 are non-smoking units.  The main attraction at the Sands is its Empress Casino, with 29,000 square feet of gaming space. It offers over 600 gaming machines and 20 table games, plus bingo and live poker. Wagering also takes place at the casino's Pipeline Sports Lounge and Sportsbook, surrounded by 14 large-screen televisions. For dining, the Sands has five restaurants to choose from. The Cabana Café and Mels Diner offer casual meals 24 hours a day. Fuzio Universal Bistro & Steaks is the place for chicken, ribs, and beef, while the new Sands Buffet serves up all-you-can-eat fare daily. There is also one fast food outlet Arby's. Every Friday and Saturday from 9pm to 1am, live entertainment is provided for free in the casino near the Third Street Bar. In summer, there are Rockin' Friday Night Pool Parties, and in the fall the pool area plays host to the NASC Shuffleboard Tournament. The Sands also has a giant Jacuzzi in its Penthouse Health Club on the 17th floor. Exercise equipment, a steam room, a sauna, and massage services are available, too. For event planners, some 12,000 square feet of meeting space can be booked for banquets, conventions, weddings, and meetings of all sizes. Terrible's Sands Regency Casino Hotel is located at 345 North Arlington Avenue, Reno, Nevada 89501."
"Texas Station Casino","Nevada","Texas Station Casino - N. Las Vegas, Nevada - Hotel and Casino","Texas Station Casino is a moderately sized hotel and casino located in Las Vegas, Nevada. It is billed as a venue that offers a full Las Vegas hotel casino experience, but at affordable rates that would be difficult to find on the Strip. Texas Station not only offers hotel accommodations at a great value, but also access to a full gaming area, a number of entertainment options and a varied selection of dining establishments. The gaming area covers a 91,000 square foot area and covers all the bases when it comes to today's popular gaming options. Those who head straight for the slot machines or the video poker machines when they visit a casino will find more than 2,000 different machines ready and waiting. Table game options include all the classics, as well as all the popular variants on the classics. Blackjack, roulette, Pai Gow poker, and craps are just a few of the choices to be found. An 8-table poker room is also available featuring the Omaha and Texas Hold `Em variants of the game in a comfortable sit-down setting. In addition to the main gaming area, Texas Station also features a 486-seat bingo hall that is open every day of the week with bingo sessions running regularly throughout its working hours. A 24-seat keno lounge and a 206-seat racing and sports book round things out to present a comprehensive Vegas gaming experience. The casino also offers a player's club option for frequent visitors that allows them the opportunity to earn perks, privileges, and advantages just for enjoying their gaming experience the way they normally would. Entertainment at Texas Station Casino covers a number of different options as well. Live music is a weekend staple at the casino's South Padre nightclub. There are also a number of bars and lounges that are open 24/7 for the convenience of the patrons including the A-Bar and the Martini Ranch. Texas Star Lanes is the casino's award-winning 60-lane bowling alley. Texas Station is even home to the Regal Cinemas where guests can catch all the latest films when it's time to take a break from gaming. For guests that are traveling with children, there is Texas Station's special Kids Quest area for children aged 6 weeks to 12 years old. This section of the casino includes features such as quiet play zones, access to non-violent video games and CD-ROMs, arts and crafts activities, and an indoor playground complete with tunnels, slides, and ladders. The Kids Quest area is professionally supervised during operational hours by trained staff certified in CPR and first aid, so parents can rest easy knowing they're leaving their children in good hands. Dining venues at Texas Station Casino consist of a number of different options. These include the popular Austin's Steakhouse; San Lorenzo, an elegant venue serving authentic Italian meals; Coco's; Starbucks; the Texas Star Oyster Bar; and the Feast Buffet, an extensive smorgasbord that includes a wide selection of favorites each and every day. Like many hotel casinos, Texas Station is also capable of accommodating guests interested in holding meetings, seminars, or events there in either one of four fully-equipped ballrooms. Those interested in this option should contact the hotel directly for a current rundown of rates and availabilities."
