Name,State,Title,Description
"National Automobile Museum","Nevada","National Automobile Museum, Reno, NV","Reno, Nevada is home to many casinos although it isn't on the same scale as Las Vegas. Where Las Vegas is known as the City that never sleeps'', Reno is called the Biggest little city in the World''. This has a lot to do with the casinos, but Reno has other attributes. The weather isn't quite as hot because it is closer to the Sierras. Reno is in close proximity to Lake Tahoe where all kinds of recreation is available. Besides the casinos and natural beauty there are several attractions for families, vacationers and business travelers. The National Automobile Museum of Reno is a great place to walk through history. Cars have changed since they were first invented and at the Museum visitors can watch this change. They have decorated the museum with streets that reflect the time period of the vehicles. Some of the cars were owned by famous people. A Thomas Flyer, the first American made car to win the New York to Paris race in 1908 is on display. It was a 4 cylinder car with 60 H.P. and cost forty five hundred dollars. There is a Stutz Bearcat that was part of the Indianapolis 500 in the early days of the race. Visitors can see the 1961 Roth's Beatnik Bandit'', a sleek low slung topless two seater. The engine is exposed and the paint is customized. A 1912 Baker Electric V Special Extension Coupe owned by actor Andy Griffith resides at the museum and so does a 1914 Bugatti Type 40A Cabriolet. The familiar Jaguar hood ornament is there on a 1949 XK-120 Roadster. A 1910 Rolls-Royce Silver Ghost Tourer and 1927 Rolls Royce Phantom Cabriolet Deville are among the most desirable of cars. Little known car manufacturers have their classic and unique cars at the museum. Celebrities like Al Jolson, Frank Sinatra and James Dean's personal autos are on display. Frank drove a 1961 Ghia L 6.4 Hardtop. Elvis Presley's 1973 Cadillac Eldorado Custom Coupe with its distinctive hood ornament makes it a very popular car at the museum. The bad boy of film James Dean drove a rather innocuous 1949 Mercury Series 9CM 6 passenger Coupe. The National Automobile Museum is dedicated to helping students learn more about the automobile and the different eras that produced the cars. With this in mind they have school programs that can assist teachers with teaching history, science, social studies, visual arts, math and many other subjects. All of the exhibits reflect the time period of the car. There are also programs for adults and families. There is a gift shop at the museum that is stocked with books for restoring vehicles, cookbooks and books that appeal to children. Clothing items for all ages are available. Car care products of the highest quality can also be found in the gift shop. Even if some guests are not interested in cars they can't help but be fascinated with the various automobiles at the National Automobile Museum."
"Nevada State Museum","Nevada","Nevada State Museum, Carson City, NV","Carson City, Nevada is the State Capitol although it is not one of the largest or centrally located capitols. The city was named after the famed Kit Carson who was a famous scout. John C. Fremont was one of the first Europeans to see this part of the country that was called Eagle Valley by the Washoe Indians. The gold and silver rushes of the Comstock Lode in 1859 helped Carson City become more populated. The Virginia and Truckee Railroad ran tracks from Virginia City to Carson City in the 1860's, making the city easier to reach. However, the Southern Pacific Railroad installed a line through Donner Pass which proved problematic to the city's population in later years. The Nevada State Museum relays the history of the area. It is located at 600 North Carson St. and is open Wednesday through Saturday. The hours of operation are from 8:32 am to 4:30 pm. The museum is closed for Thanksgiving, Christmas and New Year's Day. There is an elevator that allows visitors in wheelchairs access to the museum. Tours are available by request. Admission to the museum is Adults: six dollars, Seniors: four dollars, Children seventeen and under: free. Members of the museum are also free. There is a new entrance to the museum that guests enter through. It is called the Dema Guinn Concourse. The Nevada State Museum regularly changes the exhibits so that it is fresh and new. A Museum Store is where visitors can find books on the State of Nevada, Native American jewelry, t shirts, cards, crafts, Nevada souvenirs and medallions. The medallions are minted on a special coin Press No. 1. The museum also hosts lectures and different shows throughout the year. A schedule of events is at the online site. There are several areas for the exhibits with the Marjorie Russell Center displaying clothing and textiles. The collection has approximately ten thousand artifacts. There is women's clothing that began in the eighteenth century and continues to present day. Children's clothing, hats and ceremonial dress is part of the exhibit as well. The textiles that are displayed include flags and banners. Military uniforms are part of the fashions that help to communicate the history, symbols and economic status of the wearers. This building is also part of an extensive research facility that tells about the technical data of the textiles and clothing. The staff can help provide answers about preserving heirlooms and give them names of textile experts that may be able to help. Student internships are available to students at the University of Nevada. Marjorie Russell was one of the First Ladies of Nevada and the collection houses some of her personal items. Visitors need to schedule an appointment to view the center. Visitors can see the Carson City Mint Building that made coins from 1870 to 1893. They continue on to the geological history area with rock specimens and photos. A Columbian Mammoth that was found in Black Rock Desert has been reconstructed and a Native American exhibit tells of their culture in their own words."
"Nevada State Railroad Museum","Nevada","Nevada State Railroad Museum, Carson City, NV","The railroad played an important part in the development of Carson City, Nevada and was also responsible for its decline. When the Virginian & Truckee Railroad track was built it really opened up Carson City, which is the state capitol. However, when the Southern Pacific Railroad put a line through Donner Pass it went farther north than Carson City so the visitors to the city slowed down considerably. In honor of the railroads roll in Carson City there is a Nevada State Railroad Museum. The museum is located at 2180 S. Carson St. and it is only open Fridays through Mondays. The hours of operation are from 8:30 am to 4:30 pm and it is closed on Christmas and New Year's Day. The admission fee is four dollars for Adults, three dollars for Seniors, with Children and Friends of the Museum free. The museum will offer monthly evening programs so visitors that are interested should call 775-687-6953 for information. There are motor car and steam train's rides available. The 1926 Edwards Motorcar No. 401 runs from 10:00 am to 4:00 pm and generally runs every thirty minutes. The fare for the motorcar is Adults: four dollars, Seniors: three dollars, Friends of the Museum: two dollars, Children (6-11): two dollars and Children under five: free. The steam train keeps the same hours with a special Santa Train in mid December. Volunteers run the museum with some of them being paid to do so and others just for the joy of it. They become engineers of the steam train, are part of the steam train crew, and give tours. Volunteers also sell tickets or work at the museum store. For train enthusiasts there is a HO model railroad at the museum that has been built entirely by the volunteers. It is on permanent exhibit at the Nevada State Railroad Museum. The model railroad shows the progression of the railroad from the beginning days to the twentieth century. Besides showing the technology of the railroad industry it also shows the impact the railroad had on the state, economically speaking. The Friends of the Museum and many other volunteers operate the trains when the museum is open on the weekends. They are also present for any group tours that may be coming to the museum. If there are no volunteers to run the trains they have installed a push button so that visitors to the museum can run the train on demand. There is an opportunity for railroad enthusiasts of all ages to ride in the cab of the Steam train. Only two individuals may ride in the cab at one time and they must be at least six years old. Children must ride with an adult. The cost of the steam train cab ride is twenty five dollars. Guests taking a ride on the 1926 Motorcar travel around the museum grounds for a length of fifteen minutes. The Motorcar is run by diesel power. Anyone that enjoys railroads will find the Nevada State Railroad Museum a great place."
"Nevada Way","Nevada","Nevada Way - Boulder City, Nevada - Main Thoroughfare in a Quiet Town","Located just 20 miles southeast of Las Vegas along U.S. Highway 93 en route to Hoover Dam, Boulder City grew up during the Great Depression. It was founded in 1932 by the U.S. Bureau of Reclamation to house the workers who were building the dam. Ever since, Boulder City has endured as one of only two places in Nevada that prohibit gambling. For several decades, the consumption of alcohol was illegal, too. Without casinos, the town has retained a quaint, small-town atmosphere. In fact, its growth is controlled by municipal ordinance so that it remains a small community. The city didn't add its second traffic light until the spring of 1998. Nevertheless, Boulder City's primary attraction is its proximity to Hoover Dam and Lake Mead, making it a convenient lunch, breakfast, or shopping stop. Most of the town's businesses line Nevada Way, the name given to decommissioned State Road 500 that runs through the downtown. Although not well marked, this road is actually Business Loop U.S. 93 and runs parallel to the highway from the stoplight at Buchanan Boulevard to an exit point on the far east side of town. Where Nevada Way passes Wyoming and Arizona streets, it offers a number of antique stores, several restaurants, a hardware store, and a few art galleries. The Boulder City Chamber of Commerce is located here, as is the main office of the Lake Mead National Recreation Area and the local newspaper."
"New York New York Hotel and Casino, Las Vegas","Nevada","New York New York Hotel and Casino, Las Vegas","The famous New York skyline is visible in Las Vegas with the New York New York Hotel and Casino. A roller coaster snakes its way around the buildings of the hotel. The Empire State Building and the Statue of Liberty watch over all the festivities of Las Vegas. Guests enjoy great accommodations and wonderful restaurants. The hotel is right in the heart of the Strip so shopping, entertainment and gambling is just a walk away. From the Skyline room to the Penthouse Suite the amenities at the New York New York will impress their guests. The regular rooms have a king size bed or two queens, internet access, cable TV, safe, 24 hour room service and rollaway beds if needed. Check in is 3:00 pm and check out is 11:00 am. Choose the Park Avenue Deluxe and guests enjoy marble bathrooms and an iPod dock. The Spa Suite has a king size bed with a corner spa tub in the bedroom. There is also a sitting area in this 500 square foot suite. A Marquis Suite provides 700 square feet of luxury. A marble entry, king size bed and spa tub lead to a sitting area with chaise lounge and a table with two chairs. The Ziggurat Suite is a very comfortable 1,100 square feet of living space. The king size bed, closets for him and her, wet bar for entertaining, dining area for four and a spa tub give guests the relaxation space they are looking for. The bathroom is spacious with an oversized shower, double sinks and separate vanity. The Penthouse Suite is the pinnacle of luxury. They have master bedrooms, flat screen TV's, living and dining areas, spa tub and a wet bar. Complimentary robes and slippers await guests after a day of gambling and shopping. Turn down service is included and a VIP lounge for check in is provided. No one will go hungry when they stay at the New York New York. The American is open 24 hours a day. Irish, Italian, Asian, Mexican and a steakhouse round out the cuisine that can be had from 7:00 am to 3:00 am. Reservations can be made and are recommended at many of the establishments. You can dial the restaurant directly to make a reservation. Entertainment at the New York New York comes in several forms. The dueling pianos are at the Irish Pub and the Cirque du Soleil show Zumanity is open for performances Tues, Wed, Fri, Sat and Sun. Performance times are at 7:30 pm and 10:30 pm. Rok Vegas is a sexy nightclub that is open Wed through Sat from 10:30 pm to 5:00 am. Friday and Saturday nights are for dancing at the Dulce Latin Night at Gonzalez Y Gonzalez. It opens at 11:00 pm. The casino offers all of the latest slots, table games, Keno, Sport and Race Book. A spa is on site, open from 6:30 am to 7:00 pm. Treatments and massages are available along with the fitness center."
"O Spa at TI","Nevada","O Spa at TI","When the Treasure Island resort was sold by MGM Mirage to the Ruffin Companies in 2008, a number of changes were effected, not the least of which was the replacement of the former Wet Spa at TI by a new one designed by Oleksandra Nikolayenko-Ruffin. The facility is now known as the Oleksandra Spa & Salon or simply the O Spa at TI for short.  The O Spa at TI provides guests with a complete menu of body, hair and nail treatments. It also offers access to a fitness room, steam room, sauna, and whirlpool seven days a week, year round. Spa services start at $72 and range up to $550 or more. The salon gives cuts and other professional hair treatments priced at $65~$125 and manicures/pedicures for $35~$115 and up. The O Spa at TI is located inside the hotel at 3300 South Las Vegas Boulevard, Las Vegas, Nevada 89109. Spa facilities are open daily from 8:30am to 7pm; spa and salon services are available from 9am to 7pm; and the operating hours of the fitness facilities are from 6am to 7pm. Guests must be aged 18 years or older. A facilities fee of $27 per day is required or included with treatment; overnight guests of Treasure Island may use the fitness area free of charge."
"Oasis Resort, Casino Golf and Spa, Mesquite, NV","Nevada","Oasis Resort, Casino Golf and Spa, Mesquite, NV","Mesquite, Nevada is just outside of Las Vegas. It is a quieter town for gamblers looking to stay at a resort and casino. The space these casinos have to grow provides more amenities for guests. The Oasis Resort, Casino Golf and Spa has 1000 rooms, four restaurants, and 50,000 square feet of casino space. The outside of the hotel is reminiscent of Aladdin's palace with the towers and blue roofs. The exterior of the hotel is done with adobe style for smooth walls. Inside the hotel the interior is classy. The rooms have comfortable beds with contemporary furniture. Guest rooms provide hair dryers, iron and ironing boards, cable TV, flat screen televisions, and no smoking rooms. Internet is available throughout the hotel casino. Room sizes will vary from double beds to king sized beds. Suites have a maximum occupancy of five people. The rooms have been newly remodeled. Amenities outside the room are extensive. A fitness center next to the spa allows for guests to work out. Banquet facilities, conference rooms, and a gift shop make up a few of the amenities available. The swimming pool is located outdoors with plenty of chairs for lounging. The hotel casino does offer a concierge, express check out, and parking. The conference rooms are available for business travelers, and some rooms can be used for wedding receptions or other conferences. Arcade games are in the game room for children, while parents have the casino. The casino offers table games, poker, slot machines, video poker, and keno. Gamblers can play a variety of games or stick with their favorite option. The table games do have some lower stakes, making it possible for all gamblers to try them out. The slot machines line the walls and floors with various themes. Some of the slots will be progressive while others are not. Oasis Resort and Casino has an indoor bowling alley. This bowling alley is covered in blue lights to make the playing more fun. Children with adults can spend time bowling down the lanes. The casino resort offers packages with bowling to make guests' stay more enjoyable. A nightclub onsite presents evening shows for adult entertainment. Beverages are served at the club. There are four restaurants not including the coffee shop and bar. The Paradise Buffet has an unlimited variety of food. It is open for all three meals serving American and worldly cuisines. Dennys is open twenty four hours a day with breakfast as their main menu. The Tailgaterz Tavern serves wings, pizza and beer for guests. The last restaurant is Charmaines Steak House. Like the name sounds this restaurant is about steak, though seafood is on the menu. It is a fine dining establishment requiring proper dress. Golf is available at the Oasis. The golf course is spread out over several acres providing fast greens and varying fairways. Some water obstacles and trees will be found on the course. Mountains in the background offer more to the course's beauty."
"Orleans Arena","Nevada","Orleans Arena, Las Vegas, Nevada","Sin City has plenty of attractions for visitors including the Orleans Arena in Las Vegas, Nevada. The Orleans Arena has 9,500 seats and is actually situated in Paradise, Nevada. It is the home arena for the Las Vegas Wranglers Ice Hockey team and Las Vegas Gladiators Arena Football Team. Nearby the arena is the Orleans Hotel and Casino. Orleans Arena is on Tropicana Avenue and it opened in 2003. The owners are Coast Casino. Sporting events at the arena include boxing, concerts, ice hockey, basketball, and rodeo. Orleans Arenas has had a number of interesting events including the 2003 boxing fight with Ricardo Mayorga retaining the Ring welterweight championship against Vernon Forest. Zab Judah and Demarcus Corley were also at the Orleans Arena. The first capacity crowd was hosted on October 21, 2003 with the Wranglers and Bakersfield Condors. The Stanley Cup visited the arena in 2005. Other notable events include the NCAA championship in 2006, which was the first one to be connected to a sports book casino. The Las Vegas Gladiators moved to the arena in 2007, but moved on in 2008 to Cleveland Ohio. Mikey Way and Alicia Simmons got married back stage in 2007 at the arena, and lastly the NIAA State Basketball Championship was held in the arena in 2009. From 2003 to present the Orleans Arenas has hosted Van Halen, Akon, Blackeyed Peas, Brooks and Dunn, Panic at the Disco, and Disney on Ice. They have also had the Harlem Globetrotters, Ringling Bros. and Barnum and Bailey Circus, and much more. Las Vegas locals visit the arena several times a year, as do guests from all over the world. There are restrictions on what can be brought into the arena such as no outside food or drink, no professional cameras, audio or video recording, and guests are subject to searches. Tickets to the events at the arena can be purchased online or at the box office. The arena is accessible for all individuals. There are a number of luxury suites on site to cater to businesses or private parties. The suites have 24'' wide leather theater seats, 42'' plasma screen, refrigerator, access to the premier concourse level, and concierge services. Catering services are available at the arena. The food is ready 15 minutes before the door is opened and it will last through the events. They have specific catering menus that guests can choose from. For the holidays there are special events and concerts that arrive. For example each year the Trans Siberian Orchestra comes for one day to play their hard rock Christmas music. Often the Manheim Steamrollers are also at the arena for Christmas, at least when they are touring. Orleans Arena will continue to host a number of different events to keep their patrons happy. The events change based on what groups are touring and who is available to stop at the popular Las Vegas locale. Top artists are often going to make a stop at the Orleans Arena when on tour."
"Palms Place Hotel Spa","Nevada","Palms Place Hotel Spa","The Palms Place Hotel and Spa offers accommodations just a short distance from the famous Las Vegas Strip. The tower provides rooms with nine foot ceilings, plasma televisions, state of the art kitchens and great views of the best Vegas has to offer. Unlike the regular rooms at the Palms Hotel, the Palms Place offers hardwood and marble floors, a private entrance and the ability to reach your room without trudging through the casino. But when you are ready for casino play, the Palms offers it all. The gaming floor features thousands of slot machines, gaming tables featuring blackjack, Pai Gow poker roulette and more. Guests have access to all of the great clubs and dining establishments at the Palms including Rain, Moon, the Playboy Club, Ghostbar, Rojo, the Lounge, Alize, Little Buddha, Blue Agave, the 24/7 Café, Nove Italiano, Gardunos, N9NE Steakhouse, the Bistro Buffet and Simon Restaurant. Other amenities at the hotel include the Amp Salon, the Palms Pool, the Palms Spa, Sunset Tan, the Primp Salon and a variety of shopping opportunities. The Las Vegas Strip is just a short shuttle ride away. The shuttle drops guests off at the Paris/Bally's hotel area, steps from great restaurants like Le Burger Brasserie and the Margaritaville Café. "
"Paris Las Vegas Hotel","Nevada","Paris Las Vegas Hotel","Las Vegas is known for its gambling, shows and luxurious hotels. Shopping lines the Strip from cheap t-shirts to fine couture clothing. Cartier, confectioners and anything else you could want is available on the strip. The Paris Hotel is one of the fine hotels and casinos that offer all the amenities and opulence of a room in the famous city itself. The lobby of the Paris Hotel is reminiscent of a palace. The attention to detail is evident in the paintings on the wall and the woodworking. There are large rooms and suites that fit anyone's budget. They have used elegant fabrics and custom furniture to bring the opulence of Paris to Las Vegas. A luxury guestroom offers a king size bed or two queens, a marble bathroom and distinctive French furnishings. Amenities in every room include a two line phone with a speaker, voice mail, internet access, a data port and videos on demand. A safe for valuables and hair dryer complete the luxury. A sitting area with two chairs and a desk are perfect for relaxing or work. Both the Luxury or Premium rooms have a shower and soaking tub. If more room is needed the suites at the Paris Hotel will supply it. The Le Mans has a couch, chairs and coffee table. The Suite also has a wet bar and refrigerator. Bathrooms in the Le Mans have double sinks, a bathtub and a bidet. A king size bed means plenty of room for sleeping. The Suite Calais has a separate bedroom, his and her bathrooms, whirlpool tub, a wet bar, living room and dining table. This Suite is perfect for entertaining or small business meetings. The Red Room guestrooms take on a modern theme. French Contemporary furnishings and a bright red dycor bring the room to life. There is a 42 inch plasma HDTV, an iHome that has an iPod dock, and an alarm clock radio with stereo. A king size bed resides in the Luxury and Premier rooms. Since these rooms are in the upper floors there are views of the Strip, Eiffel Tower and pool. The casino at Paris replicates a street in Paris with cobblestones and street lamps made of iron. Visitors can actually see the struts of the Eiffel Tower. They offer slots, table games, Keno, poker and race & sports book. Eating at the Paris Hotel offers casual to five star dining. French cuisine is served in the Eiffel Tower restaurant. It sits well above the Strip for a great view and a great meal. An alfresco bistro and Les Artistes Steakhouse complete the sit down dining choices at the Paris Hotel. There are more casual eateries that offer take out service for guests' busy schedules. Attractions at the Paris Hotel include a ride to the top of the Eiffel Tower just like the original, a rooftop pool that encompasses two acres or a spa for relaxing in. There are private cabanas outside for seclusion as well as poolside massages available. The Cafy du Parc offers dining poolside. The pool is open seasonally from 9:00 am to 6:00 pm daily. Visitors can shop at the Bally's-Paris Promenade or Le Boulevard; it offers boutiques, gourmet food shops and much more. There are live shows and lounges for entertainment."
