Name,State,Title,Description
"Fast Lap Indoor Kart Racing, Las Vegas","Nevada","Fast Lap Indoor Kart Racing, Las Vegas","While there is plenty to do at the hotels of Las Vegas visitors sometime like to try something a little unique. Fast Lap Indoor Kart Racing is a fast paced experience. The karts have Honda 200cc engines that allow them to go approximately fifty miles per hour. They are gas powered and maintained to a high standard. Fast Lap holds tournaments where the winning competition is rewarded with gift certificates. The tracks were specially designed by two former IKF racers. They are twenty feet in width and twelve hundred feet in length. This allows for optimum racing and speed. Guests wear protective helmets while in the vehicles. The drivers are on the course for a full ten minutes. Fast Lap Indoor Kart Racing is open seven days a week. The hours are Monday through Saturday from 11:00 am to 11:00 pm. Sunday hours are from 11:00 am to 9:00 pm. The price for walk-ins is twenty five dollars per hour. They also host private parties and pricing differs for everyone's needs. If guests wish to have food at the private party there is catering that can be provided. They can serve full buffets, box lunches, sit down meals or just serve cocktails with hors d'oeuvres. For the safety of all of its patrons Fast Lap has general rules and regulations. Guests must be at least five feet tall. A parent or legal guardian must be present if the patron is under eighteen to sign the waiver. Anyone who races at Fast Lap must sign a full release and waiver of liability in case of injuries. if there are any medical conditions that could pose problems the guest should check with their doctor before driving a Fast Lap Kart. The business has a zero tolerance policy'' and no one will be allowed to drive if alcohol or drug use is suspected. Guests will have to take a breathalyzer test and will not be given a refund or allowed to drive. No contact of Karts is ever acceptable and if given the blue flag a guest must pull over to the right as soon as it is safe to do so. They give patrons one lap in which to do this. Yellow flags mean everyone must slow down and form a single line. Guests may be required to stop if it is deemed necessary. Should a red flag come up everyone must stop as soon as it is safe. When the checkered flag is waving the race has come to an end and guests must head for the pit in a slow manner. Guests must stay within the kart at all times. if a spinout or accident happens a marshal will assist patrons. If a guest receives a warning or penalty for their driving or behavior they can either go to the penalty area or be asked to leave the track. Fast Lap provides a safe, fun atmosphere for everyone and is located at 4288 Polaris Ave in Las Vegas."
"Flamingo Hotel and Casino, Las Vegas","Nevada","Flamingo Hotel and Casino, Las Vegas","The Flamingo Hotel is a landmark in Las Vegas, and even though the original hotel that Bugsy Siegel built has been replaced by the new one it is still a major player in Las Vegas. Located on Las Vegas Boulevard and Flamingo Road this hotel offers a unique place to stay for families, vacationers and business travelers. A Wildlife Habitat and a huge Caribbean water park entice guests to relax and be entertained right on the property. The Deluxe rooms at the Flamingo have a king size bed or two queen size beds. Each room has a desk with a chair and high speed internet access port. The Flamingo Go Room combines contemporary styling with luxurious amenities. There is a white vinyl upholstered ceiling and a mile high headboard. A king size bed offers an ultra soft pillow-top mattress. Three layers of plush linens complete the bed. Deep pile carpet, LED lights in chrome lamps, 42 inch flat screen TV, with another screen built in to the bath room mirror and a comfortable sitting area make these rooms unforgettable. Body jets and Gilchrist & Soames bath products provide relaxation for guests. The Go Rooms have the latest technology with a top of the line sound system, CD/DVD player with iPod, electronic draperies, and wireless internet that allows guests to conduct business or just relax. An enormous pool area greets guests. The pools connect to one another through lagoons and a waterfall. A waterslide is open seasonally for guests' enjoyment. If you don't want to be away from the casino for too long you can participate in the live games poolside. The Beach Club Cafy and Poolside BBQ can take care of hunger pains, and three bars can provide beverages. Private cabanas can be reserved for the day and they have many amenities. An LCD TV, mini fridge and a personal host come included in the price. The pool is open every day in season from 9:00 am to 6:00 pm. The entertainment at the Flamingo is varied and offers well known stars and popular Las Vegas entertainers. X Burlesque is reminiscent of the old Las Vegas shows. They are open nightly in Bugsy's Cabaret. The show begins at 10:00 pm. Comedian George Wallace and Donny and Marie are some of the famous headliners that are part of the Flamingo's entertainment. Nathan Burton is a magician that combines magic and humor. Check at the hotel for times and days of the performances. For guests that like to just relax in the evening there are several bars that can accommodate them. One of the lounges has a view of the Wildlife Habitat. Bugsy's Bar is in the middle of the action on the casino floor and it is open twenty four hours a day. The Garden Bar serves great cocktails while guests look out on the Flamingo waterfalls and lagoon. A spa and fitness center is open from 6:00 am to 8:00 pm daily, providing work outs, massages and spa treatments."
"Flamingo Wedding Chapels","Nevada","Flamingo Wedding Chapels - Las Vegas, Nevada - Hotel Offers Five Wedding Venues","One of the most popular wedding venues in Las Vegas is the Flamingo Las Vegas Hotel & Casino, right in the middle of the famous Las Vegas Strip. Over the years, the property has developed a specialty in planning and arranging nuptials and receptions under the auspices of Harrah's Wedding Services division. The Flamingo Wedding Chapels are comprised of five distinctly different locations. For indoor privacy and a tropical setting, there is the Garden Wedding Chapel. Twelve-foot-high trees and trellised archways mark the Gazebo Chapel, which can host groups of up to 100 guests. Wedding ceremonies can also be conducted at the Crescendo Pool, on the West Lawn, or in front of Paradise Falls. The chapels allow for selection of thoughtfully designed wedding packages - Lavender, Tulip, Rose, and Orchid - each including wedding coordinators, reception planning, flowers, music, photography, and videos. Ceremonies for the renewal of vows and custom weddings can also be arranged. The Flamingo Wedding Chapels are located at the Flamingo Las Vegas Hotel & Casino, 3555 Las Vegas Boulevard South, Las Vegas, Nevada 89109. Office hours are 9am to 7pm on Sunday through Friday and till 9pm on Saturdays. Chapels may be booked outside office hours."
"Flashlight","Nevada","Flashlight - Las Vegas, Nevada - Campus Sculpture Symbolizing UNLV","In 1978, the University of Nevada, Las Vegas commissioned Swedish artist Claes Oldenburg and his Dutch-born partner Coosje van Bruggen to create a work of art that could stand as a symbol of university's educational mission. The result was Flashlight,'' a 38-foot-tall, 10-foot wide masterwork made of steel and painted with non-reflective black polyurethane enamel. Completed in 1981, it stands in the plaza between Judy Bayley Theatre and Artemus W. Ham Concert Hall. From a distance, the four-story sculpture resembles a huge, mid-20th century ribbed, rubberized Rayovac flashlight with its beam facing down into the ground. Closer examination reveals that it is made up of twenty-four fins'' of steel sheet attached to a solid central cylinder to create a distinctive, almost cactus-like profile. Its on/off switch has been said to resemble the silhouette of nearby Sunrise Mountains. To illuminate the sculpture at night and create an intimate atmosphere, a modest ring of hidden lights surround the Flashlight's face. Some say that this symbolizes the hidden light of education in a city that is defined by its excess of artificial neon light. Flashlight can be seen 24/7 on the UNLV campus at 4505 South Maryland Parkway, Las Vegas, Nevada 89154. It was funded through private donations and a grant from the National Endowment for the Arts."
"Fleischmann Planetarium and Science Center","Nevada","Fleischmann Planetarium and Science Center - Reno, Nevada - Indoor Star-Gazing, Movies, and More","Located on the campus of the University of Nevada, Reno, the Fleischmann Planetarium and Science Center was originally built in 1964, when it became the first planetarium to project full-dome movies of weather phenomena. It is listed on the National Register of Historic Buildings. More recently, the facility has become one of the world's first planetariums to utilize the Spitz SciDome digital projector. This high-resolution, state-of-the-art immersive visualization tool produces extraordinarily colorful and bright three-dimensional images. Under the auspices of the Astronomical Society of Nevada, the Center offers public star shows daily in its domed 60-seat theater, plus large-format films and public star observing events. The facility also features a gift shop, a classroom for educational programs, and a gallery space for exhibits that complement the films and star shows. The Fleischmann Planetarium and Science Center is located at the University of Nevada, Reno, MS 272, Reno, Nevada 89557. It hosts some 44,000 visitors a year. Admission tickets are typically $6 for adults aged 14~54, free for those under age 13, and $4 for all others. Several free exhibits and interactive displays can be found on the center's main floor."
"Floyd Lamb Park at Tule Springs","Nevada","Floyd Lamb Park at Tule Springs - Las Vegas, Nevada - Day-Use Recreational Venue for Families","Floyd Lamb Park at Tule Springs, also known as Floyd Lamb State Park, is a day-use recreational area covering 2,040 acres to the northwest of downtown Las Vegas. It was originally established by the City of Las Vegas in 1964 for use as a municipal park, acquired and operated by the state from 1977 onward, and then returned to the city in 2007. The park was named in honor of Nevada State Senator Floyd R. Lamb (1914~2002). Each year, more than 200,000 people visit Floyd Lamb Park at Tule Springs. Its facilities include natural desert terrain, grassy tree covered lawns, four small lakes, picnic areas, barbecue grills, hiking trails, horseback riding and biking paths, restrooms, horseshoe pits, and volleyball courts. Fishing is permitted in all the lakes with a Nevada fishing license, but the catch is limited to three fish per person. Tule Springs was once a self-supporting ranch with alfalfa and cattle. Several of its original wood buildings still exist in the park. Fossil remains have also been unearthed here, including extinct mammoths, horses, camels, bison, and giant sloths. Floyd Lamb Park at Tule Springs is located 20 miles from the Las Vegas Strip at 9200 Tule Springs Road, Las Vegas, Nevada 89131. Visitors should take U.S. Highway 95 north past Ann Road and follow the signs to the park. It is open from 8am to 8pm from May through August and 9am to 5pm the rest of the year. A day-use fee of $6 per vehicle is charged."
"Fortification Hill","Nevada","Fortification Hill - Boulder City, Nevada - Extinct Volcano Overlooking Lake Mead","Located in the Lake Mead National Recreation Area, Fortification Hill is an extinct volcano that has become popular with hikers. It is especially well traveled in the spring, when flowers bloom on the mesa, and in winter when the air is cool and crisp but not too cold. In summer, it can be a challenge owing to the heat as well as the moderately difficult climb. The round-trip trek to the summit of Fortification Hill covers six miles from the trailhead. It starts at an elevation of 2,365 feet and rises to a height of 3,699 feet. From the top, one can see panoramic views of Arizona, Nevada, Lake Mead and Hoover Dam below. Mount Charleston, Las Vegas, and Muddy Mountain can also be made out in the distance. The trail appears to be straight forward, but there are actually a series six hills to negotiate along the way. They range in difficulty from a steep Class 1 to Class 2-3 climbs. Atop the mesa, the trail is easy and flat. Flora here includes mostly low-growing Mojave Desert scrub, such as Creosote Bush, Broom Snakeweed, Burro Brush, and White Bursage. Fortification Hill is about 90 minutes southeast of Las Vegas off U.S. Highway 93 beyond Boulder City on the Arizona side of Hoover Dam. To reach the trail, continue past the dam for 2.5 miles to Route 70, a maintained dirt road that leads northeast 3.5 miles to the trailhead at Kingman Wash past the Paint Pots primitive camping area."
"Forum Shops at Caesar's Palace, Las Vegas","Nevada","Forum Shops at Caesar's Palace, Las Vegas","There are many ways to discover the shops that are at Caesar's Palace. The Forum Shops, Appian Way Shops and Caesar's Luxury Collection Online are the various ways. There are one hundred and twenty shops at Caesar's, which is called the Shopping Wonder of the World. They feature the top designers of the world, from Kate Spade to Louis Vuitton. Jimmy Choo and Valentino have their creations on display at the wonderful shopping area. Besides shopping at the Forum there are at least thirteen restaurants and food shops. An expansion of 175,000 square feet extended the area to Las Vegas Boulevard. It created a pedestrian plaza that is one of the entrances for the Forum Shops. The high arched ceilings are painted blue like the sky. The Roman dycor is complemented with beautiful fountains that remind shoppers of the fountains in Italy. A light show is performed at one of the fountains nightly. This multi level shopping mecca has marble floors and many Roman statues. A huge fish tank is located in the Forum Shops area. Shoppers can visit the Exotic Cars across from the fish tanks. Roman arches lead shoppers from area to area. There are stores that sell accessories such as Anthropologie, Coach, Davante, Michael Kors, Montblanc, Scruples and Pandora. Swarovski Crystal and Swatch are also at the Forum Shops. Cards, books, stationery and gifts can be found at the Essentials at The Forum, Forum Gifts & Sundries, Magnet Maximus and Swarovski Crystal. Children's clothiers are well represented with GapKids, Kids Kastle and Vilebrequin. Toys for kids can be found at FAO Schwarz. Bath products and more are available at Bath & Body Works, Estee Lauder, MAC Cosmetics and Perfumes by Christian Dior. Jewelry for everyone's tastes can be found at Bvlgari, Cartier, De Beers, Harry Winston, Tiffany & Co, Vicci Fine Jewelry and Hyde Park. Clothes from every designer are at the Forum Shops: Armani, BOSS Hugo Boss, Brooks Brothers, Calvin Klein, D & G, DKNY, Dolce & Gabbana, Ermengildo Zegna, Marc Jacobs, Roberto Cavalli, Tommy Bahama and Versace Jeans Couture. Gianni Versace will have a store opening soon in the Forum Shops. Sales are part of the shopping experience at the Forum Shops. Restaurants that feature sit down dining include: BOA Steakhouse, Il Mulino New York, La Salsa, Planet Hollywood, Trevi Italian Restaurant, Joe's Seafood, Prime Steak & Stone Crab plus the Cheesecake Factory. Specialty food can be purchased at Cafy Della Spiga, Fat Tuesday, Vosges Haut- Chocolat and Casa Fuente. When shoppers are tired they can retire to the hotel for a relaxing swim in the pool or play a slot machine or table game at the casino. There are also many restaurants at the hotel that can provide you with twenty four hour dining at the cafy or French cuisine. The Cafy Lago Buffet is an all you can eat dining option as well. If guests have a sweet tooth the place to go is Payard Patisserie & Bistro, where there are delicious chocolates and pastries."
"Four Seasons Hotel Las Vegas","Nevada","Four Seasons Hotel Las Vegas","Hotel's in Las Vegas have a lot to measure up to and if they are not going to offer a casino floor for guests to enjoy, there had better be a lot of other amenities to keep people coming back. The Four Seasons Hotel provides accommodations and access to many of Vegas' best attractions, all with a strip view and the peace and quite of a lobby not filled with slot machines. The hotel has over 400 guest rooms, 86 of which are suites. The hotel is one of the city's smaller hotels, creating a feeling of personalization and intimacy. The hotel is actually located inside of the Mandalay Bay tower, on four floors and accessed by the Four Seasons express elevators. This prime location provides guests with idea views of the mountains, the Strip, the pool, and the Four Seasons and Mandalay Bay gardens. Each of the rooms features 42-inch plasma televisions, work desks, marble bathrooms, and Internet access. Guests have access to the Spa at the Four Seasons where you can relax, unwind, and enjoy services like skin treatments, massages, facials, and anti-aging treatments. There are separate men's and women's spas, as well as a Zen lounge and a eucalyptus steam room. Dining options at the Four Seasons include two different restaurants, as well as a variety of indoor and outdoor lounges. In-room dining is available 24 hours a day. Four Seasons guests can also charge their meals to their rooms at any of Mandalay Bay's 22 different restaurants. "
"Four Seasons Hotel, Las Vegas","Nevada","Four Seasons Hotel, Las Vegas","The Four Seasons in Las Vegas is considered a top brand. The corporation started in the 1960's. Isadore Sharp was a young architect and builder when she started with her father, who decided to build a hotel. During this time three hotels were opened that were meant to be places for guests. Rather than focus on all aspects of running a business the hotels were meant to see to every need of the guest in the best way possible. Over the years the four season brand became recognized around the world. In 2000 the first Four Seasons was opened in Cairo, with a resort in Sharm El Sheikh in 2002. The Las Vegas Four Seasons Hotel is just one of fifty properties. The hotel is everything one comes to recognize about the brand. The rooms are decorated in tan paint, with soft colors for the furniture. Wood furniture is spread throughout the rooms for comfort. There are numerous sized rooms including suites for guests needing a larger space. Rooms even come with kid sized robes as well as adults. The Four Seasons Hotel in Vegas is not a gambling casino. There is a wave pool next door that kids are allowed to enjoy. Instead of a casino the Four Seasons is a hotel for pampering with spas, and a steakhouse. It is also a place for couples to enjoy a bit of romance. The decor inside and out is elegant sophistication designed to please any guest. The Spa at the Four Seasons Hotel is open every day from 8am to 8pm. The spa offers unique treatments for their guests. Hydration for skin, special treatments and even a Zen lounge make up the spa. Men's and women's sides for relaxation exist. There are also eucalyptus steam rooms. There is a main pool on the premises. The pool is beside the heath club. It is outdoors with several places to sit around the pool. The area is filled with palm trees, cabana areas, and potted plants. There are two whirlpools outdoors as well. Meals and smoothies can be obtained at poolside. The pool area is open from 7am to sunset. The pool is 100 feet by 30.5 feet. The depth is 3.5 feet, and it is possible to do laps for those interested. Fitness facilities on the premises offer state of the art work out equipment for both strength and cardiovascular training. Lounges and steam rooms are also on site for guests needing to relax after a workout. Mineral water and chilled towels are supplied. The room is open every day from 6am to 9pm. The Verandah offers both indoor and outdoor seating for meal time. The decor is natural and warm to make dining a pleasant experience. The atmosphere is one of Mediterranean with lush gardens and the pool just outside. The restaurant has two private dining rooms for small parties. Breakfast, lunch, and dinner are served at the restaurant with both adult and children's menus for their guests."
"Fremont Street Experience","Nevada","Fremont Street Experience, Las Vegas, NV","The hotels of Fremont Street are some of the first hotels that were built in Las Vegas. The Fremont Hotel is fifty years old and still going strong. The Golden Gate is one hundred years old and is where visitors can still get a 99 cent shrimp cocktail. Wayne Newton got his start at the Fremont Hotel as did many other famous performers. Freemont Street is the first paved street in downtown Las Vegas; it had the first street light, elevator in a hotel and the first hotel to be designed as a casino. The Freemont Street Experience is much more than a street. There are ten casinos that line the street, but the outdoor VivaVision canopy with its twelve million lights and 550,000 watt sound system is something that draws more than seventeen million visitors a year to the Street''. The images that appear overhead combine with the music to enchant visitors. Shows start at dusk and go on every hour. There is no charge to watch this incredible performance and everyone is welcome. The LED screens are ninety feet above the ground. Underneath the canopy are shopping venues, kiosks and two permanent stages. Over sixty restaurants serve the tourists that visit Freemont Street each year. The Freemont Street Experience encompasses free concerts, special events and many different street performers. This seven block pedestrian mall cost approximately seventy million dollars back in 1995 when it was built. The four block canopy that was opened in 2004 has live action video capabilities. This digital video display system cost seventeen million dollars alone. There are ten high tech computers that operate the spectacle from a climate controlled environment. Hotels that are on Freemont Street are Binion's Gambling Hall and Hotel, California Hotel and Casino, the Fitz Casino and Hotel, Freemont Hotel and Casino, Golden Nugget, Golden Gate Hotel and Casino, Main Street Station, Vegas Club and the Four Queens Hotel and Casino. Many people enjoy the pampering and luxury of these hotels in the Downtown area. Dining is available at any of the hotels on Freemont Street as well as other restaurants in the seven blocks of pedestrian mall. With more than sixty to choose from visitors can get fast food, buffets or gourmet meals at the many offerings. All of the hotels have casinos for the guests and visitors to enjoy. State of the art slot and video slot machines along with table games like Blackjack, Roulette and Craps will be available. Race and Sports Book can be found and Poker rooms for any level of player. After visiting the Freemont Street Experience visitors can go back to the Strip for other outdoor shows. The fountains at the Bellagio are choreographed to all types of music and Treasure Island has a pirate show twice nightly. Stars, magicians and Las Vegas Revues are also part of the entertainment on the Strip and at the hotels on Freemont Street. Everyone can enjoy the outdoor light and music show, but visitors should get there early for a great view."
"Galena Creek Regional Park","Nevada","Galena Creek Regional Park - Reno, Nevada - Venue for Camping, Picnics, and Hiking","Galena Creek Regional Park occupies 440 forested acres on the eastern slope of the Carson Range within the Sierra Nevada Mountains. It takes its name from a creek that traverses the area and divides the park into separate north and south sections. Other water features here include Jones Creek and Marilyn's Pond. Activities available at Galena Creek Regional Park include barbecuing, bird watching, cross-country skiing, fishing, hiking, horseback riding, and picnicking. Among the on-site facilities are horseshoe pits, volleyball courts, an outdoor amphitheater, restrooms, and an old stone visitor's center. There is also a fish hatchery with a gas fireplace, high ceilings, overhead fans, a kitchen, and a serving area. Each year, the park organizes an outdoor education program called Camp WeChMe from May 1 through mid-October. It features campfire activities, ranger-led hikes, exhibits, and overnight accommodations in 12 bunkrooms. Galena Creek Regional Park is located at 18350 Mount Rose Highway, Reno, Nevada 89511. Turning off U.S. Highway 395, it is seven miles from the intersection along State Route 431, aka Mount Rose Highway. There are 24 regular parking spaces and one handicapped space. Operating hours are from 8am to 9pm daily between Memorial Day and Labor Day, with limited hours the rest of the year. No fees are charged for park usage."
