Name,State,Title,Description
"King's North at Myrtle Beach National, Myrtle Beach, South Carolina - a Myrtle Beach Top-Shelf Tradition, Now Redesigned by Arnold Palmer in 1996","South-Carolina","King's North at Myrtle Beach National, Myrtle Beach, South Carolina - a Myrtle Beach Top-Shelf Tradition, Now Redesigned by Arnold Palmer in 1996","Since first opening in 1973, the North Course at Myrtle Beach National was one of the most requested and recognized golf courses in Myrtle Beach for nearly 25 years. Then, in 1996, Arnold Palmer and his Palmer Design Group were asked to return and transform the North Course into something brand new. The redesign started as something quick and dirty,'' but turned into a major renovation that involved $4 million in improvements. While the routing of the course remained the same, the renovations included tearing up the fairways and greens, installing a myriad of new bunkers, and increasing the course length to more than 7,000 yards from the tips. A total of 400,000 cubic yards of dirt was moved, thousands of azaleas were added, along with hundreds of hardwood trees, and lakes, bunkers and greens were all enlarged. The end product transformed the beaten and battered'' traditional style of the former North Course into a semi-modern course laden with bunkers and a mixture of holes, from links-style to contemporary. The front and back nines were also reversed, changing the numbers and order in which the course is played. According to the head golf professional, no two holes on the revamped course are the same, but the layout now calls for a good deal of course management. Proper placement and position in the fairways is essential, or one could end up in a waste bunker, and there are a lot of undulations in the new greens. There are also still a good many dogleg par-4s throughout, which adds to the challenge and shot selection. If played from the forward men's tees, the course is very short at only 5,702 yards. From the middle tees, the course plays to 6,431 yards, which means players who can keep their ball in the fairway and putt with some authority on the slow-rolling Bentgrass greens can score well. The course features a number of noteworthy holes. Hole No. 6, nicknamed The Gambler,'' features an island fairway, which affords golfers the ultimate risk/reward shortcut to the green, or a disastrous adventure should they fail on either of two precise shots that are required. The signature par-3 No. 12 hole (formerly No. 3), still sports an island green and sand traps shaped like South Carolina. During the renovations, the green was enlarged and given a wooden bulkhead for added definition. Hole No. 18, nicknamed The Bull's-Eye'' by GOLF Magazine, now boasts 42 sand bunkers after its redesign. While the traps may not come into play, golfers have described it as intimidating, playing through a sea of sand'' in this fairway, followed by an approach to a green that reaches out into a lake. Since re-opening in 1996, King's North has received even more acclaim. Golf Digest ranked it among America's Top 10 New Upscale Courses, the National Golf Course Owners Association named it South Carolina's Course of the Year in 1997, and hole Nos. 6, 14, 16 and 18 are all featured in the book The 100 Greatest Holes Along the Grand Strand."
"Kings Courtyard Inn","South-Carolina","Kings Courtyard Inn - Charleston, South Carolina - Bed and Breakfast Inn with Meeting and Banquet Facilities","The Kings Courtyard Inn is situated at King Street in Charleston, South Carolina and is approximately 10 miles from Charleston International Airport. There is off street parking available behind the Inn although there is an overnight charge, and motorcycles are not permitted. The property is non smoking throughout and pets are not permitted. The three story property was built in 1853 and has had many uses throughout its history including as high quality shops and private residences. At one time, the upper floors were used as an Inn catering to plantation owners, shipping interests and merchant guests. The building was transformed to an Inn in 1983 and now contains 41 guest rooms and suites. Each bedroom has a TV, wireless internet access, clock radios, hair dryers, irons and ironing boards and a refrigerator. There are various room types to select from, including a Standard with a King Bed or two Queen Beds. The Courtyard King rooms feature a king-sized bed and are situated adjacent to one of the interior courtyards. Deluxe King rooms are larger than the standard sized guest rooms and feature canopied beds, a fireplace and jetted tubs. The Two Room Suites have two rooms separated by a door, with both having their own bathroom and TV and a king bed in one room and a double bed in the other. Parlor Suites are larger and have a living room with fireplace, a bathroom and a bedroom with a king-sized canopied bed There are no restaurants at the Inn but guests do receive a complimentary continental breakfast, which can be eaten in their room, courtyard or breakfast room, or alternatively guests can order a full breakfast from the kitchen. Charleston does have many restaurants near the Inn including Circa 1886, Magnolias, Mistral and The Boathouse. Evening cheese and wine receptions and afternoon or evening sherry and brandy are other complimentary services offered to guests at the Inn. Staying at the inn entitles guests to use the nearby East Shore Athletic Club for a minimal charge. As part of the Charming Inns chain there are group meeting packages available for guests. The Kings Courtyard Inn has several options for meetings, banquets and conferences. The staff can assist with all A/V needs and will serve breakfast, lunch, breaks or afternoon cocktails, hors d'ouevres or dinner as part of the full day and half day meeting packages. There are a couple of courtyards, which can be used for outdoor dinners seating 20 to 30 guests. The Blockade Runner room is the largest at 713 square feet, and can accommodate up to 50 seated guests for a banquet or wedding reception. Many tourist attractions are within walking distance of this hotel including several historic houses, churches and museums. Charleston Waterfront Park is less than a mile away. The South Carolina Aquarium on Charleston harbor is home to 10,000 plants and animals and is also a very popular tourist attraction."
"Kings Mountain National Military Park","South-Carolina","Kings Mountain National Military Park - Blacksburg, SC - Historical Battlefield with Hiking Trails","Located in Blacksburg, South Carolina, Kings Mountain National Military Park lies in both York and Cherokee Counties. Established on March 3, 1931, by an act of Congress, Kings Mountain National Military Park commemorates the Battle of Kings Mountain. The Battle of Kings Mountain took place on October 7, 1780. American Patriots defeated the Loyalist forces led by British Major Patrick Ferguson. This battle was considered one of the turning points of the Revolutionary War in the South. The Battle of Kings Mountain was the first significant Patriot victory to take place after the Continental Army's demise in Camden and Charleston. The Overmountain Victory National Historic Trail ends at the Military Park. The Overmountain Victory National Historic Trail actually commemorates the route that the Patriot forces used to arrive at the Battle of Kings Mountain. The Military Park receives the most visitors in May and October. January and December are the months with the lowest visitation. The Military Park is open weekdays from 9:00am to 5:00pm daily. From Memorial Day to Labor Day, weekend hours are extended to 9:00am-6:00pm. Kings Mountain National Military Park is closed on New Year's Day, Thanksgiving Day, and Christmas Day. There is no cost for admission to the Military Park, but donations are accepted at the Visitor Center. The Visitor Center features a museum exhibit area and a sales outlet. Visitors can also watch a film about the Battle of Kings Mountain. The film is 27 minutes long. The Visitor Center houses a bookstore. The bookstore is located in the lobby and managed by Eastern National. Kings Mountain National Military Park is adjacent to Kings Mountain State Park. The two parks have worked together to establish 16 miles of horse trails and 16 miles of hiking trails. The Military Park is home to Battlefield Trail. Battlefield Trail is a self-guiding trail that loops around the battlefield site. The trail is 1.5 miles long. Ferguson's Cairn, which is where British Major Patrick Ferguson is buried, is located along Battlefield Trail. In addition, Battlefield Trail features wayside exhibits, U.S. Monument Markers, and other markers. Lodging is available in the nearby North Carolinian cities of Gastonia and Kings Mountain. Gaffney, South Carolina, also offers lodging nearby. There is also one designated backcountry campsite within the Military Park. Neighboring Kings Mountain State Park offers visitors a campground with 116 campsites. Those interested in additional information about the campground can call 803-222-3209. In addition to the Military Park's historical value, the Military Park is an ideal location for visitors to observe wildlife, wildflowers, and birds. The National Park Service recommends that visitors plan to spend a minimum of two hours on the grounds in order to fully experience the Visitors Center and Battlefield Trail. School groups and other educational groups should make reservations for their trip to the Military Park at least three weeks in advance. Applications for Special Use Permits require a minimum of four weeks advance notice. Additional information regarding Special Use Permits and reservations can be obtained by calling 864-936-7921."
"Kingston Plantation Condos by Hilton","South-Carolina","Kingston Plantation Condos by Hilton - Myrtle Beach, SC - Fun and Sun","Today, many people, especially families, enjoy staying in condominiums for their vacation. The additional space, along with the home-like qualities, makes a condo a great choice for any size of family. The Kingston Plantation Condos by Hilton in Myrtle Beach, SC offer you that space and convenience, as well as great amenities and easy access to all different kinds of attractions in the Myrtle Beach area. The four awesome oceanfront towers, the Brighton Tower, Margate Tower, North Hampton Tower and South Hampton Tower, all offer you magnificent views that you can enjoy from your private balcony. In addition, you will find that there is a great deal of variety in condo sizes to allow you to find a condo that will fit your family's size and your needs. You can find up to a four bedroom condominium in Kingston Plantation Condos by Hilton to be able to bring along the grandparents as well. Amenities include oceanfront pools, access to fitness centers, wireless Internet, and more. Access to the SPLASH! Waterpark for you and your family is also included to give you something else to do. Other amenities include tennis courts and a 72-par championship golf course right at Kingston Plantation, as well as an on-site restaurant and massages at the Sports and Health Club.  You will find that there is enough to do to keep you and your family occupied and happy. The Splash! Waterpark is exclusive to the Kingston Plantation by Hilton. Whether you stay in the condos or one of the other properties, you will have access to a fun and exciting waterpark that your whole family can enjoy. With water slides, jet sprays, water spouts, and a giant bucket that will spill onto you and your family, you will find this waterpark to be great fun no matter what the age of your children. Also included are two swimming pools, two kiddie pools, and a lazy river, as well as three jacuzzis. All of these features help to make this waterpark great fun. The seasonal activities that are offered during the spring and summer months will add great fun to your vacation as well. From yoga on the beach to kid's night out to arts and crafts to pep rallies and more, there is a great deal to keep you busy around the resort. Some of the activities will cost an additional fee, but they can be well worth the additional cost in fun and enjoyment. Staying at The Kingston Plantation Condos by Hilton will give you a great time, no matter how long you have to stay. Whether you spend all your time at the beach, enjoy the waterpark, or one of the many other activities that are offered, you will have great fun staying at The Kingston Plantation Condos. No matter what the size of your family or what your reason is for visiting Myrtle Beach, you will find that the Kingston Plantation Condos by Hilton will fit your wants and needs for your visit to the area."
"Lake Paul Wallace","South-Carolina","Lake Paul Wallace - Bennettsville, SC - Boating, Swimming, and Fishing","Lake Paul Wallace is a man-made lake with a regulated water level. A walking path separates the fishing side of the lake from the boating and swimming side. Fishing is offered on the west side of the lake. Boating and swimming are offered on the east side of the lake. Lake Paul Wallace is located in Marlboro County in Bennettsville, South Carolina. Lake Paul Wallace can refer to both the actual lake and the Lake Wallace Wildlife Management Area. The area is maintained by the South Carolina Department of Natural Resources. The lake is roughly 600 acres, and the Lake Wallace Wildlife Management Area is consists of about 52 acres that are either on or around the lake. The wildlife area was purchased with federal funds from several different sources. There is no admission charged for access to the lake, and the lake is open daily during daylight hours. The boating and swimming side of the lake features a skiing channel that is one mile long. In addition, there are sunning terraces on the grass and a sandy white beach area by the swimming area. During the summer months of swimming, lifeguards are on duty. The fishing portion of the lake is located across a diversion dike and is stocked with fish. Fishing on the lake does require a valid South Carolina fishing license. Bass are commonly caught on the lake. The water reservoir for Bennettsville is the portion of the lake that lies just north of Beauty Spot Road. The reservoir area is also used as a refuge for waterfowl. Canadian geese, coots, herons, mergansers, and ducks make their home in this area. Swans and American eagles can also be found in the area. Bicyclists, walkers, and runners have three trails to choose from. Crooked Creek Trail is two miles long and parallels the lake. In addition, there is a wooded trail that features different views of the lake. A third trail that is a little over 3 miles long runs across the diversion dike and around the eastern shore of the lake. Sheltered picnic areas are available for group activities. There is one picnic shelter in the beach area. Another picnic shelter is located below the wooded walk on Jacks Island, where visitors may also be able to see some of the ducks that Jacks Island is known for. Dove hunting is permitted in the hunting field next to the lake. Dove hunting is one of the activities that Bennettsville is known for. Additional information regarding dove hunting season, as well as the rules and regulations for dove hunting, can be obtained by calling 843-661-4768. Lake Paul Wallace has also become home to the annual Summer Beach Blast. The Summer Beach Blast was first held in 2002 and is an all-day community event featuring jet skiing, swimming, boating, socializing, and music. The most recent Beach Blast drew between 1,500 and 2,500 people. For additional information on Lake Paul Wallace and the activities offered at the lake, interested parties can call 843-479-5600."
"Landmark Resort","South-Carolina","Landmark Resort - Myrtle Beach, SC - Hotel On The Ocean Front With Water Park And Nearby Golf Courses","The Landmark Resort is a five star hotel located on the south side of Myrtle Beach in South Carolina. The site is easily accessible from Myrtle Beach airport, with a complimentary shuttle service provided by the hotel on request. Free parking is also available at the resort. The hotel contains 160 guest rooms housed on 15 floors, which are serviced by elevators. There are various scales in the rooms available ranging from standard sized rooms and efficiencies with double bed to executive and penthouse suites. The latter features three separate furnished rooms and a king size garden tub. Each room has a private balcony, satellite/cable TV, free wireless internet, in-room safe and hairdryers. An additional resort fee will cover a daily newspaper, local calls and in-room coffee. Smoking rooms are available if required too. Whilst there is no golf course actually on the site of the hotel, it is in close proximity to over 100 championship golf courses and driving ranges. Three different packages are offered to golf enthusiasts, which include lodging, green fees, carts and taxes. A breakfast buffet is also included each morning of the golfing holiday. The hotel boasts an outdoor water park, which includes a wading pool with waterfall, bar jet tunnels, a lap pool, eight foot spa, and a nine-hole putting course by the water park. In addition to this there is an indoor pool, an outdoor pool with seasonal bar and a 300 foot lazy river ride. The hotel provides direct access to the beach with chairs and umbrellas available to rent. The indoor pool has a section for children to play in, whilst outside there are seasonal activities available for kids. There are plenty of amusement parks, miniature golf and water activities offsite to take the children to as well. The hotel also contains an exercise facility, sauna, and arcade and gift shop. There are rooms available for special events too. These can be for meetings, conferences, parties or wedding receptions. The Grand Ballroom can facilitate up to 700 people, with the hotel promising to tailor menus to suit any occasion. There are various dining options at the resort. The Gazebo Restaurant is open for breakfast and dinner, whilst the Pub Lounge offers light snacks and sandwiches. There are also a pizza parlor, snack shop and ice cream shop on site. Guests can also dine in their rooms as all comfortable rooms and efficiencies have refrigerators and microwaves. The penthouse suites have their own kitchen and dining area. Bars and restaurants are also within easy walking distance from the hotel. Reviews left by guests have been somewhat mixed with conflicting stories about the cleanliness of the hotel and the helpfulness of staff. There have also been some issues with cars left in the parking lot being broken in to. However, it appears parents enjoy taking their kids here with many families making more than one return visit."
"Le Grande Cirque","South-Carolina","Le Grande Cirque - Myrtle Beach, South Carolina - Show Featuring Circus Type Stunts and Tricks","Le Grande Cirque is a show staged at the Palace Theater located at Broadway at the Beach in Myrtle Beach, South Carolina and features solo and group trapeze, contortionists, the magical cloud swing, the Strong Men, the incredible Swan Lake ballerina, bungees, bikes, human towers, plate spinners and dancers. There are approximately 600 parking and motor coach spaces on premises. Showtime is at 8pm Monday to Saturday, whilst there are extra shows Wednesday at 10am and 2pm on Thursday. The two hour show features a cast of 50 world champion acrobats and performers from over 15 countries across the world including China, Russia and Monte Carlo, and aims to be the new Cirque Du Soleil. Executive Producer, David King and his team of directors traveled far and wide searching for talent including world champion Chinese acrobats. The amazing tricks performed by some of the world's greatest acrobats and other acts in the show should appeal to people of all ages. The acrobats leap from one huge pole to another getting a grip with their hands, then their legs before sliding down the pole and stopping inches from the ground. Meanwhile a young girl rides a bike around the stage, whilst 13 other performers leap on board. Stunts are performed without the use of wires or nets to keep the audience of the edge of their seats. Many of these performances include stunts never tried elsewhere including the wheel of death, which is 30 foot ball spinning at 60 miles per hour with an acrobat performing stunts inside and out of the wheel. The show even features a dog act with six Russian poodles performing a number of clever tricks. The animal acts always appeal especially to the younger members of the audience. The show features the most famous classical music of the last 100 years, with the addition of a strong pounding beat that helps to drive the show along. Exotic costumes are also huge part of the production with designers apparently very keen to offer their services. Put together the spectacular lighting, costumes and the classical rock music all helps to knit together the foundations of the show. Le Grande Cirque takes its show on tour and has played at theaters across the world to over 10 million people. It broke box office records at the Australian Sydney Opera House in 2008. In Myrtle Beach the show has received good reviews from the local press. The Box Office is located inside the main lobby for ticket purchases and pick-up and is open from 9am to 9pm Monday through Saturday and 9am to 6pm on Sundays, with show and dinner packages available at special rates for groups of 15 or more. School groups are also encouraged to watch the show given it provides an education of different cultures. Children will be afforded the opportunity of a question and answer session involving the Chinese acrobats with the help of an interpreter."
"Leaps-n-Bounce","South-Carolina","Leaps-n-Bounce - Myrtle Beach, South Carolina - Indoor Inflatable Play Center","The Leaps-n-Bounce play center is situated at Holmestown Road in Myrtle Beach, South Carolina. It is approximately a 20 minute drive further south along Highway 17 from Myrtle Beach and Broadway at the Beach and is open all year round from 10am to 8pm Monday to Saturday and 12pm to 6pm on Sundays with no time limits set within these hours for kids to play on each inflatable, and adults get to play for free with child admission. The play center is open for visitors to drop in with their children, birthday parties, field trips and other clubs and has a number of inflatable play areas including some suitable for toddlers under five years of age. This venue is an ideal trip for parents to take their children on a rainy day, as they can spend hours jumping around on any of the five inflatables on site. Parents can supervise whilst sitting in an area with tables and chairs, TV, video games and an assortment of magazines. The children meanwhile can leap around in the 40 foot obstacle course or ride down the 20 foot slide, whilst there are also play areas for the toddlers including a smaller slide. All the staff members have been trained to help supervise group events at the play center including birthday parties. The Party packages include two hours use of the party area and playtime, decorations, a balloon, ice cream and drinks for each child. Packages can cater for parties from as few as eight children to 25, which would involve renting the whole facility for a private party and includes some food such as pizza. Inflatable Rentals are offered too for private House Parties,Church & School Festivals with a number of optionsavailable to customers and the offer of staff to help supervise the activity. Prices vary for each inflatable but the total will include tax, inflatable delivery, set up and collection at the end of the rental period, whilst a discount will be given for customers hiring more than one inflatable. Items for hire include Shark Slide, Toddler Town, Jungle Bouncer, Obstacle Course, Castle Combo, Monster Truck, Princess Castle 5 in 1 Combo, 20 foot Super Slide, Water Slip & Dip, Tee Ball Game and a 30 foot Obstacle Course. Previous visitors to this attraction have rated this highly as it is a great place for children to let off steam for a couple of hours, whilst it is kept very clean and the staff are very friendly. There are a few dining options within approximately five miles of the play center, including Eggs Up Grill, which is the nearest or further towards the coast visitors can try out the Cheesesteak Factory, SeaBlue Tapas Restaurant or Nibils Restaurant. Several golf courses are in the area too if one of the parents wishes to have a round whilst the children are playing at Leaps-n-Bounce, with Indigo Creek and Heron Point being two of the nearest."
