Name,State,Title,Description
"Rainbow Harbor Shopping Center","South-Carolina","Rainbow Harbor Shopping Center - Myrtle Beach, South Carolina - Shopping Center","The Rainbow Harbor Shopping Center is situated at North Kings Highway in Myrtle Beach, South Carolina. It is a shopping complex containing shops, restaurants and office space and is close to the beach. The 6 mile drive from Myrtle Beach International Airport takes approximately 15 minutes. Rainbow Harbor is a complex that has several locally owned shops such as Studio 77, which is a specialty gift shop. This sells a mix of jewelry, handbags, body products and other unique items. A free gift wrapping service is also provided by the vendor. There are a number of wholesale clothing outlets at this location including Coplon's, which sells fashion items by the designer Kate Spade, such as handbags, shoes, jewelry, fragrances and baby items. Femme Fatale sells various clothing items for women and men, including shoes, boots, underwear, swimwear, wigs and other specialty items. The Foxy Lady is a ladies fashion boutique that opened its largest store at Rainbow Harbor in 2000 and features various collections in women's garments, swimwear and other fashion items. Catering for residential and commercial properties, B. Graham Interiors has a 3,000 square foot showroom, drapery fabrication department, and interior design studio. For visitors seeking pictures for the home there is an art gallery called Cheryl M Newby Inc. Meanwhile visitors can also look for shoes and accessories at Cee Jae's Footwear & Accessories, whilst another jewelry store at the shopping center is R-Jordan jewelers. Dining options at the shopping center include The Melting Pot with its menu of fondues from the traditional cheese to vegetable, beef, chicken and seafood varieties, whilst the dessert fondue is chocolate into which you can dip an assortment of fruits and cakes. Here they have a full bar and an extensive wine list. Kitchen Capers specializes in a variety of dinner ware, crockery, cutlery, glass and table linens. This store has been in Myrtle Beach since 1977 and sells many other products ideal for the kitchen. Visitors to Myrtle Beach in the winter months or just missing the sunshine may want to top up their tans at the tanning salon called Fantasy Tan of Myrtle Beach. As a center for businesses as well as shops, there a places to seek financial advice such as MJB Financial Services the Stock Brokerage firm. Visitors looking to make their stay a more permanent one can seek some personal finance and mortgage advice from First Choice Mortgage-equity. There is plenty of accommodation close to the shopping center including Dunes Village Resort, Beach Colony Resort, South Wind On The Ocean, Cherry Tree Inn and Forest Dunes Resort, which are all within half a mile of the Rainbow Harbor. Visitors can also find many other places to eat within half a mile of the shopping center such as Aspen Grill, Ciao! and Carolina Roadhouse. Myrtle Beach has over 100 golf courses with Heather Glen Golf Links and PineHills Palmetto at Myrtlewood Golf Club being two of the closest."
"Residence Inn Charleston Downtown/Riverview","South-Carolina","Residence Inn Charleston Downtown/Riverview","The Residence Inn Charleston Downtown/Riverview offers comfortable accommodations near the best historic attractions in South Carolina. Guests enjoy complimentary hot breakfast each morning of their stay and are treated to an evening social hour Monday through Thursday. The hotel offers a 24-hour market, as well as a fully equipped kitchen in each guest suite. Free high-speed Internet access is available on the property and in each guestroom. Guests also enjoy a wide variety of other amenities including a picnic area with barbecue grills, access to a nearby salon, nearby car rentals, an onsite ATM, daily housekeeping service, coffee served in the lobby, in-room coffee and tea makers, an onsite laundry facility, newspapers in the lobby, safe deposit boxes, valley dry cleaning service, onsite vending machines and toll free calls. The hotel is locate near many of the area's best known attractions including the Palmetto Carriage Works, the South Carolina Aquarium, Folly Beach, the Magnolia Plantation and Gardens, Spirit Line Cruises, the Nathaniel Russell House and the Old Exchange and Provost Dungeon. Several plantations are near the hotel including Middleton Place, Drayton Hall and Boone Hall. Guests will also enjoy trips to Patriots Point Naval and Maritime Museum, Charleston's Pirates and Buccaneers, Fort Sumter National Monument, Ghosts and Legends Walk, the Governor's House Inn and the Historic Homes Walk. "
"Ripley's Aquarium","South-Carolina","Ripley's Aquarium - Myrtle Beach, South Carolina - popular aquarium and tourist attraction in Myrtle Beach","Myrtle Beach is well known for its many golf courses and live shows, but the resort is also home to the most popular attraction in South Carolina - Ripley's Aquarium. The huge state-of-the-art facility, which covers almost 90,000 square feet, offers visitors the chance to observe and learn about some of the world's most well known, fascinating and beautiful sea creatures. The aquarium was opened in the heart of Myrtle Beach in 1997 at a cost of around $40 million. Ripley's followed this success by opening a second aquarium a couple of years later in Gatlinburg, Tennessee. Since their opening, both of the aquariums have been accredited by the Association of Zoos and Aquariums and both have become two of the most visited aquariums in the United States. Ripley's, who are better known for their believe it or not'' themed attractions have gone to great lengths to ensure that the exhibits at the aquarium are educational as well as interesting to all age groups. The facility features not only live marine displays, but also hands-on exhibits and interactive displays in Discovery Center, as well as hourly presentations given by knowledgeable staff members. A rotating program of temporary exhibits ensures that repeat visitors have something new to see. The aquarium has several different themed areas, all of which offer opportunities for viewing the fish from different angles. Ray Bay features rays from different parts of the world, while Rainbow Rock is home to brightly colored fish from the Pacific and Indian Oceans. The Rio Amazon exhibit highlights fish from the Amazon rain forest of South America - including the deadly Piranha fish - while the specialty of the Schooling Fish Tank is fish from US coastal waters. One of the newest exhibits, which opened in early 2009, features over thirty baby fish But the aquarium's biggest attraction is the Dangerous Reef - a 300 foot long moving walkway which takes visitors along a recreation of the ocean floor, while huge sharks swim around and above them. It's about as close as people can get to these dangerous creatures without actually getting wet. The enormous tank, which forms part of the exhibit, holds around 750,000 gallons of water. When the doors of the aquarium close each night, guests can actually stay and sleep among the sea life with the aquarium's extremely popular Sleep with the Sharks'' program, which allows groups of fifteen or more to spend the night. The program includes a self-guided tour of the aquarium, an educational presentation, a scavenger hunt, a late night snack, and other memorable and unique experiences, especially for children. Ripley's Aquarium is located in the Broadway at the Beach Center, just a few short blocks from the beach and close to the resort's several other Ripley's attractions and tourist locations. It is open daily from 9:00 AM until 10:00 PM. Guests should allow at least a couple of hours to visit, although many visitors may well that they need a whole afternoon or even longer to see all of the exhibits."
"Riverbanks Zoo","South-Carolina","Riverbanks Zoo - Columbia, South Carolina - historical zoo with over 3,000 animals","Receiving more than 850,000 visitors each year, Riverbanks Zoo in Columbia, South Carolina is the state's largest gated attraction. The sprawling 170 acres, situated on the Saluda River, houses a large zoo, botanical garden, and aquarium. Since 1973, Riverbanks Zoo has been on the list of National Register of Historic Places and the park itself dates back even further, to the early 1800s. As a top tourist attraction in South Carolina, Riverbanks Zoo has won the Southeastern Tourism Society's Shining Example Award four times and the SC Parks Recreation and Tourism Governor's Cup Award twice. The zoo is also an accredited member of the Association of Zoos and Aquariums (AZA). As one of the leading attractions in the southeast, Riverbanks has an extensive collection of animals and exhibits. More than 3,000 animals call Riverbanks Zoo home. The zoo has one of the largest collections of birds, reptiles, fish, and mammals of any zoo in the region and is constantly adding exhibits, animals, and adventure to its already long list of offerings. One of the more recent additions to the zoo was the inclusion of African elephants, koalas, and gorillas. In 2002 the Birdhouse at Riverbanks Zoo, which features gentoo, rockhopper, and king penguins, opened and was presented with the AZA's Significant Achievement Award. One of the most popular exhibitions at Riverbanks Zoo is the Aquarium Reptile Complex (ARC) that covers 20,000 square feet. The ARC features hundreds of amphibians, reptiles, fish, and invertebrates that are found all over the world. The four galleries of the ARC cover four different regions of the world including the desert, the tropics, the ocean, and South Carolina. It is worth mentioning that the ocean gallery holds a 55,000 gallon Indo-Pacific coral reef tank with moray eels, sharks, and many other Pacific Ocean species. The ocean exhibit features daily diving demonstrations by zoo staff members. The botanical garden at Riverbanks Zoo is something to see. Comprised of 70 acres, it features more than 4,200 species of both native and exotic plants. Visitors may explore the botanical gardens at their own leisure, following the trail system that covers both bottomland and upland forests as well as native wildlife. Visitors can not only enjoy the serene beauty of the lush landscape, but also the natural river views and valley overlooks. Some of the exhibits of the botanical garden include the bog garden, the shade garden, the dry garden, and a treetop bridge. Because farming is such a big part of South Carolina, Riverbanks Zoo also features an exhibit to help children understand what life is like on a farm. Children are permitted to pet and feed llamas, Nubian goats, and Jersey cows. Other animals within the exhibit include turkeys and rabbits. There are also pony rides provided, which may be the favorite of any child that visits this part of the zoo. The Riverbanks Zoo is open daily from 9:00 AM to 5:00 PM, with longer hours during weekends in the summer. Potential guests who are interested in visiting the zoo can learn more by calling (803)779-8717."
"Robert Mills Historic House and Park - Columbia","South-Carolina","Robert Mills Historic House and Park - Columbia, South Carolina Historic Museum, Landmark and Ornamental Gardens","The Robert Mills House is one of only five historic landmarks in the city of Columbia in South Carolina. It is situated in Blanding Street and the house and garden are open to the public every day except Mondays and major holidays. Guided tours are provided at the top of the hour. The house was designed by the house's namesake Robert Mills, who was one of the first native born Americans to become a professional architect. He designed the house for an Englishman Ainsley Hall and his wife Sarah in 1823. Mills rarely worked on private residences and is chiefly remembered for designing the Washington Monument, which wasn't completed until 29 years after Mills' death. Sadly Hall died before the house was completed and after his outdated will was contested, Sarah decided to sell the house. The Presbyterian Synod of South Carolina and Georgia bought the house and established a seminary there until they moved to Georgia in 1927. Following various changes of ownership the house came close to being demolished in the 1960s, but was saved and opened as a house museum by the Historic Foundation of Columbia in 1967. Robert Mills, who was born in South Carolina, was renowned for designing buildings in the Classical Revival style and this house was no exception. He used classical features such as symmetry, a protruding Greek style porch and large Ionic columns at the front of the house. The back is equally as grand with a wide porch and large columns and small arches. There are many historic pieces of art, furniture and photographs collected by the Historic Foundation of Columbia, which are maintained at the house. Some of the furniture on display is from around the early 19th century period when Mills designed the house. The pieces of art and furniture vary in style from American Federal, English Regency and French empire furniture. The historic museum, which was declared a National Historic Landmark in 1973, also boasts a large garden. Under the stewardship of the Presbyterian Synod, the house was used mainly for religious and educational purposes, so no great attention was paid to the grounds. The gardens were landscaped and made very ornamental in the late 1960s to reflect early 19th century inspired English gardens. The ornamental part of the garden features statues, pergolas, formal planting and pathways and has been designated The Founders' Garden''. It was established to complement the style of the house and is being used to emphasize heritage plants and plant conservation and sustainable planting practices. The grounds can be privately hired for special events, but the house is not available for rent. As well as the gardens, the carriage house can be hired for special events, and is also used as a classroom space for educational programs. There are two other buildings flanking the main house. One of these is a library, whilst the other has a museum gift shop for visitors to purchase souvenirs."
"Rock Hill Galleria","South-Carolina","Rock Hill Galleria - Rock Hill, SC - Over 690,000 Square Feet of Shopping Space","Rock Hill Galleria is located at 2301 Dave Lyle Boulevard in Rock Hill, South Carolina. The mall originally opened in 1991. In 2004, major interior renovations were completed. Rock Hill Galleria is considered to be a regional mall and has a gross leasable area of slightly more than 690,000 square feet. The mall features regular inline stores, department stores, kiosks, and pushcarts. Additionally, Rock Hill Galleria features stores in all of the following categories: accessories, bath and beauty, cards and gifts, books, children's apparel, department stores, entertainment, housewares and home, jewelry, men's apparel, music, restaurants and eateries, services, shoes, specialty stores, sport and fitness, technology and electronics, and women's apparel. The mall has space for six anchor stores, although only four are currently occupied. The four anchor stores are: Belk, JC Penney, Sears, and Wal-Mart. In addition to the anchor stores, the mall features several of the top names in retail. Some these top names include: Ayropostale, American Eagle Outfitters, Bath & Body Works, Christopher & Banks, Kay Jewelers, RadioShack, rue21, Victoria's Secret, and Yankee Candle. There are several food and dining options available at the center. Options include a food court, individual restaurants, fast food establishments, and specialty foods. Selections include (but are not limited to): A Slice of Italy, China Cafy, The Cookie Store, and Showmars. Regular mall hours are Monday through Saturday from 10:00am-9:00pm and 12:00pm-6:00pm on Sunday. Anchor store hours vary, and the mall's hours may also change due to holidays or special events. Additional information on the mall and the mall's hours can be obtained by calling the mall directly at 803-324-1711. Restrooms are located next to JC Penney. An ATM is available in the food court. There are several payphones located throughout the mall, and strollers can be rented near the food court. In addition, there is a play area for children. The play area is sponsored by Coca Cola. The Mall Management Office, Security Office, and Customer Service are located at the end of the mall, near Wal-Mart. Rock Hill Galleria also offers a soft seating are, wheelchair service, Ticketmaster service, newspaper vending, and a lost and found. Patrons can sign up to receive e-mail updates. Subscribers receive advance notice regarding seasonal events, new products, and special offers. There is no charge for subscribing to Rock Hill Galleria's e-mail updates, and patrons can unsubscribe at any time. The mall offers companies and groups sponsorship opportunities. Companies can sponsor kids clubs, mall walkers, sampling opportunities, special events, play areas, valet parking, visits from Santa, or visits from the Easter Bunny. The mall is frequently looking for companies and groups that it can partner with in order to add additional services for patrons. Companies or persons interested in events and promotions can contact the Mall Office at 803-324-1711. Rock Hill Galleria offers interested parties the option of proposing events. Event proposals need to include a proposed date and time, as well as a rationale for how the event will benefit the mall, its customers or the community. Additional information on event proposals can be obtained through the mall's website or by calling the Mall Office. The mall also employs security officers to ensure the safety of shoppers. The Security Office can be reached by calling 803-230-2488."
"Rose Hill Plantation State Historical Site","South-Carolina","Rose Hill Plantation State Historical Site - Union, SC - Stately Antebellum","Using the property as a plantation, both Gist and his son grew cotton as a cash crop. After the family died, the mansion fell into disrepair. The site was acquired from the U.S. Forestry Commission by Clyde Franks, a South Carolinian businessman. Over the next eighteen years, the home underwent renovations. Among these renovations were the additions of stucco over the brick, and the addition of porches on the front and rear of the structure. South Carolina named the area a state park in 1960. Currently, Rose Hill Historical Site encompasses roughly 40 acres. Guests can tour the mansion and walk through the rose gardens. There is also a hiking trail that leads down to the Tyger River. Close to the house proper is the Gist family cemetery. Gist, his second wife, and his son, William, are all buried at this cemetery. Local legend maintains that Gist's horse was buried next to him. The mansion is located within a collection of boxwoods, rose gardens, and magnolias that were planted by Gist. The area is enclosed by an iron fence. Several buildings, including the carriage house, are also available for touring. For those interested, there are several ghost stories regarding the site, and odd sightings have been reported on the property. Daily tours of the mansion are conducted every hour from 1:00pm to 4:00pm. Larger groups should call ahead. The tour fee is $4 for adults and $3 for children ages 6-15. The grounds themselves are open every day from 9:00am-6:00pm. A single picnic area is available, and it can be reserved for $35 per day. Weddings and receptions are commonly held on the grounds. Further information can be obtained by calling 864-427-5966."
"Roxanne Towers","South-Carolina","Roxanne Towers - Myrtle Beach, South Carolina - Self Catering Hotel","The Roxanne Towers hotel is located at North Ocean Boulevard in the heart of Myrtle Beach, South Carolina. It is only a ten minute drive away from Myrtle Beach International Airport. Guests can hire a taxi or car from the airport and there is parking available on site and across the street. There are various accommodation types available including a studio apartment with a bathroom, double beds and a balcony. One bedroom guestrooms feature a bathroom, one Murphy bed, kitchen, separate living area and a balcony. Two bedroom guestrooms feature two bathrooms, one large and two double beds, kitchen, separate living area and a balcony. Each guestroom is non smoking and receives a daily maid service. Kitchens are fully equipped with a dishwasher, whilst every suite also contains a washer/dryer. Other features of the units include high speed internet access and complimentary coffee every morning. There are no dining areas in the hotel so if guests don't feel like cooking there are many bars and restaurants nearby. Pier 14, which was originally built in 1926 and survived the wrath of Hurricane Hugo in 1989, is a short walk down the beach and houses the Pier 14 Restaurant and Lounge. Other restaurants nearby include Atlantis Restaurant and Sea Captain's House, which are both in North Ocean Boulevard. Access to the beach is easy from the hotel, whilst recreational activities at the property center on the oceanfront pools available to the guests. During the winter months the hotel has a heated indoor pool, whilst there is also a lazy river ride and an oceanfront hot tub too. With over 100 golf courses in the Myrtle Beach area, the hotel staff will try to help customize a package for groups, to make accommodation available around tee off times. The hotel is within walking distance of The Pavilion Amusement Park, shopping, and restaurants as well as 14th Avenue Pier and Chapin Park. Myrtle Beach also contains two Tanger Shopping Outlets, which are only a short drive away from Roxanne Towers. Visitors can also try their hand at fishing, which is very popular in the area along with various water sports. The hotel is a short distance from Broadway at the Beach, which is a large complex with shops, restaurants, and various attractions. A couple of cinemas are at the site as well as the Palace Theater, whilst there are many other attractions for all the family to enjoy in and around the mall. Restaurants and bars here include Planet Hollywood, Hard Rock Caf,, an Italian Bistro and an Irish Pub with several places also laying on entertainment in the evenings. Of the reviews left by previous visitors to this property, most of them were very positive with people suggesting they would return to this hotel. Comments were made about how clean the property was and the pools were great fun for the children. Some stated that the venue was good value for money as the management ran special offers enticing casual passers by to stay there."
"Royale Palms Condos by Hilton","South-Carolina","Royale Palms Condos by Hilton","Myrtle Beach, SC   This 24-storey condominium is a true representation of luxury and comfort in the South Carolina area. The very entrance to the condominium has been carefully planned, with elegant palm trees to give a sense of loftiness and charm. The overall surrounding is a cause 'for love at first sight', and both indoors and outdoors have been carefully combined to complement each other. Karaoke, aerobics, poolside activities and bingo are some of the many recreational activities that are offered at the Condo. There is no such thing as a vacation in your room at this versatile and truly enchanting place, every detail has been taken care of to ensure that your visit is a memorable and relaxing one. Finding a condo that has all the amenities to meet your needs, such as a kitchen with washer and dryer is a long-shot, but at the Royal Palms Condos, you will feel as if you are at home the very minute you enter your apartment. With such service, there is really no need to call for room service, and if you are with family and friends you can prepare your favorite recipe at your own time and with your own special ingredients. Parents who are on vacations with children who are picky eaters will rest assured that their tiny ones are eating all they should from their favourite cooks! There is also fast speed internet, to attend to the needs of the many that come in and out of their doors on business trips or even those who are technology fanatics. Their one bedroom condos are excellent solutions in corporate housing and for those you are tired of cramped hotel rooms, this is one deal worth thinking over. All one bedroom condos include a coffeemaker, hair dryer, iron and ironing board, and last but not least a mini-refrigerator. Traditional hotels only provided 'sleeping services'. With very little options and initiatives to accommodate the guest, many are now being rivalled with condos like Royal Palm that have managed to offer a deferential in the hospitality sector. The seductive and crystal clear pools are fantastic, and invite all visitors to jump into its waters and enjoy the best and most luxurious that there is to offer. The condominium also offers private patios that overlook the ocean giving a sense of peace and awe. With much talk and concern about having a healthy life, The Sport and Health Club, located at the Kingston Plantation has adopted the trend with sophisticated and up-to-date equipment to answer the calls of the many quests who are looking for active exercise programs while on their vacation or short stay. There are also tennis instructional programs that are offered from the most experienced and highly educated tennis instructors. Parents who intend to take their baby along will be pleased to know that the resort offers baby sitting facilities. A very practical and comforting solution for quests who would like to travel or enjoy a day playing golf or having a massage at the spa, but are unable to do so, because of their little one"
