Name,State,Title,Description
"Devils Fork State Park","South-Carolina","Devils Fork State Park - Salem, SC - Only Public Access Point to Lake Jocassee","Devils Fork State Park is located on the shores of Lake Jocassee, and the Jocassee Gorges Wilderness provides a picturesque backdrop for the park. Located at 161 Holcombe Circle in Salem, South Carolina, the park is in Oconee County. The park sits on about 622 acres of land and provides the only public access to Lake Jocassee. Largely undeveloped and tucked within the Blue Ridge Mountains, Lake Jocassee is a reservoir that consists of 7,500 acres. The Cherokee Foothills National Scenic Highway leads to Devils Fork. The park is part of the SC Department of Parks, Recreation and Tourism (PRT). PRT began leasing the area from Duke Power Company in 1991. Devils Fork State Park's regular hours of operation vary, based on the season. From Late Spring to Mid-Fall, the park is open daily from 7:00am-9:00pm. From Late Fall to Mid-Spring, the park is open Saturday through Thursday from 7:00am to 6:00pm and 7:00am to 8:00pm on Friday. Office hours are kept year round from 8:00am to 5:00pm Monday through Friday. Office hours on weekends are 11:00am-noon and 4:00pm-5:00pm. Admission to the park is $2 for adults and $1.25 for South Carolina seniors. Admission is free for anyone 15 years of age or younger. In part, the park is frequented by boaters, fishermen, families, and scuba divers because Lake Jocassee is not crowded and offers visitors spectacular views of wooded slopes with waterfalls that cascade down into the lake. In addition, Lake Jocassee is South Carolina's only lake to offer both smallmouth bass and trophy trout. The lake is also home to bluegill, black crappie, white bass, brown trout, and rainbow trout. All persons fishing on the lake are required to have a valid South Carolina fishing license. Boat access to the lake is offered via four different boat ramps. Visitors are allowed to swim in Lake Jocassee, but there are no lifeguard or roped off swimming areas. Although Lake Jocassee is one of the main features of Devils Fork State Park, the park also offers a variety of other activities. The park features modern villas and full campgrounds. The park offers both RV camping and tent camping. Reservations for camping can be made by calling 866-345-PARK. Reservations do require a minimum stay of two nights. Campsite rental rates vary based on site selection. The lowest rates offered are for backcountry campsites on the northern shore of the lake. These sites are available for $4-$5 per person per night. All other campsite rentals range from $14 to $20 per site per night. Visitors can rent villas. All villas include heat, air conditioning, linens, coffee makers, screened porches, picnic tables, outdoor grills, microwaves, TVs, and basic cooking and eating utensils. Pets are not allowed in villas or villa areas. Villas are available with either 2 or 3 bedrooms, and there are a total of 20 villas on-site. Villa rental rates range from $84 to $172 per night. Rates depend on the location of the villa, the size of the villa, and the season in which the villa is rented. Visitors can use the hiking trails and nature trails to view of some of the wildlife and plants in the area. Rare Oconee bell spring flowers grown in the park, and peregrine falcons and bald eagles can be seen. The Bear Cove Trail is a hiking trail that is 2 miles long, and the trail mainly runs through a hardwood forest. The Bear Cove Trail is a moderate trail that both begins and ends between the picnic shelters. The Oconee Bell Trail is a loop trail. Only one mile long, this nature trail got its name from the rare wildflowers that are sometimes found along the footpath. The Park Store at Devils Fork State Park offers visitors the ability to purchase firewood, souvenirs, snacks, and limited groceries. The park also features playground equipment and picnic shelters. There are two picnic shelters available for group activities. Shelter rental rates range from $30 to $38 per day, and shelters can be reserved by calling 866-345-PARK."
"Disney's Hilton Head Island Resort - Hilton Head, South Carolina Vacation Rental Accommodation","South-Carolina","Disney's Hilton Head Island Resort - Hilton Head, South Carolina Vacation Rental Accommodation","There are various accomodation options including studios, which can sleep up to four guests and feature a queen-sized bed, double-size sleepr sofa, TV and DVD player and a kitchenette with a microwave, refrigerator, wet bar and a coffee maker. The one bedroom vacation homes also sleep up to four people and have a fully fitted kitchen, king-sized bed, queen-sized sofa in the living room, a whirlpool tub, washer and dryer plus the other amenities found in the studio accomodation. For visitors requiring larger accomodation the two bedroom vacation home's additional bedroom has its own private bathroom and either one queen-size bed and double-size sleeper sofa or two queen-size beds. Set on two levels there is the even larger three bedroom Grand Villa, which can sleep up to 12 guests. Each additional bedroom has a queen-sized bed and private bathroom, whislt there is also a dining room with seating for eight people. The resort does not have a full service restaurant as such, but there are places to get seasonal snacks and drinks at Disney's Beach House, including Signals Snack Bar and the Surfman's Sand Bar with its selection of poolside snacks and drinks. Barbecue grills are located throughout ther resort, or there is Tide Me Over, which has take out options of hamburgers, wraps, sandwiches to name but a few. Adjacent to the resort and just across a walking bridge is Shelter Cove where there are several more restaurants. A shuttle bus transports guests to the Disney Beach House in Palmetto Dunes, which is about a mile-and-a-half away. There guests enjoy a private H-shaped heated swimming pool. A number of water activities are laid on too including kayaking trips, whilst various activities are arranged for children from aged 3 to 12. Families can take part in sing-songs and listen to stories at the Beach House campfire, or take part in a Disney themed game of bingo. There are many other sporting options off site for guests to check out especially for golf enthusiasts as the resort is located in close proximity to many championship courses. Tennis is also very popular in Hilton Head with the famous Palmetto Dunes Tennis Center nearby. Shoppers can travel the short distances to Shelter Cove Harbour, The Mall at Shelter Cove, and Tanger Outlets I and II."
"DoubleTree by Hilton","South-Carolina","DoubleTree by Hilton - Columbia, SC - Hotel Rooms, Suites, and Meeting Space","DoubleTree by Hilton Columbia is located at 2100 Bush River Road in Columbia, South Carolina. The DoubleTree was recognized as a 2009 Expedia Insiders' Select Hotel, which is an accolade received by the top 1% of Expedia's listed resorts and hotels, based on quality and value. The DoubleTree is a smoke-free facility. The hotel features an outdoor pool, a fitness center, high-speed internet access, airport shuttles, and suites. Located only minutes from downtown Columbia, the DoubleTree is just off of Interstate 20. The facility is close to many attractions. Guests have easy access to the University of South Carolina, Riverbanks Zoo, the South Carolina State House, Lake Murray, Lexington County's Tennis Complex, and other local attractions. The DoubleTree facility recently completed a multi-million dollar renovation and offers more than 20,000 square feet of meeting space. Space is available for business meetings, weddings, conferences, family reunions, and a variety of other events. The Conference Center assigns personal planners for events. The personal planner works with the event host through the entire process - from planning through the post-event review. Featuring the Yes I Can!'' program, the Conference Center supplies a complete array of business services that are designed to assist with business events. The Business Center can be accessed 24 hours a day and offers computer access, faxing capabilities, and copying services. Meeting space at the DoubleTree facility features audio and visual services that include a state-of-the-art sound system. Banquet services and banquet menus are available. The Conference Center is home to the Congaree Ballroom, which is Columbia's largest hotel ballroom. The Conference Center has a total of 11 breakout rooms. Rooms vary in size, and capacity is based on event configuration of the room. Rooms range in size from 354 square feet to 11,000 square feet and have a capacity range of 12 to 1,800 people, based on configuration. For additional information about events or hosting events at the Conference Center, interested parties can contact the Director of Sales at 803-731-0300, extension 1047. The hotel has 238 rooms and 35 suites on the premises. Rooms offer free HBO, alarm clocks, coffee makers, hair dryers, ironing boards with irons, in-room safes, voicemail, work desks, ergonomic chairs, wake-up calls, complimentary wireless high-speed internet access, in-room movies, and complimentary newspapers. Cribs are available by request, and some rooms have balconies. Room service is also available, with breakfast being served from 6:30am to 11:00am and all-day fare from 11:00am to midnight. The first floor features pet-friendly hotel rooms. A $25 non-refundable pet fee is required when checking in, and all pets must be registered with the hotel. Guest rooms have either two queen-sized beds or one king-sized bed and include all of the standard amenities above. Suites feature additional amenities like mini refrigerators and sleeper sofas. Suites with two rooms have a second TV, and whirlpool baths are available in select suites. Guests have access to the following services and amenities: baggage storage, express check out, laundry service, complimentary parking, complimentary transportation to Columbia's airport, a sand volleyball court, and a gift shop. The DoubleTree facility features different dining options. Columbo's Italian Eatery and Prime Steaks is an on-site restaurant that is open for breakfast, lunch, and dinner. Guests who simply want coffee or some tea can stop by KC's corner, which is open 6:00am-2:00pm daily. Columbo's Lounge is open from noon to 11:00pm daily and offers another alternative for lunch or dinner. Check in is at 3:00pm, and check out is at noon. For more information regarding the DoubleTree Hotel Columbia and Conference Center, interested parties can call the DoubleTree facility directly at 803-731-0300. To make reservations by phone, interested parties can call 800-395-7046."
"Doubletree Guest Suites Charleston-Historic District","South-Carolina","Doubletree Guest Suites Charleston-Historic District - Charleston, South Carolina - Hotel","The Doubletree Guest Suites are situated on the corner of Church and Market Street in Charleston, South Carolina and adjacent to the Charleston City Market. The hotel is approximately 12 miles or 20 minutes drive from the nearest airport, Charleston International. There are parking spaces available for a fixed daily charge. The 212 guest rooms overlook the hotel courtyard or the city and contain one king-sized bed, with the choice of smoking or non smoking rooms. Each room has amenities such a TV, telephone, internet access, clock radio, coffee maker and ironing facilities. The bathrooms include a shower/tub combination complimentary bath amenities and hair dryer. Each of the suites contains a master bedroom, and a full adjoining living room with a sleeper-sofa. They also feature a topped wet bar with a refrigerator, two televisions, dual phone lines, and wireless internet access. Guests can select a number of combinations for these suites with non smoking rooms having either one double bed, one king bed with two rooms (different sizes), and the smoking rooms having one king with two rooms, two double beds with two rooms or two double beds single room. The hotel also offers accessible accommodations with a king bed or 2 double beds in the master bedroom and a full adjoining living room with a pull out sleeper sofa and dining area. Other features include an elegant granite topped wet bar with a refrigerator. The bathrooms contain a tub or roll-in shower with grab-bars and a granite topped vanity. A number of dining options are available to guests including room service, which is available for breakfast only between 7am and 10am each day. An alternative option for breakfast is the Lighthouse Caf, with its choice of either hot buffet or continental selection. This is open from 7am to 10am each day except Saturday and Sunday when it opens between 7.30am and 11am. Situated next to the hotel is Hank's Seafood Restaurant, which is open daily for dinner from 5pm to 10pm and resembles a Classic Charleston Fish House with an old fashioned saloon-style bar and exhibition raw bar. A short walk through the city market is the Peninsula Grill with a menu including steak and chops, fish and shellfish, champagne and lobster and opens daily between 5.30pm and 10pm. There are many other restaurants and bars within walking distance of the hotel. Meetings, weddings and other special events can be held at the hotel. Up to 350 guests can be seated for a reception in the largest room the Charlestonian Ballroom, whilst there are several other rooms varying in size to meet different needs. Staff can arrange transportation, entertainment, decor, flowers and other personal touches specific to guests' needs and will also arrange free-time activities for groups staying at the hotel. Business travellers can use the meeting rooms and business center. Internet access, audio/visual equipment, video phones, printing and copying services are all services offered here too. Guests can also make use of an on site fitness center."
"Drayton Hall","South-Carolina","Drayton Hall - Charleston, SC - Colonial Architecture in a Spectacular Plantation House","Drayton Hall was built in the early 1700's, and is one of the finest and oldest-surviving examples of Georgian Palladian architecture in the US. Belonging to 7 generations of Drayton's, the house is now owned by the National Trust for Historical Preservation and welcomes thousands of visitors through its doors. Construction of Drayton Hall began in 1738 by 23-year-old John Drayton, who purchased the 350-acre plantation that the house sits upon that same year. The plantation is on the Ashley River, 12 miles from Charlestown and close to John's home of Magnolia Plantation. It was completed just 4 years later in 1742, and to this day remains one of the finest examples of colonial architecture. Since the 1700's it's been home to 7 generations of Drayton's as well as the 7 generations of African American slaves that accompanied them, and has a wealth of history locked behind its doors. In 1974 Charles and Frank Drayton sold the property to the National Trust for Historic Preservation, and the house now stands as a national landmark of Georgian architecture and American colonial history alike. It came to the trust largely un-restored with much of the house remaining the same since it was built, with only minor alterations and restorations being undertaken in its almost 300-year history. The house has been beautifully preserved for future generations to enjoy, along with the acres of gardens that accompany it. It's the only plantation on the Ashley River to remain completely intact, having withstood being used as a staging ground in the Revolution, surviving the great Charleston Earthquake of 1886 even though its epicentre was just a few miles away, and avoiding being flattened by countless hurricanes since its conception. It's quite remarkable to even be standing, let alone to remain largely untouched and remodelled. It more than earns its status as a National Historic Landmark. There are professionally guided tours of the house as well as self-guided tours including maps and DVD's. Exhibitions fill the house, and visitors can also enjoy marsh and river walks, a trip to the artisan-inspired museum shop and a reflective stop at the African American cemetery, where at least 33 former slaves are buried. The house operates on seasonal times, being open from 8:30am to 5pm 1st March - 31st October, and from 9:30am to 4pm 1st November - 28th February. Guided tours operate on the hour every hour, and the last tour each day leaves at half past the hour. Entry fees range from $6 for children to $14 for adults, with children under 6 getting in free. The house and grounds are also available for private functions, corporate events and weddings, and can provide the perfect backdrop to any special occasion. After the site is closed to the general public it's all yours, and staff can help you to create the perfect moment. The Hall can only accommodate a limited number of special events per year, so make sure to book ahead to avoid disappointment."
"Dunes Village Resort","South-Carolina","Dunes Village Resort - Myrtle Beach, South Carolina - Oceanfront Property with Indoor Water Parks","The Dunes Village Resort is situated at North Ocean Boulevard in Myrtle Beach, South Carolina. It is approximately six miles from the nearest airport at Myrtle Beach. The resort is located in the residential north end of Myrtle Beach consisting of two 14-story hotels with direct access to the beach, and guests must be 21 or older to check in, whilst no pets are allowed. Accommodation includes oceanfront studios, one bedroom suites, two, three, and four-bedroom condos and an oceanfront cabana. The studios feature 1 king bed, sofa sleeper, 2 TV's, DVD player, dining area, kitchenette, dressing area, a bath and a balcony. The suites offer 2 queen beds or 1 king bed, 2 TVs, DVD player, Jacuzzi bath, full kitchen, dining area, living room with a wall bed and a sofa sleeper, washer and dryer and balcony. The two bedroom condos feature king and 2 queen beds, 3 TVs, DVD player, 2 baths including one with a Jacuzzi, full kitchen, dining area, living room with sofa sleeper, washer and dryer, and balcony. Three bedroom condos contain similar amenities with the addition of an extra bath, TV and two more queen beds. Similarly the four bedroom condos have extra items with a total of six queen beds, five TVs and four baths, two of which have Jacuzzis. On site there are a number of dining options available to guests including the Admiral's Room Restaurant, which offers a full breakfast buffet. Captain's Caf, is open for lunch and dinner either inside or out on the pool deck and specializes in seafood, whilst the lounge is in the caf, serving beverages. Drinks and snacks are also served at the Cabana Tiki Bar or for light breakfasts, juices and coffees there is Seattle's Best Coffee Shop. The resort boasts several recreational facilities with the most popular being the two indoor water parks, which are a combined total of 30,000 square feet. These feature a 250 foot lazy river with lagoon, lap pool, five spa tubs, two adult sized water slides, and numerous water activities such as water volleyball. A spa tub, lazy river, and additional pools are located on two large outdoor patios with lounge chairs. As well as these attractions kids can also be entertained by the Silly Submarine, the Kiddie Adventure pool with water squirting elephants and another children's pool, whilst the resort also offers seasonal supervised children's activities that include pool games, arts and crafts, and treasure hunts Golf packages can be arranged by the resort golf department, who are able to get preferred rates and pass savings by combining the room with a tee off time. Fishing is very popular in the area with opportunities to fish from one of the seven piers along the coastline, or to charter a boat for a spot of deep sea fishing. Myrtle Beach has many other attractions including two large complexes, Barefoot Landing and Broadway at the Beach, which contain shops, bars, restaurants and many other attractions."
"Dutch Square","South-Carolina","Dutch Square - Columbia, SC - 62+ Stores and an AMC Theater","Located at 421 Bush River Road in Columbia, South Carolina, Dutch Square originally opened in 1970. When the mall first opened, it was advertised as the largest mall in the Carolinas.'' After the loss of several anchors, the mall's management company filed for bankruptcy in 1993. In 1995, the mall was purchased by Phillips Edison & Co. In order to bring tax revenues to the city, the city of Columbia annexed the mall property in 1997. Phillips Edison & Co. then redeveloped the mall and added an additional 18,000 square feet to the facility, which brought total retail space to approximately 600,000 square feet. Dutch Square consists of a single level and features over 62 stores and services. The mall features stores in all of the following categories: accessories, children's apparel, gifts and books, hobbies and amusement, jewelry, major stores, men's apparel, music and electronics, personal services, restaurants, shoes, specialty foods, specialty stores, and women's apparel. The mall has four anchor stores, which are AMC Dutch Square 14, Belk, Burlington Coat Factory, and Office Depot. In addition to the anchor stores, the following is a sampling of the stores offered at the mall: 2Hot, Ashley Stewart, Beauty Line, Catherine's, Claire's Boutique, Cuz Fashion, Dressbarn, Fashion Unlimited, Foot Locker, GameStop, Gold Rush of Columbia, Hibbett Sports, Just Casual, RadioShack, Rainbow Apparel, Treasures, Trendz, Urban Fashion, Wes Bolick Bedrooms, and World Fashion Imports. There are about 2,500 parking spaces available for patron use. Dutch Square's food court offers six options: Chick-Fil-A, China Max, D'Avino's, Piccadilly Cafeteria, Subway, and Super China Buffet. In addition to the food court, Natural Remedies offers specialty foods. For those seeking more variety, Hardee's, Ruby Tuesday, and Schlotzsky's Deli are located outside the mall. AMC Dutch Square 14 offers shoppers the opportunity to watch a movie. Their 14 auditorium theater features digital sound, stadium seating, and handicap access. Listening devices are also available. Matinee tickets are available for movies showing before noon. Child Tickets are available for ages 2-12, and Senior Tickets are available for individuals 60 years of age or older. Regular mall hours are Monday through Saturday from 10:00am-9:00pm and 12:30pm-6:00pm on Sunday. Anchor store hours can vary, and hours may also change due to holidays or special events. Customer Service is located in front of Dressbarn, near Center Court. Customer Service hours are Monday through Thursday from 11:00am-8:00pm, Friday and Saturday from 11:00am-9:00pm, and 12:30pm-6:00pm on Sunday. Gift certificates are available at Customer Service, with increments starting at $10. Gift certificates can be used at all mall stores. In addition to information, Customer Service also offers a coat and package check, copy service, fax service, gift wrapping, stroller rentals, wheelchair rental, safety escorts, and a taxi call service. Notary Public is available by appointment. An ATM is located in front of Burlington Coat Factory. The mall also features meeting rooms that can accommodate up to 80 people. Some food court merchants offer catering services, which can be used for events held in the meeting rooms. For information on meeting rooms, interested parties can call 803-772-3864, which is also the number to Mall Management. Anyone needing to contact Security or Housekeeping can do so by calling 803-772-0838."
