Name,State,Title,Description
"Mount Mansfield","Vermont","Mount Mansfield - Vermont - The Highest Mountain Found in Vermont","Mount Mansfield is the highest mountain in the state of Vermont. From the mountain, the highest point in the town of Underhill, Vermont, 4395-foot peak (1,340 m) above sea level. Your Ridgeline, including some secondary peaks, lies in the town of Stowe. When viewed from the east or west, this mountain looks like a very elongated human profile, with the clear forehead, nose, lips, chin and Adam's apple. These features are most distinct when viewed from the east, unlike most human faces; the chin is the highest point. Mount Mansfield is one of the three points in Vermont, where true alpine tundra survives from the Ice Age. A few acres exist on hump camel and the Mount Abraham near and south, but the Mount Mansfield summit still has about 200 acres. The mountain is used for various recreational and commercial purposes. The Nose is home to the transmitter towers for a number of regional radio stations and television. There are many hiking trails, including the long road, which crosses the main range. In addition, the eastern flank of the mountain is used by the Stowe Mountain Resort for skiing in winter. One of the tourist activities take the toll road (about four miles, steep, mostly unpaved, with several hairpin turns) of the Base Lodge Stowe in The Nose and walk along the ridge or The Chin . In addition to expert trails, a group of famous trails, known as the Front Four are goat, Starr, National and Lift line. Steep areas have many natural hazards (rocks and trees), and little grooming. There are also numerous country skiing trails around the base of the mountain and its lower slopes. Bruce The road descends the east side of the mountain, while the Teardrop way down the west side. Mount Mansfield has four major trails leading to the summit. They range in difficulty from M (moderate) to DDD (very difficult). The long road, a route through the famous Vermont, is classified as M, as is the Haselton Road. It is more difficult Profanity Trail, which is classified as DD (harder) and very difficult Cliff Trail, a DDD. These trails extend to the name of the front peak, an elevation of 3,940 feet, upper lip and lower lip and chin 4395 feet. The chin is the highest point in Vermont. Each peak is usually the name of part of a face that Mount Mansfield resembles when viewed sideways. Marked trails are white and blue fire. The long road has 2 by 6 inches (51 by 152 mm) white burns (formerly red-white-around bull's-eyes loop). All other roads are marked with blue flames. This is a challenging 0.7 miles (1 km) hike to the ridge, which extends through the long path. To reach the trailhead Profanity a long walk in the path of long should be done. The Haselton starts at the base of the gondolas, running into a toll road."
"Mount Snow Resort","Vermont","Mount Snow Resort, West Dover, VT","Visitors to Mount Snow Resort can enjoy skiing and snowboarding on one of the four mountains. Guests can also snow tube if they wish as well as take lessons for skiing and snowboarding. There is lodging right at the slope so guests can be close to the action. Visitors to the area can enjoy four seasons at Mount Snow Resort. There is an eighteen hole golf course, mountain biking, music events and a conference center for wedding receptions or meetings. The mountain can make its own snow in preparation for opening day. Around the Thanksgiving holiday the resort hosts a torchlight parade and fireworks display. There are eighty trails on the mountain with a vertical drop of 1700 feet. There are nineteen lifts to whisk skiers to their destination. Fourteen per cent of the runs are green circles for novice skiers, seventy three per cent are blue squares for intermediate skiers and thirteen per cent are black diamonds for advanced or expert skiers. Once the ski resort opens, the hours midweek are from 9:00 am to 4:00 pm and 8:00 am to 4:00 pm weekends and holidays. The snowmaking coverage at Mount Snow Resort is eighty per cent coverage. They have twelve terrain parks with one mini pipe and one super pipe. The annual snowfall is approximately one hundred and fifty inches. The lifts can move more than thirty thousand people per hour. There is a total of twenty lifts with three high speed quad chairs. They also have one fixed quad, seven triple chairs, four double chairs, one rope tow and four magic carpets. Mount Snow Resort is in Green Mountain National Forest and is twenty nine miles from I-91. A tubing park is located at the Mixing Bowl which is just below the Grand Summit Hotel. This is where the magic carpet lifts are located and on certain evenings guests can use this area at night. Cross country skiers can use several different areas including Timber Creek which is on Route 100. Guided snowmobile tours are available through the Green Mountain National Forest by tour operators. Mount Snow has a two hundred room hotel that they operate. They also have a one hundred room lodge. The larger hotel is the Mount Snow Grand Summit Resort Hotel and Conference Center, the smaller is called Snow Lake Lodge. Besides these two places there are condos, inns, ski lodges and motels in the area. Services at the Mount Snow Grand Resort Hotel include a ski equipment rental and repair shop at the Clock tower Building. They also have guest services, child care, a Medical Center and First Aid building. Mount Snow Ski and Snowboard school is open to all ages and there are ski shops, food establishments and bars. People wishing to improve their skills in competitive skiing can attend the weekend sessions of Competition Development. They can be coached in alpine, freestyle and snowboarding techniques. There is also a boarding school for students in grades nine through twelve that gives students one on one intensive training."
"Mountain Green Ski & Golf Resort","Vermont","Mountain Green Ski & Golf Resort","Those looking for a place to stay close to skiing in Vermont can choose the Mountain Green Ski and Golf Resort. The resort is located at the bottom of Killington Mountain, considered the best ski mountain in the area. The resort offers a variety of amenities, including free shuttle rides to skiing. The resort is open year-round and offers both ski and golf packages, so this can be your getaway destination no matter the season. Guests are invited to golf at the Green Mountain National Golf Course which is just a few minutes down the road from the resort. There are other golf courses in the area and Vermont boasts an astronomical number of courses for such a small state. Guests are also invited to enjoy biking tours of the area, or use the numerous trails for hiking and exploring. Guestrooms are condominium style and range from studio to four-bedroom size. Rooms including wood-burning fireplaces, cable television, DVD players, hair dryers, wireless Internet access, full equipped kitchens and coin operated laundry facilities. There is an onsite health spa that is open during the winter and occasionally in July and August. Guests can make reservations for a few days stay or they can opt for monthly rentals or buying a condominium so they can visit Mountain Green Ski and Golf any time they want. "
"Okemo Mountain is a ski area that was previously home of General Electric Plant","Vermont","Okemo Mountain is a ski area that was previously home of General Electric Plant","Okemo Mountain is a ski resort located in Ludlow, Vermont. The area was originally a mill town and home of General Electric plant until 1977 when it was transformed into a ski destination. Over 600,000 skiers visit the mountain each year and was voted as the top US family snow are by Parents Magazine. The mountain was founded as a ski are when four inches of snow fell in 1956 and two trails were serviced by Poma surface lifts. Four more Pomas were introduced in the early 1960s along with the first chairlift in 1965. The mountain started slope side lodging in 1961 and purchased a groomer, Tucker Sno-Cat model in 1963. The mountain has grown since 1982; facilities have been expanded including chairlifts, new trails, lodges and snowmaking. The base of the mountain is 1,144 feet above sea level and the summit is 3,322 feet, making it the largest vertical drop in Vermont. There are 119 trails across 632 skiable areas with difficulty divided between novice, intermediate and advanced. During the winter a paved road is used as a ski trail, which becomes the longest trail at 4.5 miles. This trail can be driven during the summer with scenic viewing parking spots. Ninety percent of the trail area is covered with manmade snow, making it the highest percentage of snow coverage in the East. The trails built on the mountain have a theme such as Native American names or astronomy-related names at the top of Jackson Gore. The trail names and ratings include easy trails such as Bright Star Basin, Buckhorn, Coleman Brook, Easy Rider and Escape. Most Difficult trails are Black Out, Challenger, Eclipse, Exhibition and Fast Lane. The most difficult trails, which are advised skiers use extreme caution, include Big Bang, Double Diamond, Loose Spruce, Outrage and Rolling Thunder. There are 12 chairlifts, which includes five high-speed detachable quads, four fixed grip quad chairs and three triples. Seven surface lifts, five are carpets; one is a poma, which is located in the beginners area and a t-bar. Lodging is available at the Mountain, located at the base of the South Ridge Quads is Main Base Lodge, Jackson Gore Base Lodge is located at the base of Jackson Gore, Sugar House is located near the base of Northstar Express Quad, Summit Lodge is located at the top of the main mountain. ePic is located at the base of the Solitude area and Solitude Express Quad and includes a full-service restaurant. Skiing on the mountain is available in four areas. The main area includes runs for advanced skiers and includes Searle's Way, Nor'easter, Defiance and The Dew Zone, which is a halfpipe and snowboard park sponsored by Mountain Dew. The second area is Solitude located to the right of the main mountain and offers a 1,100 vertical feet of skiing. Solitude has its own base, accommodation and trailside homes. The trails are for intermediate skiers. To the left of the mountain the South Face area is has the highest peak and faced the sun in the morning. This is the most difficult terrain with most of the double-black diamond trails. This area also has mogul trails. The last area is on the far right, Jackson Gore has its own access road, lodge and ski school along with amenities found at the base lodge. A fifth area is Glades peak, which is the smallest area between main mountain and south face, this area is serviced by one fixed-grip quad. There are areas designated for show shoeing, which range in difficulty. During the summer months the trails can be used for hikers, visitors are also able to enjoy a round of golf, visit the training center or dine at Willie Dunn's Grille, which is open every day during summer and winter for lunch and dinner."
"Okemo Valley Golf Club, Ludlow, Vermont - a Championship, Heathland-Style Golf Course in Vermont's Green Mountains","Vermont","Okemo Valley Golf Club, Ludlow, Vermont - a Championship, Heathland-Style Golf Course in Vermont's Green Mountains","Okemo Valley Golf Club is Vermont's first Heathland-style golf course, and has been said to be unlike any other course in New England. Situated across from Okemo Mountain, the course is hilly and features gently rolling fairways that are wide, generous and filled with rolls, hollows, dips, and ripples. The greens are said to be sweeping, sculpted and well-undulated, rewarding players with a solid short game. The 18-hole, par-70 course plays to 6,500 yards from the longest tees, with a USGA rating of 71.1 and a slope rating of 130 on Bent grass fairways, tees and greens. The course also features fairways framed by golden Fescue grasses, which often wave beneath the mountain breezes that visit the course, strategically placed bunkers, and the stunning backdrop of Vermont's Green Mountains. Since opening in 2002, the course has received numerous accolades and awards, including being named the Best Public Course in Vermont by Golfweek in 2006. Golfweek also ranked it as the Top Modern Club in Vermont, while Golf For Women named it to its Top 50 Courses in America list in 2003. The course has also hosted a qualifier for the U.S. Public Links Championship. Practice and learning facilities at Okemo Valley Golf Club are extensive.  They include 31,000 square feet of Bent grass practice tees that have been laser-leveled to perfection. There's also a dedicated, 120-yard pitching range, as well as seven target greens, and 11 greenside and fairway practice bunkers to replicate just about any shot golfers might encounter on the course. All together, those facilities are part of the 18-acre Outdoor Learning Center. In addition, the course also offers an Indoor Golf Training Center with a 6,000-square-foot practice area that includes a large putting green, three swing stations, a full-swing virtual golf program, two classrooms, a science lab, and private lockers. Okemo Valley Golf Club also features a 9,200-square-foot clubhouse with a golf pro shop, locker rooms and Willie Dunn's Grille, a 120-seat restaurant and lounge."
"Pico Peak","Vermont","Pico Peak, Rutland, VT","Pico Peak is part of the Green Mountain's Coolidge Range in Vermont. The elevation of Pico Peak in Rutland, Vermont is 3,957 feet. This makes it a good choice for hiking and winter skiing. There is a maintained hiking trail to the summit of Pico Peak. This peak is considered to be the second highest peak. Killington Peak is the first highest. Hikers that look to the south will see Rams Head and to the north they will find Deer Leap Mountain. This peak is across Sherburne Pass. The mountain that holds the name Pico Peak is shaped like a cone. Water that is shed from the summit of Pico Peak makes its way to Long Island Sound in Connecticut from the northeast side and into Lake Champlain from the northwest side. Eventually the water from this side gets into the Saint Lawrence River then on to the Gulf of Saint Lawrence in Quebec. In 1910 this peak and one thousand acres was given to Mortimer Proctor as a birthday gift. He decided to sell the land in 1948 to a ski company called Pico Ski Inc. Pico first opened in 1937 and is credited with having the first T-bar ski lift in the United States in 1940. Pico Mountain ski area is part of the Killington Ski Resort today. The lodge on the northwest side is on Route 4. There is an Alpine Slide that is used for recreation during the summer months on Pico Peak, but skiing is the big winter time draw. There are fifty total trails on the mountain for skiing. Twenty are easy, forty eight are intermediate and thirty two advanced or expert. Six chair lifts take skiers to the runs, two are double lifts, two are triple chairs and two are quad lifts. They have the capability to make snow and they receive an annual snowfall of approximately two hundred and fifty inches. Lift ticket rates are fifty two dollars for adults at any time, thirty nine dollars for juniors at any time and seniors are fifty two dollars at any time. Lodging is available and some are even close enough to walk or ski to the slopes. The Pico Resort Hotel and Condominiums is one of the places that you can ski in and ski out. Guests of the hotel get to use the Pico Sports Center for free. They have a seventy five foot indoor pool, hot tub, fitness area with weights and cardio machines and a Sauna. Guests that wish to ski at Killington can take the free shuttle or the evening shuttle to entertainment. The Vermont Inn has sixteen rooms, a restaurant, fitness center, sauna, and outdoor hot tub. The Red Clover Inn has a restaurant, food, wine and fourteen guest rooms and the last offering is Cascades Lodge with great views, a walk to the slopes, restaurant, pub, indoor pool, hot tub and sauna. Skiers in the area can enjoy all the amenities that the different hotels provide."
"Pointe at Castle Hill Resort & Spa","Vermont","Pointe at Castle Hill Resort & Spa","The Pointe at Castle Hill Resort & Spa is located in the heart of Ludlow, Vermont, a trendy hotel that is a historical treasure in its own right. In fact, the carriage house in which the hotel is located is part of a greater historical district that many visitors love to explore.  The hotel has a mere twenty guest rooms, situated on three floors. It is recognized as one of the small, but exceedingly luxurious hotels found across the world. Fully equipped with on-site parking, a concierge, a health club, a spa, wireless Internet, a conference center and a health club, the hotel's exclusivity is not only reflected in its five star rates, but high end decor and well-trained staff. Visitors enjoy high end, silver service dining in its restaurant. It has a fully fitted bar and complete access to all of its facilities for wheelchairs and the disabled. Most importantly, the hotel has a country club type atmosphere that is both romantic and family orientated. With scenic views from its outdoor dining room, visitors can enjoy the lights of the city, whilst knowing that their every need is taken care of. They even provide high chairs and booster seats for kids. The Pointe at Castle Hill Resort & Spa is a boutique hotel catering to guests in a luxurious environment. Every creature comfort has been accounted for, even with its 1pm check in time."
"Rock of Ages","Vermont","Rock of Ages","Rock of Ages in Barre, Vermont is located in the granite capital of the world and offers tours of the amazing rock quarry. Visitors get to tour an active granite quarry that is nearly 600 feet deep. Tours are narrated and provided via shuttle where guests can watch artisans working in the factory polishing and sculpting the world renowned Barre granite.   The factory is available for self-guided tours of the artisans Monday through Friday from 8:00 am to 3:30 pm. The factory is closed all holidays and associated days; e.g., the factory is closed Thanksgiving and the Friday thereafter. The factory is generally also closed the first two weeks of January. Admission to the quarry is free. An onsite visitor's center is open to visitors and offers a video display, exhibits, and large gift shop full of souvenirs and information about the quarry. An outdoor granite bowling lane was constructed for guests to take part in playing. The bowling lane is open from Mid-May through late October. Other area locations situated nearby include the Hope Cemetery, the Millstone Hill Touring and Recreation Center, New England Cooks, Bragg Farm Sugar House, Covered Bridges, and much more. Vermont offers a wide range of dining and lodging options near the Rock of Ages."
"Shelburne Museum showcases diverse and unconventional art","Vermont","Shelburne Museum showcases diverse and unconventional art","Shelburne Museum is located in the scenic Lake Champlain valley in Vermont. The museum showcases the finest, most diverse and unconventional art and Americana in the nation. There are over 150,000 works exhibited in 39 buildings, 25 of these are historic buildings that were relocated to the grounds of the museum. Works of art at the museum include impressionist painting, folk art, quilts, decorative arts, furniture, American paintings and artifacts from the 17th to 20th century. The museum was founded in 1947 by Electra Havemeyer Webb who was a pioneering collector of American Folk Art with an independent eye and passion for art. The museum is able to host events and meetings in their eclectic, historic buildings. The museum is able to host up to 250 guests. Travelling exhibits have included Constructed Landscapes by Ansel Adams and Edward Burtynsky, these works are photographs of the American wilderness. Alzheimer's: Forgetting Piece by piece is a tribute to victims of Alzheimer's. Circus Day in America celebrates the American circus from 1870-1950. Permanent exhibits include American Paintings from the 19th and 20th century, Impressionist Paintings by artists such as Money, Degas and Cassatt, Folk Art, Historic Houses from 1790 to 1950, Decorative Arts such as glass, pewter, ceramics and food molds. Steamboat Ticonderoga is a 1906 passenger steamboat, which is also a National Historic Landmark, Quilts, Hooked Rugs and Textiles include over 400 quilts and 300 hooked rugs, Decoys of wildflower and fish from the 19th and 20th century. A 225 horse-drawn carriage, wagons and sleighs from the 19th century, tools used for woodworking, blacksmithing and harness making tools and Toys, Dolls, Dollhouses and Automata, which has over 400 unique dolls on display. The Buildings at the museum include the 1950 House, which is a vignette of a young families home, Beach Gallery and Beach Lodge features big game trophies, the Blacksmith shop is an early 19th century shop with demonstrations held daily. The Circus Building and Carousel includes a hand-carved miniature circus parade, the Covered Bridge is a rare two-lane span with footpath. Dorset House has world-renowned wildlife and fish decoys. Dutton House is a historic house from the 1820s. Electra Havemeyer Webb Memorial Building includes Impressionist paintings and six rooms from Ms. Havemeyer's New York Home. A general store is also located within the museum that includes a barber, tap room, doctor, dentist and doctor's office. Other buildings include the 19th Century jail, lighthouse and meeting house. Grounds and Gardens include the Circus Building Day Lily Garden, J. Watson Webb Jr. Memorial Peony Garden, Alyssa's Garden with perennials, a playground and 19th century games. Bostwick Memorial Garden is designed to evoke a painter's color palette, The Pauline Cropper Mallory Heritage Garden at Dutton House, Hat and Fragrance Garden and Lilacs. Demonstrations held at the museum include weaving, letterpress printing and blacksmith demonstrations along with walking tours of specific exhibits and talks on subjects included at the museum. Families visiting the museum should visit Owl Cottage Family Activity Center, which is a craft and activity center for children and their families, these activities include a reading area, workroom, play area, games, puzzles and a costume area."
"Shelburne Museum, VT","Vermont","Shelburne Museum, VT","The features that are in the Shelburne Museum were inspired by a woman named Electra Havemeyer Webb. She and her husband owned The Brick House which was given to them as a wedding present. The home has splendid views of the Adirondack Mountains and Lake Champlain. It has forty rooms and is a mere two miles from the museum. Mrs. Webb showcased her art work, textiles, furnishings and other home d,cor in a most unusual manner for the time period and it was visited by many famous people because of it. Many of the decorating schemes and exhibition themes were displayed in the Shelburne Museum beginning in the late 1940's. There are tours of the home so visitors to the Shelburne Museum can take advantage of it. The museum is open from May through October. The hours are 10:00 am to 5:00 pm and Thursday evenings until 7:30 pm in June, July and August. The price of admission is twenty dollars for adults, teachers and students over eighteen are eighteen dollars, children 5-18 are ten dollars and children under five are free. Vermont residents are ten dollars for adults and five dollars for children older than five. Museum members are allowed into the museum for free. A family pass that includes two adults and their children ages 5-18 will pay fifty dollars. The admission price is cut in half after 3:00 pm except on Thursdays. Visitors can reach the museum from I-89 in Vermont, take Exit 13 and go south on Route 7. The museum is seven miles from the town of Burlington, Vermont. Upcoming exhibits include Ansel Adams and Edward Burtynsky: Constructed Landscapes, Alzheimer's: Forgetting Piece by Piece and Circus Day in America. Families are welcome at the Shelburne Museum with many special activities planned. The Owl Cottage Family Activity Center features a craft and activity center where everyone can read, work on arts and crafts, play with toys, games, puzzles and dress up in costumes. There is a 1920's carousel that is close to the museum entrance for families to ride on. Circus music is one of the highlights of this delightful ride. A nineteenth century garden has a playground for children located adjacent to the Vergennes School house. The museum holds daily demonstrations during their season. These demonstrations are of trades that would have been used in the eighteenth and nineteenth century in New England. Visitors can see a weaver, printing demonstration and blacksmithing in the Blacksmith Shop. There are also walking tours of the Ticonderoga twice a day from Mid June through Mid August. Some of the collections that can be seen at the Shelburne Museum include: Miniature Circus figures and Circus Posters, American Paintings, Impressionist Paintings by Monet, Manet, Degas, Cassatt and others, Folk Art, Historic House interiors from 1790 to 1950, Decorative Arts, a 1906 passenger steamboat, The Ticonderoga, Quilts, Hooked Rugs and Textiles, Decoys, Carriages and Sleighs with more than two hundred on display, tools and more than four hundred antique dolls along with other toys. There is a caf, on the museum ground that is open the same hours as the museum."
